https://www.instagram.com/gyleasure/,gyleasure,96,087878185195,"b'gyleasure food studio Dessert Shopyour (uilt) (P) DM/WA us to order!087878185195always open for orders!all made by order! (2-3days), '"
https://www.instagram.com/jojosbakeology/,jojosbakeology,64,6287782385081,"b""JoJo's Bakeology100% HomemadeOnly Natural IngredientsKelapa GadingJakarta BaratFor Order & Inquiries:DMWA: +6287782385081Phone: +6287787240341wa.me/6287782385081"""
https://www.instagram.com/madooindonesia/,madooindonesia,128,6287817179000,"b'UNVEILING WILDERNESSRaw Forest Honey from Indonesia.Madu Hutan Mentah dari Indonesia..Pure, Wild, & Balinese.Bermanfaat dan Berkhasiat.CS Hotline : +62 878 1717 9000m.tokopedia.com/madoo'"
https://www.instagram.com/lulusky.id/,lulusky.id,140,081250003551,"b'LuluSkyThe Energy Building, Lt MezzanineSCBD, jl. Jend. Sudirman kav 52-53-WA 0812-5000-3551Monday - Friday8AM - 6 PM'"
https://www.instagram.com/ngohiangomarini/,ngohiangomarini,58,081284388052,b'Ngohiang Oma RiniThe Best Ngohiang in Town Made with Fresh MeatHalal Non halal Best Quality ~ No Preservatives ~ No MSGGo-Send Only  WA : 0812-8438805bit.ly/2WK4M8S'
https://www.instagram.com/makeu688/,makeu688,54,6281341591203,b'makeup kekinianShopping & RetailTas kekinian murahOrder Owner : @dwinabilah03api.whatsapp.com/send?phone=6281341591203'
https://www.instagram.com/kolkalday_/,kolkalday_,170,081284196789,"b""Kolkalday_Made with love for ur body's health100% tanpa pemanis dan pengawet buatanBy PreorderDepok,ID0812-8419-6789 (WA Only)"""
https://www.instagram.com/enklaserpong.id/,enklaserpong.id,379,6281292123322,"b'enklaserpong.id Akupunktur (Health & Beauty ) Facial,Slimming #enklabeauty Vitamin InjectionOPEN : Senin - Sabtu ( 09.00 - 19.00 )Reservation wa.me/6281292123322'"
https://www.instagram.com/dafagiantara/,dafagiantara,503,081358120424,"b'Mas DafaPRANATA ADICARAMc Manten adat JawaResepsi Temu MantenNgunduh MantuSiramanMidodareniTlp,SMS,WA0813-5812-0424klikchek Videonyayoutu.be/yvzkzdoZEC0'"
https://www.instagram.com/diyansi_/,diyansi_,444,081291474361,b'diyansi_081291474361'
https://www.instagram.com/arminadaily_endang_tw/,arminadaily_endang_tw,30,082122140522,b'Armina Daily / Bisnis Syariah#ProdukPremium #BisnisSyariah #KomunitasMilyader #SuksesSehatKayaBerkah Endang TWWA.082122140522www.facebook.com/etTeW'
https://www.instagram.com/aesthecia_clinic/,aesthecia_clinic,476,081387388798,b'Aesthecia Aesthetic ClinicFREE konsultasi dokterJam operasional:Selasa - Sabtu : 10:00 - 18:00Minggu : 09:00 - 17:00Senin : Tutup0813 8738 8798'
https://www.instagram.com/jenita.sari.146/,jenita.sari.146,214,085775400686,b'Jenita SariReseller AfrakidsInfo n order:Wa 085775400686Toko online : ridhojenita.bazarafra.comgmail.com'
https://www.instagram.com/bshoeslaundry/,bshoeslaundry,525,085716340574,b'BShoes Clean and Carekebersihan sebagian dari iman - H.R. Muslimbuka : setiap hariStore : @hade.cooWhatsapp :admin 1 : 085716340574admin 2 : 081283140515linktr.ee/bshoeslaundry'
https://www.instagram.com/gyleasure/,gyleasure,96,087878185195,"b'gyleasure food studio Dessert Shopyour (uilt) (P) DM/WA us to order!087878185195always open for orders!all made by order! (2-3days), '"
https://www.instagram.com/jojosbakeology/,jojosbakeology,64,6287782385081,"b""JoJo's Bakeology100% HomemadeOnly Natural IngredientsKelapa GadingJakarta BaratFor Order & Inquiries:DMWA: +6287782385081Phone: +6287787240341wa.me/6287782385081"""
https://www.instagram.com/madooindonesia/,madooindonesia,128,6287817179000,"b'UNVEILING WILDERNESSRaw Forest Honey from Indonesia.Madu Hutan Mentah dari Indonesia..Pure, Wild, & Balinese.Bermanfaat dan Berkhasiat.CS Hotline : +62 878 1717 9000m.tokopedia.com/madoo'"
https://www.instagram.com/gyleasure/,gyleasure,120,087878185195,"b'GYLEASURE Dessert Shopyour (uilt) (P) DM/WA us to order!087878185195always open for orders!all made by order! (2-3days), '"
https://www.instagram.com/jojosbakeology/,jojosbakeology,64,6287782385081,"b""JoJo's Bakeology100% HomemadeOnly Natural IngredientsKelapa GadingJakarta BaratFor Order & Inquiries:DMWA: +6287782385081Phone: +6287787240341wa.me/6287782385081"""
https://www.instagram.com/madooindonesia/,madooindonesia,128,6287817179000,"b'UNVEILING WILDERNESSRaw Forest Honey from Indonesia.Madu Hutan Mentah dari Indonesia..Pure, Wild, & Balinese.Bermanfaat dan Berkhasiat.CS Hotline : +62 878 1717 9000m.tokopedia.com/madoo'"
https://www.instagram.com/lulusky.id/,lulusky.id,140,081250003551,"b'LuluSkyThe Energy Building, Lt MezzanineSCBD, jl. Jend. Sudirman kav 52-53-WA 0812-5000-3551Monday - Friday8AM - 6 PM'"
https://www.instagram.com/ngohiangomarini/,ngohiangomarini,58,081284388052,b'Ngohiang Oma RiniThe Best Ngohiang in Town Made with Fresh MeatHalal Non halal Best Quality ~ No Preservatives ~ No MSGGo-Send Only  WA : 0812-8438805bit.ly/2WK4M8S'
https://www.instagram.com/makeu688/,makeu688,55,6281341591203,b'makeup kekinianShopping & RetailTas kekinian murahOrder Owner : @dwinabilah03api.whatsapp.com/send?phone=6281341591203'
https://www.instagram.com/kolkalday_/,kolkalday_,170,081284196789,"b""Kolkalday_Made with love for ur body's health100% tanpa pemanis dan pengawet buatanBy PreorderDepok,ID0812-8419-6789 (WA Only)"""
https://www.instagram.com/enklaserpong.id/,enklaserpong.id,378,6281292123322,"b'enklaserpong.id Akupunktur (Health & Beauty ) Facial,Slimming #enklabeauty Vitamin InjectionOPEN : Senin - Sabtu ( 09.00 - 19.00 )Reservation wa.me/6281292123322'"
https://www.instagram.com/dafagiantara/,dafagiantara,504,081358120424,"b'Mas DafaPRANATA ADICARAMc Manten adat JawaResepsi Temu MantenNgunduh MantuSiramanMidodareniTlp,SMS,WA0813-5812-0424klikchek Videonyayoutu.be/yvzkzdoZEC0'"
https://www.instagram.com/diyansi_/,diyansi_,443,081291474361,b'diyansi_081291474361'
https://www.instagram.com/arminadaily_endang_tw/,arminadaily_endang_tw,30,082122140522,b'Armina Daily / Bisnis Syariah#ProdukPremium #BisnisSyariah #KomunitasMilyader #SuksesSehatKayaBerkah Endang TWWA.082122140522www.facebook.com/etTeW'
https://www.instagram.com/aesthecia_clinic/,aesthecia_clinic,473,081387388798,b'Aesthecia Aesthetic ClinicFREE konsultasi dokterJam operasional:Selasa - Sabtu : 10:00 - 18:00Minggu : 09:00 - 17:00Senin : Tutup0813 8738 8798'
https://www.instagram.com/jenita.sari.146/,jenita.sari.146,214,085775400686,b'Jenita SariReseller AfrakidsInfo n order:Wa 085775400686Toko online : ridhojenita.bazarafra.comgmail.com'
https://www.instagram.com/bshoeslaundry/,bshoeslaundry,529,085716340574,b'BShoes Clean and Carekebersihan sebagian dari iman - H.R. Muslimbuka : setiap hariStore : @hade.cooWhatsapp :admin 1 : 085716340574admin 2 : 081283140515linktr.ee/bshoeslaundry'
https://www.instagram.com/thecreators.studio/,thecreators.studio,758,628170989969,"b'Creators | Food Photographer We create, you tell the story.-Food, Product and Service Photography & Videography- +628170989969 hello.thecreators@gmail.comlinktr.ee/thecreators.studio'"
https://www.instagram.com/utamarayafrozen/,utamarayafrozen,653,081192727119,"b'UTAMA RAYA FROZEN FOODCengkarengJakarta BaratTOKOPEDIA : KEDAI KECILSHOPPEE : UTAMA RAYA FROZEN FOODWA : 0811 9272711Menerima GROSIR dan ECERANFollowed by 99frozenfood, katering_sultan, and dimsum99official'"
https://www.instagram.com/bubblasse_clothing/,bubblasse_clothing,28,081289939998,b'bubblasseJual baju blouse atasan wanitaGrosiran dan eceranJakarta utaraWa contact 081289939998afclifes.wordpress.com'
https://www.instagram.com/infokuliner.jakarta/,infokuliner.jakarta,783,081284611182,"b""INFO KULINER JAKARTAPaid promote partnership0812 8461 1182 ( WA ) DM for any further detailsLet's spread love for UMKM """
https://www.instagram.com/supermarket_online25/,supermarket_online25,590,087881489952,b'Brand : RTE Ready To Eat087881489952 WATokopedia : makan_enak insta : JAKARTA-INDONESIAtokopedia.link/VLeX2zuxT8'
https://www.instagram.com/juicyjuicejkt/,juicyjuicejkt,266,08122167342,"b'Juicy.JuiceHealthy drink, organic drink, detox drinkMade by orderWA 08122167342'"
https://www.instagram.com/misivegetable/,misivegetable,177,081311948191,"b'milka sinaga sayur mayurJual sayur mayur segar , murah dan berkualitas.Harga grosir . Siap antarWa 081311948191'"
https://www.instagram.com/eka.ramadanti.566/,eka.ramadanti.566,59,082717370887,b'Eka RamadantiArisan fb arisan eka ramadantiBca 3940220113Mandiri 9000008271737Semua atas nama eka ramadanti yaAlamat oner jakarta barat .WA 088709740813'
https://www.instagram.com/kartikasalad_puding/,kartikasalad_puding,99,085725399997,b'Kartika Salad & PudingPre Order WA : 085725399997 Salad Mayo + Topping Keju Kraft ( sz 400ml & 750ml )Salad Buah & Puding HomemadeFresh & HealthyArea Solo'
https://www.instagram.com/azizahvictoryduasinga/,azizahvictoryduasinga,16,082335345085,b'azizahvictoryduasingaAzizah VictorysingaWa: 082335345085Shopee: victory2singa.officialTokped: victoryduasingaofficialFollowed by katering_sultan'
https://www.instagram.com/oy_tumbler/,oy_tumbler,6,6287779131893,"b'Oy TumblerCostume Tumbler High Quality.Local Product From Indonesia. Ecer & Grosir..Order Whatsapp Only, Tap Link below  :wa.me/6287779131893'"
https://www.instagram.com/alita_collection/,alita_collection,817,081219309538,"b'Novita RiweuhATASAN BAJU WANITA, KEMEJA, TUNIK & DASTERFor order: 081219309538BCA /BNI (dari Bogor)Tanyakan stok, pesanan hari sabtu/minggu dikirim senin'"
https://www.instagram.com/keday_momydy/,keday_momydy,37,085781458551,b'keday momydyfor order wa : 085781458551Followed by kedai_ateu'
https://www.instagram.com/ennya.haris/,ennya.haris,19,6281281195188,b'MALALAHome madeMade by order#makanantradisionalbetawi#tapeuli #tapeketanJakarta sekitarnyawa.me/6281281195188Followed by kueyosiko'
https://www.instagram.com/donat.doremi/,donat.doremi,22,088296327206,"b'Donat DoReMiMenyediakan aneka rasa donat mini kering Cemilan Sehat Mocaf Dramaga, Bogor, Jawa BaratCp : 088296327206 donatdoremi2020@gmail.comlinktr.ee/dDoReMiFollowed by kueyosiko'"
https://www.instagram.com/oceano.indonesia/,oceano.indonesia,18,6281952542435,b'Oceano IndonesiaFrozen Seafood Specialist +62 819 5254 2435.Pengiriman dari Jatibening Bekasioceanoindonesia.comFollowed by dapurlokarasa'
https://www.instagram.com/phartospoetress/,phartospoetress,15,085251386871,"b'pharto spoetress""Sang Pengembara cakrawala,""ILove Allah""Wa ""085251386871""Followed by kedaimadams'"
https://www.instagram.com/aleshashop2893/,aleshashop2893,225,085794616868,b'ALESHAshopFor order add Whatsup : 085794616868'
https://www.instagram.com/kebuuli_yaamaan/,kebuuli_yaamaan,638,081217777480,b'Kebuli YamanInfo pesanan tlp/wa : 081217777480Open Monday - Sunday  : 10 AM - 10 PM'
https://www.instagram.com/thecreators.studio/,thecreators.studio,766,628170989969,"b'Creators | Food Photographer We create, you tell the story.-Food, Product and Service Photography & Videography- +628170989969 hello.thecreators@gmail.comlinktr.ee/thecreators.studio'"
https://www.instagram.com/utamarayafrozen/,utamarayafrozen,653,081192727119,"b'UTAMA RAYA FROZEN FOODCengkarengJakarta BaratTOKOPEDIA : KEDAI KECILSHOPPEE : UTAMA RAYA FROZEN FOODWA : 0811 9272711Menerima GROSIR dan ECERANFollowed by 99frozenfood, katering_sultan, and dimsum99official'"
https://www.instagram.com/bubblasse_clothing/,bubblasse_clothing,28,081289939998,b'bubblasseJual baju blouse atasan wanitaGrosiran dan eceranJakarta utaraWa contact 081289939998afclifes.wordpress.com'
https://www.instagram.com/infokuliner.jakarta/,infokuliner.jakarta,785,081284611182,"b""INFO KULINER JAKARTAPaid promote partnership0812 8461 1182 ( WA ) DM for any further detailsLet's spread love for UMKM """
https://www.instagram.com/supermarket_online25/,supermarket_online25,590,087881489952,b'Brand : RTE Ready To Eat087881489952 WATokopedia : makan_enak insta : JAKARTA-INDONESIAtokopedia.link/VLeX2zuxT8'
https://www.instagram.com/juicyjuicejkt/,juicyjuicejkt,266,08122167342,"b'Juicy.JuiceHealthy drink, organic drink, detox drinkMade by orderWA 08122167342'"
https://www.instagram.com/misivegetable/,misivegetable,177,081311948191,"b'milka sinaga sayur mayurJual sayur mayur segar , murah dan berkualitas.Harga grosir . Siap antarWa 081311948191'"
https://www.instagram.com/eka.ramadanti.566/,eka.ramadanti.566,59,082717370887,b'Eka RamadantiArisan fb arisan eka ramadantiBca 3940220113Mandiri 9000008271737Semua atas nama eka ramadanti yaAlamat oner jakarta barat .WA 088709740813'
https://www.instagram.com/kartikasalad_puding/,kartikasalad_puding,99,085725399997,b'Kartika Salad & PudingPre Order WA : 085725399997 Salad Mayo + Topping Keju Kraft ( sz 400ml & 750ml )Salad Buah & Puding HomemadeFresh & HealthyArea Solo'
https://www.instagram.com/azizahvictoryduasinga/,azizahvictoryduasinga,16,082335345085,b'azizahvictoryduasingaAzizah VictorysingaWa: 082335345085Shopee: victory2singa.officialTokped: victoryduasingaofficialFollowed by katering_sultan'
https://www.instagram.com/keday_momydy/,keday_momydy,37,085781458551,b'keday momydyfor order wa : 085781458551Followed by kedai_ateu'
https://www.instagram.com/alita_collection/,alita_collection,820,081219309538,"b'Novita RiweuhATASAN BAJU WANITA, KEMEJA, TUNIK & DASTERFor order: 081219309538BCA /BNI (dari Bogor)Tanyakan stok, pesanan hari sabtu/minggu dikirim senin'"
https://www.instagram.com/oceano.indonesia/,oceano.indonesia,18,6281952542435,b'Oceano IndonesiaFrozen Seafood Specialist +62 819 5254 2435.Pengiriman dari Jatibening Bekasioceanoindonesia.comFollowed by dapurlokarasa'
https://www.instagram.com/ennya.haris/,ennya.haris,19,6281281195188,b'MALALAHome madeMade by order#makanantradisionalbetawi#tapeuli #tapeketanJakarta sekitarnyawa.me/6281281195188Followed by kueyosiko'
https://www.instagram.com/donat.doremi/,donat.doremi,27,088296327206,"b'Donat DoReMiMenyediakan aneka rasa donat mini kering Cemilan Sehat Mocaf Dramaga, Bogor, Jawa BaratCp : 088296327206 donatdoremi2020@gmail.comlinktr.ee/dDoReMiFollowed by kueyosiko'"
https://www.instagram.com/aleshashop2893/,aleshashop2893,225,085794616868,b'ALESHAshopFor order add Whatsup : 085794616868'
https://www.instagram.com/kebuuli_yaamaan/,kebuuli_yaamaan,638,081217777480,b'Kebuli YamanInfo pesanan tlp/wa : 081217777480Open Monday - Sunday  : 10 AM - 10 PM'
https://www.instagram.com/saladbuah_arsen/,saladbuah_arsen,18,085776405514,b'Salad Buah ArsenSalad Buah CreamyBy @itsrizkiiFresh and Healthy Jakarta SelatanORDER : Whatsapp 085776405514'
https://www.instagram.com/lawuhijabfashion/,lawuhijabfashion,72,085780259903,b'LaWuInfo Pemesanan WA 085780259903 Senin - Jumat 09.00 - 21.00 Sabtu - Minggu 10.00 - 20.00'
https://www.instagram.com/dapur_chiku/,dapur_chiku,197,085770556220,b'CEMILAN DAPUR_CHIKUJakarta barat puri kembangan jakarta-karawangFast respon wa085770556220JNE/JNT MANDIRIFOUNDER @iyanx_chiku'
https://www.instagram.com/meti_ruzainara/,meti_ruzainara,403,081384332189,b'meti yuliawatiBritish Propolis JakartaOrder NowWA 0813 8433 2189'
https://www.instagram.com/msglow_bilzaqstore/,msglow_bilzaqstore,475,085945620451,b'   &  Wattshap : 085945620451100% ORIGINAL.. BPOM - HALAL..BOGORapi.whatsapp.com/send?phone=6285945620451'
https://www.instagram.com/deden_darul_qutnie/,deden_darul_qutnie,490,085718599947,"b'Deden Darul QutnieAdmin @story_soljekWa 085718599947Alamat : kp cigayeunggeung desa Mekarsari kecamatan Maja kabupaten Lebak Banten.. ""bisi rek nganjang :('"
https://www.instagram.com/littlekoko_/,littlekoko_,695,081808890020,b'Little KokoPremium Ingredients kue bolu terbaik nusantaraDelivery: Monday to SaturdayInfo/Order:Wa : 081808890020 ( Daniel Aldri )Order at H-2Jakbtokopedia.com/bakingpowpow'
https://www.instagram.com/satetaichanbangmamancilegonn/,satetaichanbangmamancilegonn,932,087808788557,b'TaichanbangmamancilegonTaichan cilegonJl Jendral Ahmad Yani no.12D (lantai 2 kopi tuya)start from 20k 087808788557 10.00-22.00'
https://www.instagram.com/eatmebyvane/,eatmebyvane,417,085772714499,b'Served With LoveHouse of MentaiAccept all kinds of party & catering ordersMade by order (D-1)South Tangerang085772714499'
https://www.instagram.com/ffstore14/,ffstore14,63,081291058727,b'ffstore14 TRUST AND PREMIUM QUALITY 081291058727 (WA fast resp) ready stok (ig story)  QA/Order (message) Mandiri/BCAshopee.co.id/rhyfariha'
https://www.instagram.com/zhabinna_by.khaira/,zhabinna_by.khaira,21,081917020906,b'zhabinna_by.khairaMasker kain OxfordKaos Bandung : 0819 1702 0906 ( WA )'
https://www.instagram.com/angga_design/,angga_design,963,6281567890104,b'Angga_designDESIGN & PERCETAKANMenerima jasa: DESIGN KARTU UNDANGAN HARDBOX DUS KEMASAN SPANDUK/BANNERinfo orderWA/Call api.whatsapp.com/send?phone=6281567890104'
https://www.instagram.com/bebekmadura_frozen/,bebekmadura_frozen,18,085867643196,b'bebek bumbu madura frozenOrder bebek/ayam bumbu madura frozen lewat DM or via whats up 085867643196'
https://www.instagram.com/randa_bakmi_grilled_macaroni/,randa_bakmi_grilled_macaroni,787,081291139764,"b'RaNdaberlokasi di Komplek Ruko Duta Merlin, belakang gedung Carrefour, Harmoni.. Bakmi RaNda no.11 . . . Ph. 081291139764#RECOMMENDED!'"
https://www.instagram.com/indahciptasentosa/,indahciptasentosa,30,6289923810766,"b'R&D Indah Cipta SentosaGeneral ContractorCivil and interiorRenovasi , bangun baru , design dan custom furniture.+628992381076 ( whatsapp)+628111508965'"
https://www.instagram.com/anugerahfurnitureid/,anugerahfurnitureid,485,082311111150,b'Anugerah FurnitureBuilding your future dream homeBased in JakartaContact us (Call or Whatsapp):info@anugerahfurniture.com0823 111 111 50www.anugerahfurniture.comwa.me/6282311111150'
https://www.instagram.com/ross.taste/,ross.taste,162,089633880588,"b'Ross Taste | Pudding Telang Jambi City HALAL & FRESHGreat Taste, Good Quality, Best Price.Menerima pesanan untuk berbagai acara For Order DM/ WA: 089633880588'"
https://www.instagram.com/fatwego/,fatwego,78,6281283493315,b'Fat We GoJakarta BaratHomemade Food & Beverage#fatwegoOrder through WAwa.me/6281283493315'
https://www.instagram.com/myjellyart.bali/,myjellyart.bali,48,081617074616,"b'MYJELLYART.Bali% contain Chocolate, Milk n Fiber JellyFor order :wa: 0816 1707 4616Delivery by:Gojek/Grab (area Jabodetabek)'"
https://www.instagram.com/sew_id/,sew_id,435,082111078810,b'Sewing by Ebby & WindySelf manufactured.BBM: 5D9B8E69.Line: carolinwindy.WA: 082111078810.Based in Jakarta.'
https://www.instagram.com/doyankebab/,doyankebab,30,085720939787,"b'doyan kebab ORIGINAL - MOZARELLA - PISANG COKELAT Jl. Rawasari Timur 1, Cempaka Putih Timur, Jakarta PusatORDER  085720939787OPEN RESELLER'"
https://www.instagram.com/bintisolikha/,bintisolikha,112,089542344972,b'Binti Solikhasedia semua produk MSIMinyak balur Kutus kutusArea semarangOrder via wa 0895423449727'
https://www.instagram.com/abumusa_fashion/,abumusa_fashion,58,085720939787,b'Busana Muslim 0857 2093 9787 (WA)'
https://www.instagram.com/abumusa_bookstore/,abumusa_bookstore,41,6287883564616,"b'Abumusa Bookstore Hanya buku-buku islami Jakarta, Indonesia FREE BUKU SAKU!FAST ORDER klik link wa.me/6287883564616'"
https://www.instagram.com/dapoermama_shera/,dapoermama_shera,347,6283879891782,b'Snack box by @Dapoermama_sheraRisoles & Aneka kue lainnyaSehatHalalInfo order (wa only) +62 838 7989 1782tokopedia.com/dapoermamashera'
https://www.instagram.com/susiniusi/,susiniusi,241,081384536420,b'Susini UsiMumtaz cakes wa :0813-8453-6420'
https://www.instagram.com/utamarayafrozen/,utamarayafrozen,664,081192727119,"b'UTAMA RAYA FROZEN FOODCengkarengJakarta BaratTOKOPEDIA : KEDAI KECILSHOPPEE : UTAMA RAYA FROZEN FOODWA : 0811 9272711Menerima GROSIR dan ECERANFollowed by 99frozenfood, katering_sultan, and dimsum99official'"
https://www.instagram.com/keday_momydy/,keday_momydy,38,085781458551,b'keday momydyfor order wa : 085781458551Followed by kedai_ateu'
https://www.instagram.com/azizahvictoryduasinga/,azizahvictoryduasinga,16,082335345085,b'azizahvictoryduasingaAzizah VictorysingaWa: 082335345085Shopee: victory2singa.officialTokped: victoryduasingaofficialFollowed by katering_sultan'
https://www.instagram.com/alita_collection/,alita_collection,834,081219309538,"b'Novita RiweuhATASAN BAJU WANITA, KEMEJA, TUNIK & DASTERFor order: 081219309538BCA /BNI (dari Bogor)Tanyakan stok, pesanan hari sabtu/minggu dikirim senin'"
https://www.instagram.com/rengginang_nenek/,rengginang_nenek,5,085624874948,"b'Fitri_galerivindramenyediakan rengginang mentah & matangFB :rengginang_nenekWA :085624874948Area distribusi :mentah seluruh Indonesia,matang : area Kota & Kab.BogorFollowed by nasiudukbuhaji_tebetraya'"
https://www.instagram.com/cemilangaluhenak/,cemilangaluhenak,15,082213353569,b'Real Account! Homemade cemilan enakkk dan bikin ketagihan lagi...lagii...lagiii pemesanan bisa dikirim atau COD lohhWA : 082213353569 & 087882356196 Followed by nasikuningsamarinda'
https://www.instagram.com/dapoermarcelle/,dapoermarcelle,167,081380357722,b'Dapoer Marcelle / WA : 081380357722 / 085694240025Area : Jakarta onlySedia :Siomay - sateRisol mayoBanana bread**ORDER BY PO**'
https://www.instagram.com/posing.etc/,posing.etc,24,6285212720119,b'posing.etcFast PO. Closed po 25 june 2018. 100% original. WA +6285212720119. Jakarta based.'
https://www.instagram.com/happytreasureland/,happytreasureland,734,0818777998,b'Packaging Box Dus PaperbagFind ur Treasures HERE n Be Happy!! BOXHAMPERsSOUVENIRs NO Custom JNE only (Gojek/Grab) part of @boxincreativity 0818777998 (WA) JKT'
https://www.instagram.com/oishibento.jkt/,oishibento.jkt,85,6283811763318,"b'Oishi Bento Sbm sports clubFrozen Foodavailable on GrabFood/gofoodhttps://grab.onelink.me/2695613898WA 6283811763318MSG PENGAWET Terima pesanan utk ultah,seminar dllgofood.link/a/xJ3s7gA'"
https://www.instagram.com/garasiaquarium/,garasiaquarium,254,08178278279,b'iwan saputraTerima pesanan lampu led arwana... Fast response wa 0817827827tokopedia.link/AofouCf9jL'
https://www.instagram.com/kotakcustom_ku/,kotakcustom_ku,71,088308138265,"b'kotakcustom_kuPusat kotakkado jakarta,menerima request order1-1000anitc cempaka mas,lt dasar, blok j, no 883Tanya-tanya & orderWA 081382655389linktr.ee/emus'"
https://www.instagram.com/dapurcinta999/,dapurcinta999,891,6287855808370,"b'dapurcintaOwner : Martha RiantoAneka Kue Dan MasakanJakarta Pusat, IndonesiaFacebook : Martha RiantoWhatsApp api.whatsapp.com/send?phone=6287855808370'"
https://www.instagram.com/holly.claire.valentina/,holly.claire.valentina,141,082019278450,b'Holly Claire ValentinaCall me Claire born Feb 08 2019Weight : 2.78 kilosHeight : 45 cm : 02.07 PM dad @jeremyjere85 mom @ruththresia10 monthshandle by Mom'
https://www.instagram.com/bayamcriispy_/,bayamcriispy_,18,089561329711,b'bayam crispyOrder: DM/WAwa: 0895613297113By:@riss.kyaa#pkk43'
https://www.instagram.com/_kripikkaca/,_kripikkaca,18,085772167772,b'KACA JADI KRIPIKby: @siskatrdaORDER Wa: 085772167772DM jg bisaa:)BCA/CASHCOD?lokasi terdekat'
https://www.instagram.com/roomdecor_ns/,roomdecor_ns,16,089684158202,b'decorstore.idREALPICT! JakartaRoom Decor@nirashakiraOrder :Wa : 089684158202(No Call)Dm : @roomdecor_nsOpen Daily :09:00 - 20:00WIBPreorder'
https://www.instagram.com/akamsi.collection/,akamsi.collection,21,089666074830,b'Akamsi.collectionOrder & info :DM/WA(089666074830)BCAJNE/JNT/OJOLBisa COD---Jakarta Barat'
https://www.instagram.com/femaleshopp_id/,femaleshopp_id,16,081617568912,"b'~Female Shop~Owner @herlinyndhOpen order : 8AM - 8PM---Order & info :WA : 081617568912 (Fast Respone) Only BCA---Jakarta, Indonesia'"
https://www.instagram.com/mieayam_3saudara/,mieayam_3saudara,21,082112685211,"b'Mie Ayam 3 Saudara@wandaaulia.sTagline "" Kenikmatan Resep Keluarga""Delivery / Go Send : 082112685211 / 082123673772 (WhatsApp)maps.app.goo.gl/cAMKYU26nEzsNuNP7'"
https://www.instagram.com/tah.cris__/,tah.cris__,21,089533029019,b'Order sekarangTahu Crispy @dhiyaafyh_Jakarta Barat WA : 0895330290190@tah.cris__ - Budi Luhur- Larangan- Puri Beta- Joglo'
https://www.instagram.com/utamarayafrozen/,utamarayafrozen,664,081192727119,"b'UTAMA RAYA FROZEN FOODCengkarengJakarta BaratTOKOPEDIA : KEDAI KECILSHOPPEE : UTAMA RAYA FROZEN FOODWA : 0811 9272711Menerima GROSIR dan ECERANFollowed by 99frozenfood, katering_sultan, and dimsum99official'"
https://www.instagram.com/alita_collection/,alita_collection,834,081219309538,"b'Novita RiweuhATASAN BAJU WANITA, KEMEJA, TUNIK & DASTERFor order: 081219309538BCA /BNI (dari Bogor)Tanyakan stok, pesanan hari sabtu/minggu dikirim senin'"
https://www.instagram.com/keday_momydy/,keday_momydy,38,085781458551,b'keday momydyfor order wa : 085781458551Followed by kedai_ateu'
https://www.instagram.com/azizahvictoryduasinga/,azizahvictoryduasinga,16,082335345085,b'azizahvictoryduasingaAzizah VictorysingaWa: 082335345085Shopee: victory2singa.officialTokped: victoryduasingaofficialFollowed by katering_sultan'
https://www.instagram.com/aleshashop2893/,aleshashop2893,225,085794616868,b'ALESHAshopFor order add Whatsup : 085794616868'
https://www.instagram.com/cemilangaluhenak/,cemilangaluhenak,15,082213353569,b'Real Account! Homemade cemilan enakkk dan bikin ketagihan lagi...lagii...lagiii pemesanan bisa dikirim atau COD lohhWA : 082213353569 & 087882356196 Followed by nasikuningsamarinda'
https://www.instagram.com/utamarayafrozen/,utamarayafrozen,664,081192727119,"b'UTAMA RAYA FROZEN FOODCengkarengJakarta BaratTOKOPEDIA : KEDAI KECILSHOPPEE : UTAMA RAYA FROZEN FOODWA : 0811 9272711Menerima GROSIR dan ECERANFollowed by 99frozenfood, katering_sultan, and dimsum99official'"
https://www.instagram.com/alita_collection/,alita_collection,834,081219309538,"b'Novita RiweuhATASAN BAJU WANITA, KEMEJA, TUNIK & DASTERFor order: 081219309538BCA /BNI (dari Bogor)Tanyakan stok, pesanan hari sabtu/minggu dikirim senin'"
https://www.instagram.com/keday_momydy/,keday_momydy,38,085781458551,b'keday momydyfor order wa : 085781458551Followed by kedai_ateu'
