https://www.instagram.com/rizatemperatureshop/,rizatemperatureshop,12,081314856761,"b'Riza Temperature shopBerpengalaman menjadi reseller alat teknik, sparepart dan instrumentasi untuk memenuhi segala kebutuhan industri.WA only 0813-14856761'"
https://www.instagram.com/dekorwalpaper/,dekorwalpaper,13,081314856761,"b'Dekor walpaperDekor walpaper ,ini walpaper cetak yah.. tapi kalau mau cari walpaper kertas ada juga kok..yang mau didekor rumahnya bisa langsung WA 081314856761'"
https://www.instagram.com/rhara_shopslime/,rhara_shopslime,29,081314856761,b'Rha-ra SlimeRha-raslime Ciledug.Tanggerang W.A 081314856761 .Indonesia- Tangerang Pengiriman JNE /Gojek'
https://www.instagram.com/melanie_shopslime/,melanie_shopslime,49,081314856761,b'Melanie shopMelanie_ShopslimeCiledug.TanggerangW.A 081314856761.Indonesia- TangerangPengiriman JNE /Gojekwww.tokopedia.com/melanieshopslime'
https://www.instagram.com/undangan.pernikahan.vintage/,undangan.pernikahan.vintage,14,082211894461,b'Undangan.pernikahan.vintageUntuk order bisa langsung ke admin 082211894461 only whatsappRange harga undangan dari harga 1450 sd 10.000 (free plastik.dan ucapan terima kasih)'
https://www.instagram.com/noor_inspirationhome/,noor_inspirationhome,57,081314856761,"b'Juicer | Blender PortableMenjual alat-alat kecantikan,alat-alat keperluan rumah tangga juga.Admin : 081314856761 (only wa, no call)Happy shopping  Everybodyshopee.co.id/rizasyah09/2870319595'"
https://www.instagram.com/rijani_fashion/,rijani_fashion,160,081314856761,"b""Rijani hijabRijaniKeep Beauty and Syar'i WA :Admin 1 : 0813-14856761HAPPY SHOPPING www.tokopedia.com/rijanifashion"""
https://www.instagram.com/kopereggae_buaya_official/,kopereggae_buaya_official,689,089643721119,b'#kopereggae #buayarootsAlamat wardet1. perigi lama hj sarmah rt 1 rw 2 no 39 tangerang indonesia089643721119/ D7051592#buaya#reggae indonesia#clothgmail.com'
https://www.instagram.com/ratujengkol/,ratujengkol,210,085782402309,b'RATU JENGKOLMewahnya Makan JengkolBy @nhaliezna---Bintaro Order and more information :085782402309 ( WA/SMS ONLY )'
https://www.instagram.com/fetiaidayani/,fetiaidayani,218,087733163703,b'2N Tenun JeparaUsahaALUMINIUM dan Kain tenun tradisional jeparaphone# 087733163703Bawu & pecangaan JEPARAWa 087733163703'
https://www.instagram.com/thecreators.studio/,thecreators.studio,874,628170989969,"b'Creators | Food Photographer We create, you tell the story.Food, Product and Service Photography & Videography +628170989969 hello.thecreators@gmail.comContact us linktr.ee/thecreators.studio'"
https://www.instagram.com/dapoer.irma/,dapoer.irma,160,085880085858,"b'Dapoer IrmaRisol Smokebeef, Sosis Solo & Aneka MasakanBSD City, Tangerang Selatan085880085858/ 08561015445/081286666362 irmawatiarbiyanto27@gmail.com'"
https://www.instagram.com/browna_brownie/,browna_brownie,299,08118480990,"b'Homemade brownie By Estiby @rachma_estihalal & NyoklatPO H-2Shipping from: Bintaro/ Hang Jebat- Jaksel : Gosend,Speedy,Paxel, Tiki ONS/TDSWa: 08118480990'"
https://www.instagram.com/tiens.beauty.id/,tiens.beauty.id,394,081237234583,b'Masker Spirulina  ORIGINALBe Bright & Beauty with Spirulina.Maskernya Pria & WanitaHALAL Best Seller.Pengiriman : COD (DPS - BADUNG) JNE / J&T.WA :081237234583linktr.ee/tiensbeautyid'
https://www.instagram.com/gudangplastikvacummakanan/,gudangplastikvacummakanan,466,081314593458,"b'Gudang Plastik Vacuum#gudangplastikvacummakanan menjual plastik vacum (nylon) untuk makanan, sedia dengan berbagai macam ukuran, order DM/WA 081314593458'"
https://www.instagram.com/upiefarliy/,upiefarliy,536,62818996337,b'Upiek F. AriantoHappy Young Living Authorized AgentThe owner of @charmoiliansEOYL Order/membership WA @ +62818996337OR click below link for join YL by yourselfbit.ly/charmoilians'
https://www.instagram.com/nasikuningmallise/,nasikuningmallise,460,6281343621818,b'Nasi Kuning MalliseOrder via go food & grab food MalliseJl. Talasalapang No. 1A Alauddin Makassar-sulselBuka pukul 21:00 - 04:00 wita.Order disini wa.me/6281343621818Followed by nasikuningsamarinda'
https://www.instagram.com/cemilangaluhenak/,cemilangaluhenak,15,082213353569,b'Real Account! Homemade cemilan enakkk dan bikin ketagihan lagi...lagii...lagiii pemesanan bisa dikirim atau COD lohhWA : 082213353569 & 087882356196 Followed by nasikuningsamarinda'
https://www.instagram.com/sosis_bakar_bandung_carol/,sosis_bakar_bandung_carol,168,087877496586,"b'sosisbakarbandungakuSilakan di order yahpondok aren / 087877496586  telegram gojek kalo jauh. Lwbih hemat pake gopayHarga mulai dari 2rb,3rb,5rb,10rb..Followed by tamiquekue and nasikuningsamarinda'"
https://www.instagram.com/amarthaview.lestariagusta/,amarthaview.lestariagusta,310,081235663358,b'amarthaview.lestariagustaPT. PP Properti TbkInfo lebih lanjut WA  081235663358toko.ly/amarthaviewlestariagusta'
https://www.instagram.com/darikebunkemeja/,darikebunkemeja,213,628121109183,"b'Sambal Pe-Das KapitalSambal & Makanan Sehat. (Tanpa Pengawet, Pewarna, MSG). Pakai minyak kelapa. Tahan 7 hari (simpan di kulkas). @40rb / botol 200ml.+628121109183'"
https://www.instagram.com/gerailengkong/,gerailengkong,245,6281933874458,b'Gerai LengkongOleh-oleh Khas TangselWA +6281933874458linktr.ee/gerailengkong'
https://www.instagram.com/nasigurun_kebuli/,nasigurun_kebuli,340,081388774364,b'NASI GURUN KebuliNasi Kebuli pake beras basmatidaging kambing goreng rempahOpen Order H-1WA 081388774364'
https://www.instagram.com/kireina.shoes_bagscare/,kireina.shoes_bagscare,126,6283893589125,b'.Jl Rawamangun Muka Timur no 66 Jaktim +62838-9358-9125Open 8am - 8pm'
https://www.instagram.com/kebulijordan_/,kebulijordan_,134,082114735159,"b'Kebuli Jordan Menerima pesanan untuk berbagai macam Acara : Nikahan, Khitanan, Aqiqah, Maulid, Ulang Tahun, Arisan, dll. Info pesanan : 0821 1473 5159'"
https://www.instagram.com/donutkece.id/,donutkece.id,150,082299492519,b'indah/qkuyHome madeDonut kentang lembut Order via wa : 082299492519 Pembayar via : transfer/cod Lokasi Jakarta baratwww.tokopedia.com/indahcah'
https://www.instagram.com/shaka.dimsum/,shaka.dimsum,274,087873037836,"b'Shaka.Dimsum"" Dimsum Kaki 5 Kualitas Bintang 5 ""Since 2017 Ps.Gunung batu Indomaret Curug jl. Padi no 101 PakuanDelivery/Events Order:087873037836'"
https://www.instagram.com/warungbundaalif/,warungbundaalif,286,628170013619,b'Warung Bunda @lif#franchise #catering #nasiboxWarung kesayangan Manage by single mom @adhastuti411#umkmnaikkelasOrder here wa.me/628170013619'
https://www.instagram.com/uswina_hijabteman/,uswina_hijabteman,77,6281700136194,"b'Uswina_hijabtemanProduksi beragam kebutuhan muslimah.Gamis, hijab, mukena, pouch, bagInfo pemesanan & reseller, kontak kamiWa.me/+628170013619Dm.@adhastuti411'"
https://www.instagram.com/belles.humaira/,belles.humaira,42,085776638500,"b""Belle's Humaira StoreInsha'Allah Amanah  BPOM & HALAL BCA , BNI COD , GoSend , JNE 085776638500 WA Pamulang , Tangerang Selatanwww.tokopedia.com/belles-humaira"""
https://www.instagram.com/dewiebatik_kain/,dewiebatik_kain,589,081213315977,b'Suplier Batik Premium SoloTERIMA PESANAN SERAGAM & GROSIRANSHOPEE BY REQUESTFor Order Please Contact: WA : 081213315977'
https://www.instagram.com/flocorner20/,flocorner20,197,6285719009665,"b'Flo\'s CornerWhatsapp : +6285719009665..""We serve you better""'"
https://www.instagram.com/dapurmamamica/,dapurmamamica,21,6285721543387,"b'Dapur mama micaBest seller "" Baso Tulang Rangu "" ngeunah na tiada taraKebayoran - JKT SELATANPreOrderwa.me/6285721543387'"
https://www.instagram.com/dapurdenbagoez/,dapurdenbagoez,96,082233337123,b'Den BagoezLayanan pesan kirim antar : 0822-3333-7123'
https://www.instagram.com/kopi_jerukpurut/,kopi_jerukpurut,120,083812929538,b'kopikopi susues kopikopi bubukkopi robustakopi biji@obsesi@kopi_jerukpurut@rockberry_coffeetreasureMinat chat dm or wa.083812929538gmail.com'
https://www.instagram.com/pokkichicken/,pokkichicken,136,6289629628072,b'Pokki ChickenFried Chicken - Chicken Rice Bowl - Beef Burgerwa.me/6289629628072'
https://www.instagram.com/risolmaniaa/,risolmaniaa,64,089533177418,b'risolmaniaaButuh asupan snack?Risol aja guys!KULINER KARAWACIGOFOOD&GRABFOOD09.00-18.00WA & Info : 0895331774189'
https://www.instagram.com/asinan_mamaelmar/,asinan_mamaelmar,122,089629691849,b'Asinan Buah Mama ElmarSegardan 100% alami. Tanpa Pengawet  Tanpa PewarnaOrder tanpa PO WA: 0896 2969 1849 GoFood Asinan Mama ElmarLink order bit.ly/Order_asinan'
https://www.instagram.com/batagorgembira/,batagorgembira,307,081387680987,b'Batagor GembiraEat batagor and be happy!Order : 0813 8768 0987Available on GO-FOOD & GRAB FOODContact link linktr.ee/batagorgembira'
https://www.instagram.com/kedaikopi_kopao/,kedaikopi_kopao,53,081284230890,"b'kedai kopi kopao...Kedai kopi , bakpao& Makanan Manado..Alamat : Ruko Golden Madrid 1 blok A-15BSD CityTerima pesanan : 081284230890'"
https://www.instagram.com/kuro_kupiroti/,kuro_kupiroti,779,6285610282191,b'KuRo_KupiRotiProudly serving at: Cirendeu +628561028219Bake-Roast-BrewSpecialty coffee beansNatural leaven - no bread improver - no preservativestokopedia.link/H1M8B1A1I5'
https://www.instagram.com/itaveedurian/,itaveedurian,111,081381188169,b'Itavee DurianUntuk pemesanan:081381188169maps.app.goo.gl/2SXFR7o4BBekim9e9'
https://www.instagram.com/pizzasakugreenwich/,pizzasakugreenwich,57,6285289608258,b'PIZZA PALING ENAK NO.1Now available in BSD City Langsung pesan di GO FOOD dan GRABFOOD Greenwich Park cluster WhelfordPesenan kantor? Klik nih api.whatsapp.com/send?phone=6285289608258&text=Hai+kaka%2C%0D%0AMau+order+Pizzasaku+%2B+++boleh%3F%3F'
https://www.instagram.com/espisangijotehyeni/,espisangijotehyeni,161,081228495299,"b'Es Pisang Ijo Teh YeniMenerima pesanan untuk katering,hajatan,arisan,family gathering dan berbagai acaraNo telp/wa 081228495299gofood.link/u/vpDVY'"
https://www.instagram.com/warungzoya/,warungzoya,135,085946915420,b'Warung ZoyaAvailable on gofood and grabfoodSenin - minggu07.00 - 21.30 wibMore information only wa 085946915420gofood.link/u/bONRj'
https://www.instagram.com/nasiudukbabehali/,nasiudukbabehali,396,081291433432,b'BabehAliNasi Uduk Khas Kebon Kacang - BABEH ALI 0812 91 433 432 https://goo.gl/maps/wmsyBjFTzwQ2gofood.link/u/KlnPa'
https://www.instagram.com/seblakmantul.id/,seblakmantul.id,129,082299527085,b'Seblak MANTUL #MantapbeTULAneka Seblak dan jajanan masa kini dijamin ManTulWhatsAap: 082299527085'
https://www.instagram.com/osengosengmerconparadiso/,osengosengmerconparadiso,207,085884911377,b'oseng oseng mercon paradisoBenua indah blokD4 no25 TngIg @osengosengmerconparadisoWa:085884911377Gofood:oseng oseng mercon paradisoGrabfood:oseng-oseng mercon paradisogofood.link/u/4LOZwx'
https://www.instagram.com/warjep45cakyono/,warjep45cakyono,339,083892399245,"b'warjep 45 cakyonoWarjep 45 Putra Cakyono Japanese Food, Pamulang di GoFood.https://gofood.link/u/JVBLVLTerima pesanan cateringNo hp: 083892399245gofood.link/u/JVBLVL'"
https://www.instagram.com/baksogembil/,baksogembil,305,081285180156,b'BAKSO GEMBIL (Hadir @Go-Food)100% Bakso Sapi AsliSenin-Jumat 11.30-20.00Sabtu-Minggu 09.00-21.00 0812 85180156Dapatkan promo di Go-Food! EE IKgofood.link/u/4ax2K'
https://www.instagram.com/ayambakarbangmaher/,ayambakarbangmaher,473,08568819609,"b'OwnerMenerima pesanan cathring all menu dengan bahan kualitas, bersih, aman dikonsumsi dan free ongkirOrder via go food/grab food/retailWa: 0856 881 9609'"
https://www.instagram.com/cilokuahck/,cilokuahck,246,089654198161,"b'Cilokuah CK (Cocok Kenyang)COCOK, KENYANG @mashori.ilham Serpong, TANGSEL Via GO-FOOD & GRAB-FOODWA0896-5419-8161{  }(Every Day) [09.00 - 22.00 WIB]linktr.ee/cilokuahck'"
https://www.instagram.com/roetaryjam/,roetaryjam,69,087788102105,b'Roemah Takoyaki We are ready to serve you: 10 AM - 10 PM 087788102105#tidakdijaminkenyangFore eat dine in gofood.link/u/zG0k4J'
https://www.instagram.com/warungdoor/,warungdoor,450,081283837331,"b""Warung Do'orSeni Kopi 08128383733Free Wi.fi.Open ( 13.00 - 22.00).Tree 2 Cup Coffee.Coffee Farming and Processing by :Hamerang Coffeegofood.link/u/30QPa"""
https://www.instagram.com/vallenkitchen/,vallenkitchen,60,6289621656577,b'VallenKitchenKami menyediakan berbagai macam makanan homemade yg bermutu harga kaki limaTangSelWelcome Resellerorder api.whatsapp.com/send?phone=6289621656577'
https://www.instagram.com/cath_zanetta/,cath_zanetta,437,085885919162,b'cath_zanetta@browsbycathzanetta Custom Plastic Bag Manufacturer WA 0858 8591 9162browsbycathzanetta.business.site'
https://www.instagram.com/yuli_dcocraft/,yuli_dcocraft,520,089562830356,"b""Yuli AR D'cocraftwa 0895628303565Puri Bintaro Hijau Pdk Aren#Dcoupage#broshandmade#gelangmote#bungasabun"""
https://www.instagram.com/yunitajames/,yunitajames,936,081584801257,"b'Yunitamakeupbased tangerang. jakarta indYunitamakeupartist""make u beauty""using branded productAppointme 081584801257 & 081532031500Pin bb 5d847c50 & 543aca38'"
https://www.instagram.com/tanpopotaste/,tanpopotaste,735,6282189753606,b'TANPOPO TASTEGOOD TASTE by tanpopotasteDiracik oleh sepasang suami istri dengan penuh cinta Yogyakarta (Gamping) Pati kotaOrder api.whatsapp.com/send?phone=6282189753606'
https://www.instagram.com/keripikkerang.mamahioh/,keripikkerang.mamahioh,89,089695555770,"b'Keripik KerangCemilan Homemadepre order,readypemesanan via DM/WA 089695555770menenerima pesanan luar kotataskot COD, luar taskot JNE/J&TKota Tasikmalaya'"
https://www.instagram.com/seketjapcafe.jogja/,seketjapcafe.jogja,417,085282365985,b'Seketjap CafeSeketjap Cafe & Kalijodo Cafe Grab Food : Seketjap - Maguwo Grab Food : Kalijodo - Maguwo Go Food : Kalijodo Coffe Jogja 1Tlp : 0852 82365985'
https://www.instagram.com/kopi.kipa/,kopi.kipa,298,6282257138299,"b'Kopi Kipaby : @lala_melatiJam tayang 10.00 - 22.00 wibAvailable on GOFOOD and GRABFOODKopi Kipa I, KedungkandangKopi Kipa II, MangliawanOrder klik api.whatsapp.com/send?phone=6282257138299&text=Hai+kak+order+dong+..'"
https://www.instagram.com/kusumakitchen_id/,kusumakitchen_id,158,081265759066,"b'Kusuma Kitchen Makan nikmat, sehat, dan berkualitas Home cook 08126575906 (WhatsApp) Bandung Sistem pre order Pengiriman via Gojek/Grabapi.whatsapp.com/send?phone=628126575906'"
https://www.instagram.com/asooyscreen/,asooyscreen,930,083813313445,"b'Asooy Screen Sablon PlastikPlastik polos,sablon HD,PE,OPP,PP,KLIP & Jasa sablonTangerang - banten 15620More info order viaWA:083813313445email : asooysotoy@gmail.com'"
https://www.instagram.com/miami.bsd/,miami.bsd,44,081280670557,b'Mie ayam yummy Manage by @yunitayuvaHomemade ready to eat foodLocation : bsd tangerangWa: 081280670557'
https://www.instagram.com/papadaji/,papadaji,51,6289601235785,b'#martabakmanisbsd.homemadeMartabak Manis | Pudding Biskuit Regal | Pudding Coklat Vla | Home made food | Made by order | BSD homebased | WAtext +6289601235785 / DM for order |'
https://www.instagram.com/shopatsistahood2/,shopatsistahood2,995,089532007197,"b'Evi Novita (vierist)Tas Ori, KW Semi Premium, Import, Sunglasses, Jam TanganWA : 0895320071977 Trusted : BCA a.n Evi Novita : Jakarta'"
https://www.instagram.com/gallatashoes/,gallatashoes,333,085727548454,b'GALLATA SEPATUBerawal dari sepatuWhatsApp: 0857-2754-8454-------TerpercayaORIGINALBerkualitas------Order Klik api.whatsapp.com/send?phone=6285727548454'
https://www.instagram.com/lecocopuding/,lecocopuding,234,085727548454,b'LECOCO KELAPA MUDABERASA KESEGARANNYAWhatsApp: 0857 2754 8454------SegarOriginalCampur/Topping------Pesan/Orderapi.whatsapp.com/send?phone=6285727548454'
https://www.instagram.com/narezsa_farm/,narezsa_farm,276,0811885544,"b'Peternakan Lebah Madu CilacapNaRezSa Farm adalah peternakan lebah madu apis melifera di Cilacap, Jawa tengah, Indonesia. Sedia Madu Murni, koloni lebah,dll. Minat WA:0811885544 orm.tokopedia.com/narezsa-farm'"
https://www.instagram.com/brownies.makaroni/,brownies.makaroni,372,628170908074,"b""EL's KitchenProdusen Brownies Fudgy, Makaroni Skotel Panggang, bolu ketan hitam & Nastar Premium. #brownies #nastar #makaroni #boluketanhitamOrder klik link wa.me/628170908074"""
https://www.instagram.com/supplier_roti_depok/,supplier_roti_depok,682,6285282973011,"b'Ones RotiSupplier roti Tawar - Roti Burger dan berbagai olahan rotiharga khusus untuk program sosial, jumat berkah dan pengajian#anekaroti #supplierrotiwa.me/6285282973011'"
https://www.instagram.com/kopitorajaextra_/,kopitorajaextra_,44,085394525307,b'KOPI TORAJAJual kopi toraja GROSIR & ECERAN  Kopi toraja asli 100% Arabica & Robusta  085 394 525 307'
https://www.instagram.com/berlanjakuy/,berlanjakuy,76,081297761718,b'Part of BERL @fithitz Seluruh Indonesia Senin - Sabtu 081297761718OPEN RESELLERbisnis.berlcosmetics.in'
https://www.instagram.com/kulinertangsel.info/,kulinertangsel.info,861,082114455131,b'Info Jajanan TangselPP / Endorse0821 1445 5131 (Contact Person)Atau Klik link di Bio bit.ly/Postingkuliner'
https://www.instagram.com/eskopibaik/,eskopibaik,177,085155110903,b'Es Kopi BaikFreshly brewed and grinded coffee beansMade by order to keep the freshnessDM or WA 085155110903South Tangerang - Ciputatlinktr.ee/Eskopibaik'
https://www.instagram.com/dapurkicen/,dapurkicen,362,6285219399984,b'Dapur KicenGOOD FOOD ENDS WITH GOOD TALK. WELCOME TO MY RESTAURANTMasakan/Cemilan FrozenJabodetabekTelp/WA api.whatsapp.com/send?phone=6285219399984'
https://www.instagram.com/kunyitasam_alyakitchen/,kunyitasam_alyakitchen,663,6281383253199,b'Minuman Kesehatan #KunyitAsam 100% Alami Tanpa Pengawet Fresh Setiap Hari Immune BoosterPemesanan Klikwa.me/6281383253199'
https://www.instagram.com/reverastudio/,reverastudio,327,6287869134000,"b'Jasa foto dan video produkPhotography and VideographyFnB, Beauty, Fashion, Retail GoodsCompany Profile, EventsWA : +6287869134000'"
https://www.instagram.com/hanny_snackbox_sragen/,hanny_snackbox_sragen,974,6281567711546,"b'hannysofyantiHanny snack menyediakan aneka snack box untuk acara metting,seminar,syukuran,pengajian..dll.free ongkir Sragen kota% halal wa.me/6281567711546'"
https://www.instagram.com/kateringsehatjogja/,kateringsehatjogja,161,082287328366,"b'Katering Salman Katering harian Masakan Indonesia 100% Halal, No MSG Fresh, healthy, yummi,cheapy Free delivery082287328366 (WA/telp)PL di IG Story'"
https://www.instagram.com/tangselfoodhunter/,tangselfoodhunter,265,08974358654,b'tangselfoodhunterContact : 08974358654 hunttangselfood@gmail.com Tangerang Selatan'
https://www.instagram.com/depice_frozenfood/,depice_frozenfood,388,082242900048,b'DEPICE FROZEN FOOD082242900048all about frozen foodSemarang all area ongkir 10.000 flatalso add @depice_fashion @depice_jastip'
https://www.instagram.com/nit9640/,nit9640,321,089630546671,"b'Dela HerbalisProduk Anak BangsaMemiliki izin BPOM halal BRI POS, JNE, J&T, RESI INDAH CARGOWA  089630546671'"
https://www.instagram.com/arangbatokbangjay/,arangbatokbangjay,70,081389599538,"b'arang batok bang jayLapak bang Jay menjual kelapa,parut,santan,arang batok,arang kayu,minyak kelapa.Menerima pesananTlp 081389599538/WA 081383464440'"
https://www.instagram.com/cirebon.cake/,cirebon.cake,710,082320584369,b'Pawon Mamah EdahMenjual aneka cake&snackCirebon GunungjatiWA 082 320 584 369Ig owner @pipi_novieta'
https://www.instagram.com/sideafood/,sideafood,205,085715946448,"b'dimsum dan pancake order by wa : 085715946448 tambora III,JAKARTA BARAT .gunung putri,BOGOR.SUNDAY = CLOSE shipping by gosend ,grab expres,paxel,help'"
https://www.instagram.com/batagor.minisimoni/,batagor.minisimoni,536,089612077772,"b' .       ,       , , BNI  dan BCA whatsapp 089612077772'"
https://www.instagram.com/aldy_frozen/,aldy_frozen,27,6289630436299,b'Aldy Frozen+62896 3043 6299GO-FOOD : Aldy FrozenGRAB FOOD : Aldy FrozenAldy Frozen '
https://www.instagram.com/hamzahofficial.store/,hamzahofficial.store,210,6285861728237,"b'Hamzah official Store_ Brand lokal High QualityWaistbag, Pouchbag, camerabag, slingbag, DLL.JNE, J&T, SiCepatBCAOrder klik wa.me/6285861728237'"
https://www.instagram.com/sugarkitchen_jkt/,sugarkitchen_jkt,158,081381844443,"b'Sugar KitchenHomemade Recipes Bintaro, Tang-Selfor order via WA/DM 081381844443'"
https://www.instagram.com/riyu.fashion/,riyu.fashion,546,6285287392209,"b'Baju Wanita Lokal & ImportDress, rok, blouse, tanktop, blazer, cardigan, kemeja, hotpants, legging, jaket, jumpsuit, bra, kemben, dll JNE, J&T, WahanaJakarta BCAwa.me/6285287392209'"
https://www.instagram.com/epuagromart/,epuagromart,66,088806539122,b'Epu AgromartReady bumbu dan rempahBawang putih katingBawang bombayBawang merah jumboWA.088806539122'
https://www.instagram.com/dapoer_boenda81/,dapoer_boenda81,738,6285814008694,b'Dapoer Boenda Minuman Sehat  Jamu Herbal 100% Alami Tanpa Bahan Pengawet Menggunakan bahan berkualitas dan 100% HalalTangerang SelatanOrderwa.me/6285814008694'
https://www.instagram.com/kedai13.klepu/,kedai13.klepu,237,089813183370,b'kedai13Solusi penggajal perut dengan sajian yang menambah selera::go food patnerKedai13 klepu::08981318337 or 082233382232kedai13.wordpress.com'
https://www.instagram.com/seionindonesia/,seionindonesia,63,082234958474,b'sei on IndonesiaSei on Indonesia merupakan produk olahan bandeng tanpa duri dengan cita rasa yang khas kota Gresik.Order:-DM Sei on-wa 082234958474-tokopediabit.ly/2By7do1'
https://www.instagram.com/misivegetable/,misivegetable,185,081311948191,"b'milka sinaga sayur mayurJual sayur mayur segar , murah dan berkualitas.Harga grosir . Siap antarWa 081311948191'"
https://www.instagram.com/maemo_rek/,maemo_rek,84,088102614274,b'kitchen_kuwa : 0881026142747Surabaya areaMenerima pemesananSudah Maem kan rek hari ini? Jangan lupa maem karna berjuang juga butuh tenaga'
https://www.instagram.com/artis_kriakkriuk/,artis_kriakkriuk,61,089676969753,b'Reseller KrupukRESELLER Krupuk asli SidoarjoWa : 089676969753081246775264'
https://www.instagram.com/kecombrangmedan/,kecombrangmedan,990,085287392209,"b'Supplier Kecombrang SegarHarga Rp 30.000/kg (isi sekitar 15 pcs)Panen setiap MingguPengiriman setiap Senin dari kota Medan JNE, TIKI BCA, BRIWA 0852-8739-2209 (fast)shopee.co.id/ruby_cling/4538253862'"
https://www.instagram.com/guysfriedchicken/,guysfriedchicken,430,08111978992,"b'GUYS Fried ChickenBaso Tenis Fried Chicken / Baso Tenis Goreng Ayam""New Normal Way To Eat Baso""Enak, Besar, MurahEmail : guysfriedchicken@gmail.comWA : 08111978992'"
https://www.instagram.com/warungocha87/,warungocha87,45,0811110587,b'OchaOrderWa : 0811110587'
https://www.instagram.com/dorokdokviral.pamulang/,dorokdokviral.pamulang,443,081295818599,b'kerupuk kulit halal non MSGLabel halal MUIGurih & renyah tanpa MSGOpen ResellerOrder pemesanan via DM or WhatssApp 081295818599shopee.co.id/ekadriwatywa.me/6281295818599'
https://www.instagram.com/kebabqueenqueena/,kebabqueenqueena,229,082338131726,"b'KebabqueenqueenaJajanan Sehat, masakini #jamannowSedia juga ""KebabManis""Kurus atau Gemuk itu pilihan,Makan enak itu Kebutuhan  15.00- 23.00 082338131726'"
https://www.instagram.com/warungpasti_adajalan/,warungpasti_adajalan,369,081363814444,"b'""Warung Pasti Ada Jalan""Official Account Resmi@warungpasti_adajalan Mie Ayam Geprek , Delivery Order  Free Ongkir 0813 6381 4444 / 0813 6370 1209gofood.link/u/NnnyK'"
https://www.instagram.com/kejobear2020/,kejobear2020,432,081387250048,b'Kejo Bear Chinese FoodMakan enak kenapa harus MAHAL?? GREAT TASTE GOOD PRICE![Chinese Food & Fried rice] 100% Halal Food081387250048grab.onelink.me/2695613898?pid=instagram_organic&c=IDIGSS&is_retargeting=true&af_dp=grab%3A%2F%2Fopen%3FscreenType%3DGRABFOOD%26searchParameter%3DKejo+Bear+Chinese+Food&af_web_dp=https%3A%2F%2Fwww.grab.com%2Ffood&af_ios_url=https%3A%2F%2Fwww.grab.com%2Ffood&af_force_deeplink=true'
https://www.instagram.com/omahsalad17/,omahsalad17,50,6289560069710,b'OMAH SALAD> Salad Buah Owner : @mirawuland15Yang ingin tanya tanya bisa melalui instagram dan whatsapp Wa : klik bisa link yang dibawah ini api.whatsapp.com/send?phone=62895600697101'
https://www.instagram.com/datesmilk_/,datesmilk_,67,085939406626,"b'datesmilk_3AbradeMenjual Susu Kurma Berkualitas 100% Halal untuk di konsumsi & Coffee Milk ,( Coffee Robusta )Pesan melaluiWa : 085939406626Ciledug Tangerang'"
https://www.instagram.com/jacket_q1/,jacket_q1,48,081391577026,b'Susi123Sedia jacket sweater untuk pria dan wanita harga murah kualitas bagus dan amanahwa.me/081391577026Followed by elikatering'
https://www.instagram.com/oceano.indonesia/,oceano.indonesia,19,6281952542435,b'Oceano IndonesiaFrozen Seafood Specialist +62 819 5254 2435.Pengiriman dari Jatibening Bekasioceanoindonesia.comFollowed by dapurlokarasa'
https://www.instagram.com/kochstrasseofficial/,kochstrasseofficial,767,08995630078,"b'Pastel Goreng | Sponge Cake     . 08995630078 (WA) GoJek & Grab OVO, GoPay, Transfer Cideng, JakPus, IDN  |  | linktr.ee/kochstrasseofficial'"
https://www.instagram.com/alita_collection/,alita_collection,858,081219309538,"b'Novita RiweuhATASAN BAJU WANITA, KEMEJA, TUNIK & DASTERFor order: 081219309538BCA /BNI (dari Bogor)Tanyakan stok, pesanan hari sabtu/minggu dikirim senin'"
https://www.instagram.com/azizahvictoryduasinga/,azizahvictoryduasinga,15,082335345085,b'azizahvictoryduasingaAzizah VictorysingaWa: 082335345085Shopee: victory2singa.officialTokped: victoryduasingaofficialFollowed by katering_sultan'
https://www.instagram.com/wedangronde_kedoya/,wedangronde_kedoya,77,081281227888,b'Wedang Ronde KedoyaOrder WA 081281227888Terima pesanan H-2 18.00 - 22.00Taman Jajan Pola Bugar'
https://www.instagram.com/_candra.bussines/,_candra.bussines,213,6285738220323,b'Bussines Online terpercayaBisnis DatabaseSiapapun Dapat JoinModal 1X Selamanya Only 50.000PROMOGet 300-1Jt/HariHalalAmanRealPayment : Via Pulsa/DanaJoin DM/WA api.whatsapp.com/send?phone=6285738220323&text=Halo+Admin+Saya+Mau+Join'
