https://www.instagram.com/pempekbunhan/,pempekbunhan,245,6281213617468,b'Pempek bunhan depokPempek Bunhan DepokAsli Ikan Tenggiri PilihanOpen Resellerwa.me/6281213617468 untuk pemesanan#PempekFrozen#Tekwaninstan'
https://www.instagram.com/pempekiburos/,pempekiburos,57,081287999219,"b'Pempek DepokCitayam,Depok,Indonesia.Pengiriman menggunakan gojek/grab081287999219'"
https://www.instagram.com/pempeksangprabu/,pempeksangprabu,121,085619587953,b'PEMPEK SANG PRABU - DEPOK Fast respon 07:00 - 18:00 WA : 08561958795 Cabang Depok.Cab. Jakarta :@pempeksangprabu_jakarta.   GOFOODgofood.co.id/jakarta/restaurant/pempek-sang-prabu-pancoran-mas-30ce6172-a386-42d9-8edb-91369198a43e'
https://www.instagram.com/pempeksulthan.depok/,pempeksulthan.depok,32,082133552093,b'Pempek Sulthan DepokPempek Palembang AsliReseller @pempeksulthan_pindangagan @pempeksulthan.cibuburFrozen (Kemasan Vacuum)For Order 0821-3355-2093 (WA)'
https://www.instagram.com/pempekbelledepok/,pempekbelledepok,50,082371166656,"b'PEMPEK BELLE CAB DEPOK""PEMPEK BELLE ASLI PALEMBANG""WA 082371166656DEPOKDIJAMIN HALAL DAN HIGIENISPEMPEK SUDAH DI VACUMOWNER DEPOK @putri.aprilia25'"
https://www.instagram.com/pempeklaopan_depok/,pempeklaopan_depok,131,085693532736,b'Pempek LaoPan DepokOPEN PO UNTUK 12 Oktthe literal translation of laoban = old bosss e j a k 2014order : DM or WA 0856 9353 2736Pengiriman: GOJEK/GRAB/JNE YES'
https://www.instagram.com/pempek88_depok.cipayung/,pempek88_depok.cipayung,398,088088219910,"b'PEMPEK88 DEPOKPEMPEK ASLI IKAN TENGGIRIBUKA DARI 16.00 - 22.00GRAB/GOFOOD : PEMPEK88 DEPOK,CIPAYUNGWa 088219910049TERIMA PESANAN'"
https://www.instagram.com/pempeklova_depok/,pempeklova_depok,139,6289510001394,"b'Pempek PalembangHALALTANPA PEMUTIH dan BAHAN PENGAWETCUKO 100% GULA AREN, ASAM JAWA, CABE RAWITJl asrama divisi 1 infanteri depokWa.me/6289510001394'"
https://www.instagram.com/pempekayuklina/,pempekayuklina,532,087882048500,b'Pempek Palembang enak di DepokPempek Ikan tenggiri homemade..In syaa Allah halal dan thoyib..Wa 087882048500Jne & go sendJatijajar.Depok'
https://www.instagram.com/pempekbelida.depok/,pempekbelida.depok,8,6281319322002,b'Pempek Belida AsliSelalu sedia stock pempek dirumah gaes MOODBOOSTERReseller n dropship welcomeDepokwa.me/6281319322002'
https://www.instagram.com/pempekdepok_/,pempekdepok_,100,081385128322,"b'PempekDepokbuTitiekMenerima pesanan pempek, Tekwan dan snack untuk pesta.HP 081385128322'"
https://www.instagram.com/pakradendepok/,pakradendepok,89,081310002035,b'Pempek Pak Raden DepokJl. Margonda Raya No. 301A Depok Jawa Barat (021)77212900 081310002035'
https://www.instagram.com/pempekpahajidepok/,pempekpahajidepok,25,082114608175,b'Pempek Pa Haji DepokHarga Rp.40.000 / PackIsi 9 :- 5 Kapal Selam- 2 Lenjer- 2 AdaanFor Oder  082114608175 081318103177'
https://www.instagram.com/pempekema/,pempekema,75,6282110503762,b'PEMPEK BU EMA DEPOKMENJUAL PEMPEK ASLI PALEMBANG DI KOTA DEPOK | open reseller WA +6282110503762JL. Cengkeh PERUMAHAN BUKIT CENGKEH 2 CIMANGGIS KOTA DEPOK'
https://www.instagram.com/pempekolindepok/,pempekolindepok,119,085692978281,"b'Pempek Olin Depok : Jl. Palangkaraya No.35, Tugu, Cimanggis, Depok : 0856 9297 8281'"
https://www.instagram.com/pempekalicia.depok/,pempekalicia.depok,53,081285179873,b'pempekalicia.depokUntuk pemesananWa 081285179873'
https://www.instagram.com/pempekseorangsahabat_depok/,pempekseorangsahabat_depok,35,6289909090127,b'pempekseorangsahabat_cabDepokwa.me/628990909012goo.gl/maps/712fs7ZNASHytLEF9'
https://www.instagram.com/pempeklampungbogorselatan/,pempeklampungbogorselatan,200,087880807773,"b'PEMPEK LAMPUNG BOGOR SELATANBogororder?Wa: 087880807773GOFOOD ""Pempek Lampung Bogor Selatan""GRABFOOD ""Pempek Lampung Empang""grab.onelink.me/2695613898?pid=inappsharing&c=6-CZLVJ6A2T6EUGJ&af_dp=grab%3A%2F%2Fopen%3FscreenType%3DGRABFOOD%26sourceID%3DA4pcqCZkS4%26merchantIDs%3D6-CZLVJ6A2T6EUGJ'"
https://www.instagram.com/gayemkane/,gayemkane,38,082260067007,b'Produksi Pempek BogorREADY1 box (isi 10biji+bumbu kuah+timun)reseller Welcome ORDER VIA WA (NO DM) : 0822-6006-7007based in BOGOR  Trf BCAlinktr.ee/gayemkane'
https://www.instagram.com/warungkuliner42/,warungkuliner42,147,6282113165474,b'PEMPEK ENAK BOGOR aneka pempek aneka frozen food aneka sayur dan kebutuhan dapur grosir buahwa.me/6282113165474'
https://www.instagram.com/fourzenfood.id/,fourzenfood.id,591,085643135350,"b'PEMPEK & TEKWAN BOGOR Yummy, Tasty, EasyFrozen Food Tinggi ProteinTerima Pesanan untuk Catering dll. 0856-4313-5350'"
https://www.instagram.com/pempekuwakbogor/,pempekuwakbogor,227,085710002127,"b'Pempek Uwak BogorSemplak (Samping Klinik 24jam) 0857.1000.2127 Shopee : Pempek Uwak Bogor JNE, JNT & GrabFoodTerima Pesanan Pernikahan, Arisan dllwa.me/6285710002127'"
https://www.instagram.com/pempekkamilahbogor/,pempekkamilahbogor,621,085814812388,"b'Pempek Kami-LahPempek Kapal Selam, Isi Telur, Lenjer, Kulit, Adaan, Pempek Belah & Pempek Dostersedia Pempek & Tekwan (Beku)Pesanan 085814812388 - 08158827251'"
https://www.instagram.com/pempek_tabia/,pempek_tabia,210,085282842212,b'pempek tabia BogorWA : 085 282 842 212Shopee : https://shopee.co.id/pempek_tabia?smtt=0.0.9Pemesanan klik link :bit.ly/Pesan_Pempek_tabia'
https://www.instagram.com/pempekwongkitobogor/,pempekwongkitobogor,148,081212544636,b'Pempek Wong KitoPempek Ikan Tenggiri Asliby Ibu MirzaSejak tahun 2000Bumi Menteng AsriOrder by wa 081212544636 / 085691354303'
https://www.instagram.com/dapur.lemaknian/,dapur.lemaknian,44,081280086539,"b'Pempek Lemak Nian BogorPempek asli Wong PalembangHome Made BogorIkan tenggiri pilihan, dg gulo batok khas Linggau Sumatera SelatanWA: 081280086539instagram.com/frezariana?igshid=10pv0yi8ezxwp'"
https://www.instagram.com/pempekhendrik_bogor/,pempekhendrik_bogor,537,081618496919,b'PEMPEK PALEMBANG BOGORberdiri dr thn 1995 sangat terpercaya dan banyak konsumen setiahp 0816 1849 691line : @vih9171d (klik link di dibawah)(terima orderan via gojek)line.me/ti/p/%40vih9171d'
https://www.instagram.com/eatmeeh_/,eatmeeh_,185,6281937541140,"b'PEMPEK KEJU BOGOR BOGOR, ID Line: @rnm0146qWA: +6281937541140'"
https://www.instagram.com/pempek_mei/,pempek_mei,62,08158242000,"b'pempek.mei_ciomas bogorBismillah..Pempek Mei ""Pempek SuSu"" home made.Makyuss,lembut&sehat. Tanpa bahan pengawet. Harga Rakyat.Menerima reseller.Pesan tlp/wa. 08158242000'"
https://www.instagram.com/pempekrimesabogor/,pempekrimesabogor,275,081289013253,"b'pempek rimesa bogor2.000/pcs- asli palembang- sagu tani original- ikan laut segar- no pengawet,pemutih- aman di konsumsi- HalalTerima PesananWa 081289013253'"
https://www.instagram.com/pempeklemaknyoo_bgr/,pempeklemaknyoo_bgr,21,6289638433996,b'Pempek Lemaknyoo BogorDistributor Resmi Pempek Lemaknyoo di Bogor.Kirim via @travex_bogorPempek yg lemak ya hanya Pempek Lemaknyoo!Order wa.me/6289638433996'
https://www.instagram.com/pempekcahayaa/,pempekcahayaa,10,081271379115,b'pempek cahaya bogorPempek asli palembangWa 081271379115081271565957Cod air mancur sudirmanCod plaza jambu duaMinat langsung waReady stok'
https://www.instagram.com/pahajibgr/,pahajibgr,400,081392323531,b'Pempek Pahaji Bogor081392323531'
https://www.instagram.com/pempekceknis_bogor/,pempekceknis_bogor,101,081379093447,"b'Pempek Tenggiri HomemadeKota Bogor, Taman Yasmin Sektor 2Order : 081379093447 (WA only)Payo cicip doken '"
https://www.instagram.com/pempek_sheryn/,pempek_sheryn,963,081287647859,b'Produsen / Agen (Bogor)WA only : 081287647859Bersertifikat Halal MUI & DepKes RI'
https://www.instagram.com/riskas_kitchen/,riskas_kitchen,960,6281808622317,"b'ASINAN BOGOR, KEBAB, PEMPEKDelivery from Bogor via ojol utk kota bogor via paxel utk luar kota bogorwa.me/6281808622317'"
https://www.instagram.com/pempek_tabia_bogor/,pempek_tabia_bogor,65,085282842212,"b'cemilan_tabia Jual aneka pempek crispy, keriting, adaan, lenjer, selamAll item Rp. 2.500Lebih lanjut WA : 085 282 842 212 atauPemesanan klik linkbit.ly/Pesan_Pempek_tabia'"
https://www.instagram.com/kedaipempekkito_bogor/,kedaipempekkito_bogor,413,08777052538,"b'@Kedai Pempek KitoEveryday 10.00-22.00Jl.bangbarung Raya no.65,BogorJl.Pengadian (sebrang apotik sehat)Roemah Bogor,jl.RE Martadinata no.16,BogorCP : 08777052538'"
https://www.instagram.com/knd.bogor/,knd.bogor,166,087873066184,"b'Homemade Pempek & TekwanTekwan & pempek frozenIkan tenggiriBased in BogorOrder via DM or WA : 087873066184Shipping by Go-send, Grabexpress & Paxel (for jadetabek)'"
https://www.instagram.com/pempekcahaya.id/,pempekcahaya.id,2,6281271379115,b'pempek cahaya bogorPempek asli palembangWa +62 812-7137-9115Wa 081271565957Cod lab prodia sudirman air mancurCod plaza jambu duaGosendGrab'
https://www.instagram.com/pondok_pempek_bogor/,pondok_pempek_bogor,16,6287873760982,b'Pempek Pabo Khas Palembangapi.whatsapp.com/send?phone=+6287873760982api.whatsapp.com/send?phone=+6281366934712'
https://www.instagram.com/pempek_ngeunah/,pempek_ngeunah,94,081289758776,b'pempek_ngeunah bogorEmpek empek palembang Menerima pesanan Ikan tenggiri No pengawetJne & go-send.Order by DMWhatsapp 081289758776'
https://www.instagram.com/pempekcoy/,pempekcoy,379,08561806581,b'PEMPEK COY | BOGOR pempek adaan yg lembut asli Lampung Bogor 08561806581 COD: Ciomas/Dramaga Luar Bogor bisa kirim by Gojek/JNE'
https://www.instagram.com/pempek131jkt/,pempek131jkt,190,081932298285,"b'Pempek 131 JakartaPempek Resep Asli Palembangsince 2018. 081932298285 Cuko Pedas Halal Siap Kirim Gosend, JNE YES, TIKI ONS, Paxel Bintaro'"
https://www.instagram.com/pempek.zulaiha/,pempek.zulaiha,126,081514725859,"b'Pempek Ikan Tenggiri | JakartaIkan Tenggiri Asli Palembang made with love Halal  Gosend, Grab, Paxel & TIKI DM/WA 081514725859Menerima pesanan acara kantor, keluarga, dll'"
https://www.instagram.com/hoki.homekitchen/,hoki.homekitchen,331,081195221099,b'Pempek Jakarta TimurHoki.HomekitchenMenyediakan :Aneka PempekHomemade  Frozen Food  100% Halal  No MSGOrder via Wa 08119522109Go Food : Pempek hoki pondok bambulinktr.ee/Septianaeva90'
https://www.instagram.com/kedaipempekdian99/,kedaipempekdian99,563,085281925500,"b'Pempek Dian99 Jakarta Selatan Ikan Tenggiri Asli 100% Made by Order, Fresh from the oven  Whatsapp : 085281925500JAKARTA SELATAN'"
https://www.instagram.com/trukdingin.akr/,trukdingin.akr,707,6282184613306,"b'Truk Dingin Pempek ke Jakartakirim Pempek, frozen food, ongkir murah ke jabodetabek ?Jasa truk dingin, produk anda tetap fresh.Pickup di Palembang, Delivery ke Jabodetabekwa.me/6282184613306'"
https://www.instagram.com/powbowl/,powbowl,183,6281398801541,"b'Pempek Jakarta Cipayung, Jakarta TimurBisa COD/gosend from jakarta timur dan bekasiwa.me/6281398801541'"
https://www.instagram.com/meals_bunda_yasmine/,meals_bunda_yasmine,71,6285215647593,"b'Pempek JakartaMenjual Aneka Frozen Food (Pempek Asli Palembang, Dimsum, Mozreng, Kebab, Pizza Frozen dll)wa.me/6285215647593'"
https://www.instagram.com/pempek_cekpuspa/,pempek_cekpuspa,42,085758951850,"b'Pempek Cek Puspa JakartaASLI PALEMBANG NIANKerupuk, Kemplang & getas ready stockPempek made by orderOrder Via DM atau wa 085758951850Rawamangun, Pulogadung Jakarta Timur'"
https://www.instagram.com/pempek_nathan/,pempek_nathan,223,081387449722,"b'Pempek Nathan - Jakarta ""Enak Pempeknya, Sedap Cukanya""  WA : 0813 8744 9722 Pluit - Jakarta Utara - Indonesia Klik link dibwh  u/ beli melalui Tokopedia :linktr.ee/Pempeknathan'"
https://www.instagram.com/cawanputih/,cawanputih,793,086285694290,"b'PEMPEK PINDANG JAKARTASince 2008Jakarta, Indonesia +6285694290268 Available on Gofood & Grabfood WA order only (NO DM)wa.link/t3scmu'"
https://www.instagram.com/pempek_putoe.jkt/,pempek_putoe.jkt,204,081398943919,b'Pempek Putoe JakartaMenyediakan :Aneka Pempek Asli Ikan Pricelist dan testimoni lihat sorotan ya Order?Admin WA : 081398943919Shopee? klik shopee.co.id/ahmadhamzah16'
https://www.instagram.com/pempekfarina.culinary/,pempekfarina.culinary,27,083020304108,b'Pempek Farina Jakarta : 08.30 - 20.30 : Food Avenue Lotte Shopping Mall (Lantai 4) : Puri Indah Mall (The Expansion Lantai 1)Catering or Events: 08119205522smlculinary.com'
https://www.instagram.com/pempekhoneyjakarta/,pempekhoneyjakarta,61,6285268559590,b'Pempek Honey JakartaPempek Ikan Asli PalembangNo PengawetHalal MUIOrder via DMKirim ke Seluruh Wilayah JakartaSpJP  Spesialis Jual PempekCuma Jual Pempek Enakwa.me/6285268559590'
https://www.instagram.com/sonhajisonyjakarta/,sonhajisonyjakarta,21,085770893689,"b'pempek son haji sony jakartaMenjual frozen bakso dan pempek son haji sonyWA : 085770893689 : Gosend, Grab Express, Jnt, Wahana, Sicepatjakarta timurshopee.co.id/listanurlestari?smtt=0.0.9'"
https://www.instagram.com/simply.kitchenjkt/,simply.kitchenjkt,275,082183616055,b'PEMPEK ONLINE JAKARTAWarungnya Makanan PalembangJakarta Utara OrderWA= 082183616055No MSG#pempekonlinejakarta #pempekpalembang #makananonlinejakartam.tokopedia.com/simplykitchen'
https://www.instagram.com/pem_pekjakarta/,pem_pekjakarta,15,081286251286,"b'PEMPEK JAKARTA100%HALALMADE by ORDERLenjer,kapal selamBAHAN2 FRESH, IKAN FRES, NO PENGAWETSementara khusus jakartaGOSENDOrder ke Wa : 081286251286'"
https://www.instagram.com/pempek_lemaknianjkt/,pempek_lemaknianjkt,149,087870873031,"b'Pempek Lemak Nian JakartaNorth JakartaLine : pempeklemaknian_jktWa : 087870873031Available at Grabfood "" Pempek Palembang Lemak Nian ""'"
https://www.instagram.com/pempekbontet/,pempekbontet,238,62818900908,b'Pempek Palembang-JakartaPempek Palembang ASLITANPA PengawetGAK AmisHOME MADEIKAN FRESH.@pempekbontet.asliJakarta UtaraGo-JekTokopedia (PempekBontet)WAwa.me/62818900908'
https://www.instagram.com/pempekyence/,pempekyence,37,083898345722,"b'Yence | Pempek JakartaJual pempek palembangLokasi: Benhil, Jakarta PusatBisa kirim gojek / grab instant atau sameday untuk JabodetabekWA 0838 9834 5722'"
https://www.instagram.com/pempekcekelly/,pempekcekelly,30,081319209192,b'PEMPEK ASLI DI JAKARTAMakanan Khas PalembangDapat dikirim keseluruh Indonesia100% Original taste of Palembang100% Tanpa pengawetWA : 0813.1920.9192ORDER NOWklip.ai/pempekcekelly'
https://www.instagram.com/pempeksangprabu_jakarta/,pempeksangprabu_jakarta,152,089618596000,"b'Pempek Sang Prabu - Jakarta . Cabang jakarta 100% tenggiri, Freshly Made 089618596000.Cab. Depok @pempeksangprabu.   linktr.ee/pempeksangprabu_jakarta'"
https://www.instagram.com/pempekcikning8ulu.id/,pempekcikning8ulu.id,115,081808168563,b'Pempek Cikning Cibubur JakartaOpen ResellerOpen dropshipperWhatsApp081808168563link pemesananbit.ly/pemesananpempekcikning'
https://www.instagram.com/tekwanhotbekasi_/,tekwanhotbekasi_,345,628979354489,b'Tekwan Hot BekasiFresh & Healthy IngredientsReady limited stock EverydayTanpa MSG Terima Pesanan Bekasi SelatanOrder?DM or clickapi.whatsapp.com/send?phone=628979354489'
https://www.instagram.com/tekwan.serpong/,tekwan.serpong,13,082124386355,b'Tekwan Tangerang & JakartaOrder via Wa082124386355Menjual Tekwan & Pempek TekwanPempek TelurPempek LenjerPempek AdaanPempek Kulit'
https://www.instagram.com/knd.bogor/,knd.bogor,166,087873066184,"b'Homemade Pempek & TekwanTekwan & pempek frozenIkan tenggiriBased in BogorOrder via DM or WA : 087873066184Shipping by Go-send, Grabexpress & Paxel (for jadetabek)'"
https://www.instagram.com/fourzenfood.id/,fourzenfood.id,591,085643135350,"b'PEMPEK & TEKWAN BOGOR Yummy, Tasty, EasyFrozen Food Tinggi ProteinTerima Pesanan untuk Catering dll. 0856-4313-5350'"
https://www.instagram.com/pempeksiger_/,pempeksiger_,14,081280046068,b'Pempek Tekwan JakartaMenerima pesanan untuk berbagai acaraPengiriman Jabodetabek GoSendGrabExpress 081280046068Pemesanan melalui tokopedia bit.ly/2RWTWdB'
https://www.instagram.com/tekwan.serpong/,tekwan.serpong,13,082124386355,b'Tekwan Tangerang & JakartaOrder via Wa082124386355Menjual Tekwan & Pempek TekwanPempek TelurPempek LenjerPempek AdaanPempek Kulit'
https://www.instagram.com/kuebolubekasi/,kuebolubekasi,332,081322436382,"b'Homie CakeBe happy with the tasty WA(no call) 081322436382shopee.co.id/januarirawanBekasiFresh baked,premium quality#fudgebrowniesbekasi #kuebolubekasi'"
https://www.instagram.com/gallerycakes_n_cookies/,gallerycakes_n_cookies,902,6282110020441,b'Bolu Batik BekasiOleh-oleh Bekasi@miss_kolingbekasi@rollcakes_bekasiPre Order 2 hari sebelumnyaPengiriman: Bekasi Via gosend/tiki onsWA Order : +6282110020441www.bolubatikbekasi.blogspot.com'
https://www.instagram.com/rianaboli/,rianaboli,106,085716574082,b'Bolu Lipat Bekasi BEKASIBBM: 5C591016WA: 085716574082 / 085715252857LINE: @dxz8109vCek testimoni #testirianaboli'
https://www.instagram.com/bolususulembang_bekasi/,bolususulembang_bekasi,107,080021000877,b'BOLU SUSU LEMBANG ( BEKASI )OPEN STORE08 : 00 pagi - 21 : 00 malam WIB.Info & pemesanan .WA : 087723489080'
https://www.instagram.com/ictalcakes/,ictalcakes,32,089532051672,"b""BOLU PANGGANG/KUKUS BEKASIICTAL CAKE'SContact Person : 0895320516728 ( icha ) 089615279659 ( talitha)Owner : @fa.faa12 & @ichasn18bekasi"""
https://www.instagram.com/whiskedallday/,whiskedallday,262,085248947375,"b'Sponge Cakes Bolu Jadul Bekasi100% full butter ( margarine)No preservativesFresh ingredientsOrder max H-1 (10 am) JABODETABEK, BANDUNG with GO SEND / PAXEL 0852 4894 7375'"
https://www.instagram.com/bsl_cbt/,bsl_cbt,95,088212184738,"b'BOLU SUSU LEMBANG ( BEKASI )Jalan Bosih Raya Wanasari CibitungDepan Giant Express Cibitung 088212184738 Cibitung ,Bekasi Timur Jawa Barat'"
https://www.instagram.com/siliwangibolubekasi/,siliwangibolubekasi,42,628971678148,b'Siliwangi Bolu Kukus Bekasi Derry Asprian & Rahma Fiss Yami Safitri Gavin Ezra Uwais Gratis anter area Bekasi dan sekitarnya Klik langsung untuk order api.whatsapp.com/send?phone=628971678148&text=Saya+tertarik+ingin+PO'
https://www.instagram.com/bolumer.officialbekasi/,bolumer.officialbekasi,27,6285731728102,b'THE TRULLY MELTED CAKEwa.me/6285731728102'
https://www.instagram.com/bolu_kue_kering_murah_bekasi/,bolu_kue_kering_murah_bekasi,400,082261128425,"b'BOLU-KUE KERING MURAH BEKASI bahan pengawet. Homemade!ANEKA BOLU, KUE KERING&masakan rumahan wa/sms/tlp 0822611284Shopee : https://shopee.co.id/doaibu_252018/143890768www.tokopedia.com/makanan-homemade?utm_source=Copy&utm_campaign=Shop&utm_medium=Android+Share+Button'"
https://www.instagram.com/bolsulembangbekasi/,bolsulembangbekasi,102,082111000710,b'bolu susu lembangBolu Susu Lembang & Takus Lembang | Bekasi | JakartaBolu susu Rp. 40K / BoxTakus Rp. 35K / BoxJNE / TIKI / TravelWa 082111000710 / 082211000710'
https://www.instagram.com/bolumer_bekasitimur/,bolumer_bekasitimur,38,6285731728102,b'The Real Choco Cake in Bekasihttps://wa.me/6285731728102CHOCO MELT CAKEBOLUMERVERY MELTEDwa.me/6285731728102'
https://www.instagram.com/browniesgarayabekasi/,browniesgarayabekasi,324,6287825471000,b'Bolu Susu Madu Crispy SnackBrownies Panggang & KukusDibuka UntukDistributorResellerMarketter#browniesmurah#browniespanggangwa.me/6287825471000'
https://www.instagram.com/siliwangibolukukus_tangerang/,siliwangibolukukus_tangerang,32,085691746171,b'Siliwangi Bolu Kukus TangerangMitra Resmi Siliwangi Bolu Kukus area TangerangInfo pemesanan:Wa:0856-9174-6171Line:Fialshop'
https://www.instagram.com/2rsnackncakes/,2rsnackncakes,52,081388307525,b'SNACK.BOLU.KUE ULTAH TANGERANGKutabumiKresekGrabfood & GofoodReseller Welcome  All item ready stock! DM us / WA : 081388307525ORDER LEWAT GOFOOD?? gofood.link/u/yvJ75'
https://www.instagram.com/bolukaraktertangerang/,bolukaraktertangerang,87,081291414153,b'Bolu Karakter Pemesanan melalui whatsapp081291414153 Pembayaran melalui Transfer/OVO Domisili Tangerang Karawaci COD Perum 1 Beringin TGR( WAJIB DP!!! )'
https://www.instagram.com/bolu_depok/,bolu_depok,770,081285378208,b'Bolu Depokoleh oleh dari DEPOK yang sebenarnya!!.Available on Gojek (GoFood) App.Contact Us/order : WA: 081285378208 / 021 87740026www.boludepok.com'
https://www.instagram.com/bolu.gulung_depok/,bolu.gulung_depok,142,081284195593,b'Bolu Gulung DepokJual Bolu Gulung PremiumJual Bolu Gulung LembutEnak dimakan saat dinginPRE-ORDER (H-1)Menyediakan Snack BoxWA 081284195593Klik Disini bit.ly/bolugulungdepok'
https://www.instagram.com/bolususubandung_depok/,bolususubandung_depok,123,085688575480,"b'bolususubandung_depokBolu susu bandung ready di depokUntuk wilayah depok dan sekitarnya gak perlu jauh2 lagi buat dapetin oleh2 yg satu iniWA 08568857548, 085777935287'"
https://www.instagram.com/boluuncal/,boluuncal,160,08111185890,b'Bolu Bogor Cap UncalWA: 0811-11-85890Tokopedia: boluuncallinktr.ee/boluuncal'
https://www.instagram.com/adwisusiyanti66/,adwisusiyanti66,90,08533145700,b'Bolu Talas Bogor BotaniYang mau order ditunggu di WA 08533145700'
https://www.instagram.com/bolususubandung.bogor/,bolususubandung.bogor,371,089644887109,b'Mitra Bolu Susu Bandung BogorOPEN PreOrderTersedia: Lapis Talas Pakuan dan Kue BalokOpen reseller/dropshipCod Grabsend Gosend PaxelWA 089644887109'
https://www.instagram.com/bolupisangbogor/,bolupisangbogor,269,085718510990,"b'BROWNIES & BOLU PISANG ""UMMI""Bolu Pisang & Brownies Pisangdan aneka kue lainnya~ ""rasa rumah, harga ramah""Made by order, pemesanan H-5Tajur Halang, BogorLila 085718510990'"
https://www.instagram.com/bosubo.bogor/,bosubo.bogor,115,081906343939,"b'Bolu Susu Bogor#oleholehbogor#bolususu#instafood#bolususubogorOPEN RESELLERPemesanan via WA 081906343939Store kami :Kedung Waringin, Bojong GedeCitayam'"
https://www.instagram.com/boketembogor/,boketembogor,37,089514830835,"b'bolu ketan item bogor MANDIRI, BRI, BNI WA Only No Call/sms : 089514830835 Ciluar Permai Bogor, Indonesia'"
https://www.instagram.com/cemilkuy_/,cemilkuy_,119,6285624321625,b'BOLU KUKUS SILIWANGI BOGORBolu kukus siliwangi & Cuangki kuahSistem Pre-OrderFor order wa +6285624321625shopee.co.id/syifaalmyra?smtt=0.0.9'
https://www.instagram.com/bolususupuncakbogor/,bolususupuncakbogor,358,081903810568,"b'BoluSusuPuncakBogorOleh2 khas Puncak ya Bolu Susu Puncak dong Mitra ResmiSlow Respon.WA : 081903810568Line : @bspyummyid. TRUSTED BCA JNE, Cargo.Bogor'"
https://www.instagram.com/boluclassicbogor/,boluclassicbogor,237,081314284150,"b'Bolu ClassicMall BTM Bogor, Lt. UG09.30 - 18.30 WIB1. Oleh - Oleh Bogor2. Jajanan Bogor3. Bolu Jaman BaheulaBuka Reseller dan Agen Loch081314284150bit.ly/PesanBoluBuhun'"
https://www.instagram.com/boluubiungu_/,boluubiungu_,11,089512745803,b'Bolu Ubi Ungu BogorCake Home Made-HalalMade by OrderContact Order :Whatsapp 0895-1274-5803-Daerah Cibinong Bisa CODBogor - Jawa Barat'
https://www.instagram.com/ianajah24/,ianajah24,3,087865279021,b'OPEN PO BOLU BAKAR BOGOROpen PO bolu bakar bogorWa : 087865279021'
https://www.instagram.com/bolubogor/,bolubogor,49,6281222826227,"b'lugorLuGor, Bolu Bogor.Email bolubogor@gmail.comwa.me/6281222826227'"
https://www.instagram.com/bolulaku.square/,bolulaku.square,41,6283818575416,"b'BOLU LABU KUNING BOGORBolaku Square Group Ciawi, BogorInfo & PemesananDM @bolulaku.squareWA +62 838-1857-5416 (Lingga) bolulakubogor@gmail.com'"
https://www.instagram.com/bolupalabogor/,bolupalabogor,322,088809032909,b'PITALOKA - Bolu Pala BogorPERTAMA & TERDEPANAneka Olahan Pala Kekinian.Oleh-oleh baru Dramaga-Bogor Info & Order : 088809032909Follow : #bolupalabogor'
https://www.instagram.com/bolulapisbogorsangkuriang806/,bolulapisbogorsangkuriang806,149,085759028657,b'Lapis bogor sangkuriangKanggo kawasan sukabumi dan sekitarnya..Mangga di order lewat wa atau tlpn smz 085759028657gmail.com'
https://www.instagram.com/bolususubandung_koemiss/,bolususubandung_koemiss,2,081294131206,b'Bogor KoemissT.O.P pisan euy Jakarta%  INDONESIASilahkan Order  081294131206 OPEN RESELLER'
https://www.instagram.com/ayanacakes.id/,ayanacakes.id,828,6281807012255,"b'Bolu Tart Classic Jakarta Bestseller Bolu Classic Blackforest, Bolu Tart Keju, Bolu Tart Nougat Delivery seluruh Jakarta Dapatkan diskon promo IG. Clickapi.whatsapp.com/send?phone=6281807012255&text=Halo+Admin+Ayanacakes+Mau+Order'"
https://www.instagram.com/bolususulembangjakarta/,bolususulembangjakarta,40,08174333346,b'Bolu Susu Lembang JakartaWa : 0817 433 334gofood.link/a/y6XQGjQ'
https://www.instagram.com/madcakes.id/,madcakes.id,211,081284166315,b'BOLU GULUNG PREMIUM | JakartaFeel free to ask/order at:WA: 0812-8416-6315madcakes.id@hotmail.comTANPA PENGAWET______________READY STOCK!'
https://www.instagram.com/bolu_jadoel_jakarta/,bolu_jadoel_jakarta,31,081315141106,b'Si Bolu JadoelJUAL KUE BOLU JADOEL : KETAN ITEM PISANG MARMER PANDAN KARAMEL TAPEOrder via WA  : 081315141106Delivery Jakarta dan sekitarnya..'
https://www.instagram.com/mgv.food/,mgv.food,76,082113813461,b'Bolu Susu Lembang JakartaTRUSTED RESELLER BOLU SUSU LEMBANG DAN LAPIS BOGOR SANGKURIANG JAKARTA SELATAN!-Order via DM or Whatsapp: 082113813461tokopedia.com/mgvthings'
https://www.instagram.com/bolulembang.jakartautara/,bolulembang.jakartautara,112,089654937872,"b'FAWWAAZI SHOPMitra Resmi BSL, TALAS BOGOR SANGKURIANG DLL.Pemesanan :WA089654937872READY SETIAP HARI DAN SELALU FRESH YA PENGIRIMAN VIA JNE,JNT & GOSEND'"
https://www.instagram.com/kalitaboluuap/,kalitaboluuap,442,085777891183,b'Oleh oleh JakartaBolu Uap Kalita -Oleh oleh spesial JakartaSudah mendapat sertifikat halal dari MUIORDER Whatsapp 085777 89118308.30-18.00www.boluuap.com'
https://www.instagram.com/bolu_jakarta/,bolu_jakarta,25,088212187864,b'bolu jakartaBolu susu lembang(BSL)Boluk BalokDllDm/Wa:0882-1218-7864Jakarta utara-Kelapa Gading'
https://www.instagram.com/jasatitipbolugi/,jasatitipbolugi,15,088118483720,"b'DS Store JakartaMinat? WA 08811848372 (NO CALL)Shipping? Jatinegara, Jakarta TimurCOD?Bisa bayar ditempat Atur Jadwal ( 09.00 WIB - 17.00 WIB )'"
https://www.instagram.com/siliwangibolukukusjakartabarat/,siliwangibolukukusjakartabarat,103,081311554973,b'siliwangibolukukus-Lebih lembut-Lebih istimewa-Halal lagiOpen Outlet 10.00-20.00Wa klikapi.whatsapp.com/send?phone=62081311554973'
