https://www.instagram.com/kuekeringjakarta/,kuekeringjakarta,605,081293734896,"b""SUPPLIER ENDORSE GIVEAWAYJNEGOJEKTrusted since 2006HALALorder vialine @PHH4527X (pke'@')BBM: 744e948FWA : 081293734896NO CALL@madame_yenny"""
https://www.instagram.com/jual.kuekering_jakarta/,jual.kuekering_jakarta,6,081398748441,"b'JUAL KUE KERING TERMURAH Follow  @kuekering_kukerPREMIUM PRODUK Homemade JNE, J&T, Paxel, Gosend Grosir & Ecer Welcome Reseller 0813-9874-8441ORDER NOWbit.ly/OrderKukerYuk'"
https://www.instagram.com/kue_kering_jakarta/,kue_kering_jakarta,44,085920688805,b'kue kering jakartaLokasi: jakartaMinat? Contact me.Line: rosalinda8Bbm: 5949F26CPhone: 085920688805'
https://www.instagram.com/kuekering.jakarta_/,kuekering.jakarta_,78,081316425676,"b'KUE KERING JKT TERMURAH @kuekering_kuker se-indonesia Homemade 0813-1642-5676Jabodetabek :  Go-Send/Grab  JNE, J&T, Tiki, dan WahanaORDER NOWbit.ly/2ssXd7m'"
https://www.instagram.com/kuekering_jakarta_/,kuekering_jakarta_,64,081316425676,"b'KUE KERING TERMURAH SE-JAKARTA @kuekering_kuker @testimoni.kuker Homemade 0813-1642-5676Jabodetabek :  Go-Send/Grab  JNE, J&T, Tiki, dan Wahana.ORDERbit.ly/2ssXd7m'"
https://www.instagram.com/kuekering.jakartaa/,kuekering.jakartaa,48,081316425676,"b'KUE KERING JAKARTA TERMURAH @kuekering_kuker seluruh indonesia Homemade 0813-1642-5676Jabodetabek :  Go-Send/Grab  JNE, J&T, Tiki, dan Wahana.ORDERbit.ly/2ssXd7m'"
https://www.instagram.com/monmaison.id/,monmaison.id,20,081284455515,b'Cookies Kue Kering JakartaHappiness is Homemade  #MonMaisonidInfo / Order : 0812-8445-5515'
https://www.instagram.com/kue_kering_lebaran_jakarta/,kue_kering_lebaran_jakarta,2,081808405588,b'Kue Kering Lebaran JakartaKue Kering Lebaran Jakarta.DIJAMIN TERMURAH! .Ready Stock! Kue Lebaran Kacang-kacangan.Terbuka Peluang Reseller.0818-0840-5588wa.me/6281808405588'
https://www.instagram.com/amanah9991/,amanah9991,295,081387106100,b'Kue kering Jakarta Ina Cookies Kukis Nya Keluarga Kita Ina Cookies & LaDifaInfo Order / Reseller WA 081387106100 Go-send /JNE /J& T JAKARTA'
https://www.instagram.com/yummy.cookies.jakarta/,yummy.cookies.jakarta,48,081517188829,"b'KUE KERING HOMEMADE Kue Kering HomemadeJAKARTA WA : 081517188829 POS, TIKI, WAHANA, JNE, J&T ( Delivery Order Khusus Jakarta, Tangerang, Serpong )'"
https://www.instagram.com/apc.tokokuebekasi/,apc.tokokuebekasi,644,089532080966,b'Donat Brownies PizzaToko Kue HALALWA 0895320809669Kirim-kirim luar JABODETABEK via JNE#donat#brownies#pizza#kuekeringpremiumO R D E R K L I K   wa.me/62895320809669'
https://www.instagram.com/kuepiebrowniesjakarta/,kuepiebrowniesjakarta,13,082122255527,b'Ratu kue enakRatu kue warisan nenek moyangtnp bhn pengawetHalalenak luar biasa#kuepie#piebrownies#kuearisan#kuemeeting#kuejakarta 082122255527'
https://www.instagram.com/kuelapis_bekasi/,kuelapis_bekasi,15,083108717122,b'kuelapis_bekasiBerbagai kue lapisYang ingin order bisa Dm lewatWa083108717122Pengiriman dari bekasi jatiasihUntuk wilayah bekasi via GOjek'
https://www.instagram.com/kuelapisbogor/,kuelapisbogor,252,0818875149,"b'Lapis BogorSentra Kue Lapis Bogor di Jakarta Timur (Kalimalang Raya No 27). Untuk pemesanan WA 0818 875 149 antaran by Gojek /GrabBike, luar kota by courier'"
https://www.instagram.com/kuelapisajieb/,kuelapisajieb,127,087870952142,b'kue lapis ajieb bogorBismillahirrahmanirrahimLapis Ajieb oleh oleh BogorAll varianKirim luar kota:sicepat dan paxelBogor kota ongkir 15 kOrder: wa 087870952142'
https://www.instagram.com/kuepepebogor/,kuepepebogor,93,085710100802,"b'Kue Lapis (Pepe) Kue Basah, Bolu dan Kering Home madeTanpa Bahan Pengawet Bogor Order H-2 085710100802Bisa jastip sayur, daster & mukena'"
https://www.instagram.com/tipjas.lapisbogor_/,tipjas.lapisbogor_,35,08985936043,"b'Jasa Titip Kue Lapis BogorWA : 08985936043 : BCA only : JKT : JNE, JET, TIKI l, GOJEK, SICEPATLAPIS BOGOR SANGKURIANG ASLIPO TIAP MINGGU'"
https://www.instagram.com/jakartalapislegit/,jakartalapislegit,383,08567878776,b'Lapis Legit Kue Kering JKTSUPPLIER LAPIS LEGIT TERBESAR!! Supply ke Retailer & RESELLER!08567878776GOJEK READY!RESELLER WELCOME '
https://www.instagram.com/nastarkuelapismq/,nastarkuelapismq,46,081314000842,b'nastarkuelapis MQ jakartaDibuat dgn Hiegienis & Bahan 100% murniPengiriman 1jam setelah matang.WA 0813 14000 842gmail.com'
https://www.instagram.com/amartharisoles.bekasi/,amartharisoles.bekasi,906,628982054468,"b'AMARTHA RISOLES BEKASIRISOLES PREMIUM ANEKA RASAPremium ingredients, Halal, Bergiziwww.AmarthaRisoles.comPersonal account @syivanrwa.me/628982054468'"
https://www.instagram.com/risolesbekasi/,risolesbekasi,53,6287881702628,b'aneka risolesPart : @risolescibinongMenjual berbagai macam risolesMenjual aneka Frozen food!wa.me/6287881702628'
https://www.instagram.com/bundaalmairr/,bundaalmairr,399,6282298958586,b'Risoles Smoke Beef TangerangSALAD BUAHMACARONI KEJU PANGGANGRISOLES SMOKED BEEF PREMIUMTRUSTED SELLER Halal %Owner @mindyauliaSend by gosend/grabexpressWA klik di bwh wa.me/6282298958586'
https://www.instagram.com/tintun_kitchen/,tintun_kitchen,17,085939570822,"b'Risoles TangerangRisoles HomeMade , Pre Order Yuk!Halal Wa : 085939570822 Payment : BCA , MANDIRI , OVO , DANATangerang Selatan'"
https://www.instagram.com/risolesisi_tangerang/,risolesisi_tangerang,35,081118831160,"b'Risoles Tangerang }~RisTa~{Sebuah Warung UsahaCOD : DanauCipondoh, area Cikokol (TangCity), lap. A.yani, stasiun KA Poris.WA : 08111883116WA : 089533123868'"
https://www.instagram.com/mamz_risoles/,mamz_risoles,1,089561329253,b'Risoles Tangerang SelatanHomemade Risoles made with fresh ingredients and sprikled with love.Made by POowner @windaandrian711 08956-1329-2537 Gosend/GrabExpress/COD'
https://www.instagram.com/goodrisoles_frozen_tangerang/,goodrisoles_frozen_tangerang,23,081296703331,b'GOOD RISOLES FROZENInfo for orderWA : 081296703331BBM : D52259AF Ongkir 5rb untuk wilayah tangerang Via BCA'
https://www.instagram.com/risolesku.tangerang/,risolesku.tangerang,67,089612528962,b'Risolesku.TangerangRisoles Ku TangerangHomemade RisolesReady/POFrozenGorengCOD kota Tangerang^^Kota Tangerang 089612528962/Wa: 087768985173'
https://www.instagram.com/risoles.irma/,risoles.irma,32,089538432287,"b'Risoles Irma, TangselTerima PesananDaerah Tangerang SelatanTokopedia : Risoles Irma06WA : 0895-3843-22870DiJamin Wenakkktokopedia.link/7V4zZQTFt6'"
https://www.instagram.com/risolestangsel_zedka/,risolestangsel_zedka,99,081264681163,"b'RisolesTangsel_Zedka Own by @faizatulzuhra Produk Homemade Tangerang Selatan 081264681163 Sistem PO max h-1, bisa request digorengin/frozen food% Halal'"
https://www.instagram.com/bakoel_risoles_depok/,bakoel_risoles_depok,542,089643359142,b'Bakoel Risoles Depok Frozen risoles Salad buah Tahu Bakso udang mix ayam Dimsum Pastel aneka pudding Tumpeng mini dll WA 089643359142 ( NO CALL) DEPOK'
https://www.instagram.com/risolesnampol/,risolesnampol,27,089570299731,b'RISOLES NAMPOL DEPOKWa :0895702997310Line:halimahtusaadah@tusaadahhalimah@risolesnampol'
https://www.instagram.com/risoles.ragoutdepok/,risoles.ragoutdepok,32,089512846018,"b'Risoles.ragout.depokRisoles ragout, ragout ayam, ragout sapi, ragout sayuran, salad buah for contact :WA 089512846018Ship - DepokPemesanan dapat melalui : Goje'"
https://www.instagram.com/gerairisolesbogor/,gerairisolesbogor,91,087880624004,b'Gerai Risoles Bogor est 2009 By @wayyuji @sekarayunnisa : Made by order : 087880624004(Order by WA no CALL) : Mandiri/BCA : Gosend'
https://www.instagram.com/risolesfrozen.bogor/,risolesfrozen.bogor,108,6289515727926,b'Snack Zashy Risol Ragout Ayam & Risoles Sosis Mayo Roti Gulung Kornet Sistem Pre Order ! (Ready Minggu) Khusus BOGOROPEN RESELLERwa.me/6289515727926'
https://www.instagram.com/risoles.oey/,risoles.oey,277,081290726019,b'Risoles Oey JakartaRisoles Oey JakartaHomemade Risoles - HALALReady / POFrozen  Cooked 081290726019 / DMshopee.co.id/product/240095721/3926631739?smtt=0.0.9'
https://www.instagram.com/jualrisolesjakarta/,jualrisolesjakarta,49,087783268974,"b'Risoles jakarta 087783268974Risoles KrenyessVarian: Sayur,Mayo,Smockbeffline:dewisusan757 : 08.00-1600 : BRI , BCA : @pademangan-Jakarta utaraplease klik for orderwa.me/6287783268974'"
https://www.instagram.com/moukue/,moukue,108,087878187784,"b'RISOLES FROZEN JAKARTAHalalRisoles rougutRisoles mayo,Lemper ayam,Lapis surabaya,Frozen risoles..POwa : 087878187784'"
https://www.instagram.com/risolesmayojkt/,risolesmayojkt,1,087781450660,"b'Risoles Mayo JakartaPO H-2 WA : 087781450660 (WA only)Tokped : Risolesmayojkt BCAKelapa Gading, Jakarta Utarawww.tokopedia.com/risolesmayojkt'"
https://www.instagram.com/dapurmayorii/,dapurmayorii,15,081298170353,"b'RISOLES SAYUR, MAYO JAKARTAJAKARTA BARATNo MSG  Halal  RumahanJual gorengan & dan jajanan pasardaftar harga & order:WA: 081298170353 gofood & grabfood ""Dapur Mayori""'"
https://www.instagram.com/jakarta.risoles/,jakarta.risoles,509,080020000812,b'Frozen Food - Jakarta Risoles Senin - Sabtu 08.00 - 20.00 Go-Send WA : 081212837668 Reseller min order 10 pack'
https://www.instagram.com/risoles_bututi/,risoles_bututi,12,6281291422973,"b'RISOLES BU TUTI jakarta baratorderWhatsapp (+62 812-9142-2973)Or U can (dm) @wendi.praCod  tegal alur ,Menceng, prepedan dan sekitarnya (FREE ONGKIR)'"
https://www.instagram.com/saltandflourjakarta/,saltandflourjakarta,201,081286960057,b'Beef Mozzarella RisolesMozarella RisolesInshaAllah HalalOpen Order: 10.00 - 19.00WA : 081286960057dpn SD Muhammadiyah 22Jl. Mundu luar Blok N No.6#jajanankhasjakartagofood.link/a/xyWdGMj'
https://www.instagram.com/heavenlyrisoles.jkt/,heavenlyrisoles.jkt,7,6289623814818,b'Heavenly Risoles JakartaLINE: primanandanadiaWA: +62-896-2381-4818 (message only)'
https://www.instagram.com/lavistarisoles/,lavistarisoles,1,6282194239792,b'LAVISTA RISOLES CABANG JAKARTAPERTAMA DI MALUKU UTARA!LAVISTA RISOLES(Cabang Jakarta)..Terima pesanan partai besar untuk acara pernikahan dllOrder ke :+6282194239792 (Noe)'
https://www.instagram.com/jualkuejakarta/,jualkuejakarta,23,081318269808,b'RISOLES LEMPER ROTIWhatsapp - 081318269808Line - emilynathasia'
https://www.instagram.com/risolles_oreo_jakarta/,risolles_oreo_jakarta,18,082123202292,b'RisolesOreo & Traditional cakeMinimum Pesenan : 10pcs Order : 082123202292 Pengiriman : Gojek & Grab Menerima pesanan aneka macam Kue Outlet : Komp.Taman Berdikari Sentosa'
https://www.instagram.com/dapurburoes/,dapurburoes,739,08128070355,"b'CATERING BEKASI, TUMPENG DLLTUMPENG TAMPAH, RUJAK TAMPAH, LIWETAN, NASI BOXMade by OrderPesan min H-3No DM - Hanya WA 08128070355Gosend/PickUpBCA#bekasi#tumpengbekasi'"
https://www.instagram.com/dapurmamahitine/,dapurmamahitine,224,6281211209092,b'KATERING BEKASIKatering BulananTerima PesananHalal & NON Halal (Tidak di Campur)Kota BekasiBY @chchandra899wa.me/6281211209092'
https://www.instagram.com/dapurpatria_bekasi/,dapurpatria_bekasi,272,081210216227,b'DAPUR PATRIAPesan DM/WA 081210216227yahoo.com'
https://www.instagram.com/dapur.tina_bekasi/,dapur.tina_bekasi,794,6287875163884,"b'Dapur Tina100% HomemadeCod,Gojeg,gosamedayJln. Raya narogong km 07Line id :#bekasikulinerWA KLIK LINKwa.me/6287875163884'"
https://www.instagram.com/dapur.sos.bekasi/,dapur.sos.bekasi,81,082116229798,"b'all frozen food All Frozen Food Bekasi BCA Grab sameday,Paxel,JET ExpressHandle by @lutfia.suciHALALOrder by DM IG/WA (chat only)0821 1622 9798'"
https://www.instagram.com/dapurniji/,dapurniji,90,082281654409,b'dapur niji bekasiMade with loveOrder :DM or WA : 082281654409 Bekasi'
https://www.instagram.com/dapurdeliverybekasi/,dapurdeliverybekasi,47,081382003125,b'Dapur Delivery BekasiDapur DeliveryPESAN ANTAR 24 JAMPatner by Gofood & GrabfoodOrder Here:081382003125area Apartement_Center point_Mutiara_Kemang Viuw'
https://www.instagram.com/bebekemak_bekasi/,bebekemak_bekasi,152,089634698099,"b'dapur emak bekasi For Order :WAAdmin 1 (0896-3469-8099)ATAU Jl. Makrik, RawalumbuBekasi timur @aisyah_muslimart shopee.co.id/ummuaisy'"
https://www.instagram.com/dapursablon_bekasi/,dapursablon_bekasi,212,082211332573,"b""Dapur Sablon BekasiReady:TERIMA PENYABLONAN TANPA MINIMAL ORDERDS'POLS - KAOSPOLOS-WhatsApp 082211332573Workshop :Jl.Mt Haryono kp burangkeng(Gg. asem)SETU"""
https://www.instagram.com/dapurdna_ig/,dapurdna_ig,37,085817743961,b'Dapur D & A BekasiMakanan & MinumanSoft Pudding.Frozen Food.Bubble Drinks by So What.Ayam Jerit Suwirwa.me/085817743961'
https://www.instagram.com/kitchenset_bekasi_dapurkecil/,kitchenset_bekasi_dapurkecil,537,082210374431,b'Dapur Kecil BekasiMenerima Pesanan.- Kitchen Set Lemari Backdrop TV Partisi Ruangan Meja Dll.- Konsult. 082210374431'
https://www.instagram.com/dapur_ngemil_enak/,dapur_ngemil_enak,552,085714977938,b'Dapur Ngemil Enak BekasiTemen ngemil kamuKirim dari Bekasi TimurPengiriman instan courirWhatsApp for order085714977938085717871087'
https://www.instagram.com/dapur_cak_iman_bekasi/,dapur_cak_iman_bekasi,315,089648996045,b'AisyahwatiniMenerima pesanana:*paket ayam friedchicken*nasi box*nasi kuning*paket nasi Bento*tumpenginfo/order SMS/wa 089648996045@dapur_cak_iman_bekasifacebook.com/dapurcakiman'
https://www.instagram.com/dapur21_bekasi/,dapur21_bekasi,16,081613319740,b'Dapur 21Bekasi-IndonesiaWA Only0816133197408121042356'
https://www.instagram.com/esrujakbuahnyai/,esrujakbuahnyai,290,085640208258,"b'Dapur_Nyai_Bekasi""Jajanan khas Indonesia dengan kualitas bahan no 1"": 085640208258 (Wa only) : Bekasi Barat : Instant,sameday,paxel : Terima pesanan besar'"
https://www.instagram.com/dapur__mamih/,dapur__mamih,506,08176525557,b'Catering BekasiCATERING BEKASIFrom official account @gabriel_graysHomecookingAll homemade and freshOrder by WA : 08176525557#testimonidapurmamih'
https://www.instagram.com/dapur.aa.bekasi/,dapur.aa.bekasi,117,081808108999,b'Dapur AASolusi Makan EnakOrder WA 08180810899925k Sudah Bisa Makan Enak'
https://www.instagram.com/dapurfrozenbekasi/,dapurfrozenbekasi,554,082123238454,b'DAPUR FROZENLAUK FROZEN SIAP MAKANPraktis Cukup Panaskan 3 MenitSehat tanpa Pengawet dan MSGORDER Via WA : 0821 2323 8454KIRIM VIA: - GOSEND/GRAB/PAXELwww.dapurfrozen.com'
https://www.instagram.com/dapurmami.bekasi/,dapurmami.bekasi,106,082118877074,"b'ASINAN SAYUR BETAWISINCE 2017 Asinan sayur betawi, Asinan buah & Kerupuk mie100% halal & higienisORDER WhatsApp: 0821-1887-7074 / DMTokopedia : Dapur Mami Bekasi'"
https://www.instagram.com/dapurelisha_bekasi/,dapurelisha_bekasi,213,081281304506,b'Dapur ELISHA _BekasiKroket_Risoles_Bekasi WA : 081281304506 Harapan Indah ~ Bekasi Barat Transfer via BCA Pengiriman H+3 stlh transfer via Gosend/Grab Instantbit.ly/dapurelisha_bekasi'
https://www.instagram.com/dapureneeng/,dapureneeng,4,082213358432,"b'Dapur Eneng BekasiDapur Si EnengPONDOK UNGU PERMAI, BEKASIANEKA JAJANAN KEKINIAN 082213358432 (WA)'"
https://www.instagram.com/dapur.hantaran/,dapur.hantaran,207,085780091395,"b'Hantaran & Seserahan BekasiPrice :- Box & dekor 55rb/ box- Box rent 35k/ box- Dekor 45k/ box Proses dekor 7-14 hari 0857.8009.1395 (no call, chat only) Jatiasih Bekasi'"
https://www.instagram.com/dapurmahmudbekasi/,dapurmahmudbekasi,128,089510861613,"b'SAMBAL CUMI 25K & PANCAKE 9KSedia :Sambal baby cumiKebabSalbuPengiriman :BekasiJnt,jne,gojek,gosendOrder WA0895-1086-16130898-5517-789Shopeeshopee.co.id/product/297279946/6251949113?smtt=0.0.9'"
https://www.instagram.com/manis_bydea/,manis_bydea,46,085216365656,b'Dapur Manis BEKASISi Manis Di Setiap Acara  Whatsapp 085216365656 Bekasi Jabodetabek'
https://www.instagram.com/dapurkesumba.bekasi/,dapurkesumba.bekasi,7,081289842110,b'Dapur Kesumba BekasiFROZEN FOOD BEKASIPengiriman Jakarta Tanpa Bahan Pengawet Homemade 081289842110.Klik WAbit.ly/Dapurkesumbabekasi'
https://www.instagram.com/dapurmaurina/,dapurmaurina,133,082112880332,b'Klapertart & Pizza Bekasi Bekasi & JKT AreaHalal&finest ingredientsPre-order s/d Jumat 17.00Delivery setiap Minggu (gosend/grabsend)Order by WA 0821 1288 0332 (chat only)api.whatsapp.com/send?phone=+6282112880332'
https://www.instagram.com/dapurbanjarjakarta/,dapurbanjarjakarta,514,0811501917,"b'Soto Banjar di JKT/TANGERANGBISMILLAH..TERIMA PESANAN utk berbagai acara..Ready setiap hari(Gofood:SOTOBANJARKAYUTANGIASLI)WA 0811501917 BINTARO,BSD,SERPONG,JAKSEL(Gosend)'"
https://www.instagram.com/dapurmamihdona/,dapurmamihdona,198,081383324271,b'Dapur Mamih Dona | TANGERANGSIOMAY IKAN TENGGIRIHALAL %- WA only : 0813 8332 4271-pemesanan khusus untuk acara telfon ke no 081287042444-wa.me/6281383324271'
https://www.instagram.com/dapur_thailand_tangerang_/,dapur_thailand_tangerang_,103,087875709881,b'Dapur Thailand TangerangWarung Makan khas Thailand selatan (muslim)Halal harga terangkauInfo & reservasi :0878 7570 9881 / 0838 6966 9468'
https://www.instagram.com/amazing_warungnyoman_tangerang/,amazing_warungnyoman_tangerang,259,081325794646,"b'Dapur KokoNdutTake Away & Delivery Order081325794646Catering Harian START PAGI06.00 FREE Delivery area Summarecon&Paramount Gd Serpong,Alsut,BSD, DLL by confirm'"
https://www.instagram.com/dapurliatangerang/,dapurliatangerang,21,089666116396,b'Dapur Lia TangerangFresh Everyday! 0896-6611-6396Kota Tangerangwww.tokopedia.com/dapurlia'
https://www.instagram.com/dapur_momin/,dapur_momin,68,081387777029,b'Dapur_MomIn di TangerangHomemadeCakalang asap rabe rica dan makanan khas ManadoPesan H-2 via WA 0813 87777 029 Kirim hanya lewat Gojek/Grab maks. 25 km'
https://www.instagram.com/dapurenny.tgr/,dapurenny.tgr,99,081387484019,b'Dapur Enny TangerangLunch Box & Dinner BoxJam OperasionalSetiap Hari (09.00 - 19.00)Order by whatsapp0813-8748-4019GRATIS PENGIRIMAN TANGERANG AREA MIN Rp 100rb.'
https://www.instagram.com/dapurkairos/,dapurkairos,37,082116961134,b'DAPUR KAIROS | TangerangBecause 1 portion is never enough082116961134 ( NO CALL)Based on TangerangOPEN ORDER CUMI SAMBAL MATAH DAN BAWANGUntuk order bit.ly/Dapurkairos'
https://www.instagram.com/dapur_m1relle/,dapur_m1relle,113,085215829434,"b'Dapur Mirelle TangerangHomemade FoodDessert ,Spicy Food , For Order : 085215829434 ( WA only )'"
https://www.instagram.com/dapuruci.trg/,dapuruci.trg,159,081586694248,b'DAPUR UCI CABANG TANGERANGH-5 PREORDER MINANGNESE CUISINEmember of @dapur_ucii Rek. BCA only a/n Siti Nur Rahmah for order please text via whatsapp 081586694248 (NO CALL)'
https://www.instagram.com/perabotdapurbundatangerang/,perabotdapurbundatangerang,133,085693332950,b'Perabot Dapur Bunda Tangerang REAL PICTUREAsk & Order:(FAST RESP) klik WA: 0856-9333-2950Order Now!!!#perabotdapur #alatmasakwa.me/6285693332950'
https://www.instagram.com/dapur19tangerang/,dapur19tangerang,74,085920111907,"b'nasi box, snack box & cemilanTangerang, serpongOrder viaWA : 085920111907Tangerang Selatan'"
https://www.instagram.com/dapurnyai09/,dapurnyai09,51,081315628351,"b'DAPUR NYAI (Depok - Tangerang)Jual aneka masakan & snackMasakan Rumahan, buatan sendiri, insyaAllah halal dan non msg Wa : 081315628351'"
https://www.instagram.com/dapurmamaova/,dapurmamaova,428,081315265266,b'salad buah tangerang aneka sambel salad buah dessert box aneka cookies nasi box/liwetfresh made by order  WA 081315265266 gofood search Dapur Mama Ova'
https://www.instagram.com/kueulangtahuntangerang/,kueulangtahuntangerang,891,083813662292,b'Leo Creative Cake by Dapur EcoLUPA PASWORDfollow akun satunya@kueulangtahuntangerang1WA:083813662292'
https://www.instagram.com/dapur.rulshop/,dapur.rulshop,84,6285777336760,"b'Salad Buah TangerangFood by @nurullhdy @rulshopMakanan Halal&Thoyyib InsyaAllahTangerang, kotbum Tng terima cod&free ongkirWhatsapp klik link dibawah wa.me/6285777336760?text=Assalamu%27alaikum+ka+nurul%2C+saya+berminat+untuk+order+produk+rulshop%F0%9F%98%8A'"
https://www.instagram.com/mamimung_tangerang/,mamimung_tangerang,24,082220949150,"b'Dapur_mami_faeyzaSelamat datang di dapur mami faezya, untuk order bisa langsung whatsapp ke 0822-2094-9150 (dibawah) / dm aja yaapi.whatsapp.com/send?phone=6282220949150&text=Hallo+saya+ingin+order'"
https://www.instagram.com/dapur.encime/,dapur.encime,551,082135965857,"b'Jual Makanan TangerangSpesial kremes ayamAyam gorengBandeng PrestoPepes bandeng PringsewuResoles montokWa 082135965857Pengiriman gosend instant,sameday'"
https://www.instagram.com/dapur.onlenn/,dapur.onlenn,78,081211511173,b'BFC TANGERANG/ DAPUR ONLENNWa 0812-1151-1173'
https://www.instagram.com/dapurummisyaurah/,dapurummisyaurah,42,085947725244,"b'MASAKAN RUMAHAN TANGERANGKalo lagi repot, gak sempet masak di rumah..Pesen masakan rumahan aja ke ummi syaurah..Insyaallah lebih sehat, bergizi, non msg  WA 085947725244bit.ly/Dapurummisyaurah'"
https://www.instagram.com/masakanrumahantangerang/,masakanrumahantangerang,61,6287888696346,"b'Dapur RaffaMasakan rumah beku higienis halal terjangkauOrder by wa +6287888696346Open ResellerDelivered from Graha Raya, Tangerang'"
https://www.instagram.com/dapurbukuku/,dapurbukuku,16,628211357431,b'DAPUR BUKU KU TANGERANGOnline bookstore @dapurbukuku1000% OriginalUntuk pemesanan silahkan hubungi kami :Whatsapp  : +62 8211357431Line (resmi) : @dapurbukuEnjooooooy'
https://www.instagram.com/dapurbunisa/,dapurbunisa,246,6285276868795,"b'Homemade Frozen Food TangerangHalal, Sehat, No MSG, No PengawetLink WA wa.me/6285276868795'"
https://www.instagram.com/dapuronlinetangsel/,dapuronlinetangsel,742,081329609667,"b""Bunda Althaf StoreWhat's Mommy WantMom and Kids NeedWA 081329609667Katalog dan pemesananklik link dibawah ini bundaalthafstore.my.id/oximeter"""
https://www.instagram.com/dapur.alifa.tangsel/,dapur.alifa.tangsel,17,62818763512,b'dapur.Alifa.tangselAsli dari @dapur.alifa.Order by WA +62818763512Lokasi Tangerang Selatan'
https://www.instagram.com/dapurcemilan.tangsel/,dapurcemilan.tangsel,22,087809098624,"b'By EkariOder wa 087809098624 komp villa dago toll, blok c3/5, ciater serpong, tangsel'"
https://www.instagram.com/dapur.nya.mommy/,dapur.nya.mommy,20,081213930119,b'MAKANAN NUSANTARA TANGSELTangsel WA: 081213930119 (Nova)Halal 100% Pengiriman Jabodetabek'
https://www.instagram.com/tangselkitchen/,tangselkitchen,14,6287771667687,b'bumbu.dapurWarung Bumbu Dapursegala jenis bumbu dapur kualitas export. Pemesanan bisaDM/WA +6287771667687'
https://www.instagram.com/dapurmertua_tangsel/,dapurmertua_tangsel,19,087884008483,b'dapurMertua_tangselMenjual aneka jajan..tanpa tangan orang lain alias buatan sendiri..yang minat bisa DM/ Wa087884008483..pamulang'
https://www.instagram.com/dapurkita.jkt/,dapurkita.jkt,24,08176655540,b'Dessert cake tangerang&tangselWA : 08176655540 (no call) or DM'
https://www.instagram.com/dapurmamandoet/,dapurmamandoet,57,081319917165,b'Dapur Mama Ndoet DepokOrder Via Wa/Dm [081319917165]Perum Nuansa Depok 99 blok A no 10Cook by : Mama Linda Silaen Polnaya'
https://www.instagram.com/dapurlula.depok/,dapurlula.depok,111,081385100699,"b'Dapur LulaDEPOK, INDONESIA.Menerima pesananOrder by WA 081385100699 Homemade Komplek HBTB Jalan Bunga 3, Sukatani Tapos'"
https://www.instagram.com/dapur_euceu_depok/,dapur_euceu_depok,60,081201025082,"b'Dapur CeuceuPengiriman : GoSend, J&T, JNETransaksiBNI : 0768417396Mandiri : 1330016359481BRI : 081201025082533'"
https://www.instagram.com/bebekemakdepok_/,bebekemakdepok_,440,087880966405,b'Dapur Emak DepokMitra Bebek Emak DepokWelcome reseller Dan marketerWa 087880966405www.galleryryamah.com'
https://www.instagram.com/dapur_arrumi/,dapur_arrumi,987,082113629240,b'DAPUR ARRUMI . Jakarta & DepokPremiun Chiffon CakeHigh Recommended100% HALAL Homemade tanpa PengawetCitayam DepokWA: 0821 1362 9240www.tokopedia.com/dapurarrumi'
https://www.instagram.com/dapurara.depok/,dapurara.depok,529,081380731566,"b'DapuRara Bolketem , Bread , Cake , Pastry , Snack Box , Cookies WA 081380731566 BCA Grand Depok City , Depok Delivery Gojek , Kurir khusus kuewww.facebook.com/anna.rahmawati.750'"
https://www.instagram.com/dapurmama_depokbeji/,dapurmama_depokbeji,122,089671559196,b'Dapur Mama By Jumita SaniOPEN P.O H-1Pesan via :- DM- WA : 089671559196Pembayaran :- COD- Transfer BCA.Owner : @kartika.r.d@jumitasanii'
https://www.instagram.com/dapurab_depok/,dapurab_depok,345,628170098826,"b'Dapur AB DepokOpen PO: Getuk Lindri, Sosis, Tempe Organik, Jamu, Wedang Uwuh, Cenil Nanas.Owned by @wiraniMade by orderKukusan, Depokwa.me/+628170098826'"
https://www.instagram.com/dapur_manda_depok/,dapur_manda_depok,17,081291180308,"b'Dapur Manda DepokFood&Beverages, Catering & Special OccasionOrder:WA : 0812-9118-0308 / 0813-8827-6778Ig Inbox : @dapur_manda_depokSpecial Occasion : Order H-5'"
https://www.instagram.com/dapur.mamadepok/,dapur.mamadepok,81,6281299313993,"b'Dapur MamaJl. Lafran Pane 7B TuguDepokAdmin 1 +6281299313993Admin 2 +6281585392925Catering harian,Nasi BoxDekorasi engagement, Khitanan, birthday'"
https://www.instagram.com/dapur_depok/,dapur_depok,36,081210237167,b'DAPUR DEPOK1. Untuk pemesanan dapat dilakukan sehari sebelumnya sampai dengan jam 22.00. Transfer ke BCA 2671452544 an Achmad Teguh Santoso2. Wa 0812 1023 7167'
https://www.instagram.com/dapuraisyahdepok/,dapuraisyahdepok,55,6281219896408,b'Sambal kentang & tempe depokSpesial Sambal Kentang & Sambal Tempe Order DM WA klik wa.me/6281219896408'
https://www.instagram.com/saladbuahdapurazkha/,saladbuahdapurazkha,129,083873430072,b'salad buah depokOrder 083873430072 Jln TPU kalimulya 3 rt03/06 no.55 Kalimulya Cilodong Depok Jawa barat..Fresh di buat hanya pesanan tidak stok'
https://www.instagram.com/dapurdepok/,dapurdepok,139,08979567145,"b'kue lebaran dan pie susu enakYou can get what u need guys Fresh, Healthy, and make a happiness  WA : 0897-9567-145#jajanandepokenak #kuelebaranjakartafacebook.com/dapurdepok'"
https://www.instagram.com/dendeng_dapur_unihal_depok/,dendeng_dapur_unihal_depok,98,081212312711,b'Dendeng Batokok&Rendang PdangDendeng Batokok& Rendang*WA 081212312711*Lokasi Depok*Senin-Minggu*Request & PO% Halal dg Bahan kualitas Premium*BISA KIRIM SELURUH INDONESIAbit.ly/2X9cKsOFollowed by risolesmontok'
