https://www.instagram.com/nasikebuliuy/,nasikebuliuy,103,081192336812,b'Nasi Kebuli Uni Yanti DepokThe best Nasi Kebuli in town is here!  Order: 0811923368 (WA/ Sms)  LINE: @pth1207j  Terima pesanan partai besar/kecil  Griya Depok Asri'
https://www.instagram.com/nbkdepok/,nbkdepok,70,081325080560,"b'Nasi Bakar Kemangi-DepokNasi Bakar Kemangi Cabang ke-10, Depok.Terima pesanan: 081325080560Bisa antar by gojek Rp15.000(maksimal 40 km dari belakang asrama brimob, Depokg.co/kgs/sxQ15v'"
https://www.instagram.com/nasikuningbox.depok/,nasikuningbox.depok,680,082152697171,"b'Dapur_De_Tellonasi box, nasi kuning, pisang nuggetTerima pesananWa. 082152697171Lokasi : jl. Atim emat, cilodong, depok jabar#pisangnugget #pisangnuggetdepokbit.ly/Langsung_Order'"
https://www.instagram.com/dapur_ibu_rn/,dapur_ibu_rn,144,089692458880,"b'RICE BOWL& NASI BAKAR DEPOKMumer,porsi mantep,bikin nagih.PemesananWA:089692458880Go Food : Dapur ibu RNJLn.Musi XI (ujung) Rt3/Rw2 No 104F kec Sukmajaya'"
https://www.instagram.com/homukare.depok/,homukare.depok,14,081314823301,b'Nasi Kare Jepang HalalTaste Will Never Lie. Go-Food & Grab Food Ready  More Than 25 Portion : 081314823301(Takeaway Only)homukare.business.site'
https://www.instagram.com/nasimaks_depok/,nasimaks_depok,95,089779129355,b'Nasi MaksNasi Rempah Buatan Emaksedia sayur praktis siap masaktokopedia : sayur potong praktisshopee : sayur nasimaksno wa : 08977912935Link Untuk Pesan!gofood.link/u/lP5kmD'
https://www.instagram.com/jualnasikotakdepok/,jualnasikotakdepok,247,081290801259,"b'Jual Nasi Kotak Nasi TumpengMELAYANI :Nasi Box,Nasi Kotak,Nasi TumpengUntuk Acara :Syukuran/Ultah/Tour & Travel, dll. 0812-9080-1259 PESAN ANTAR #nasibox #nasikotakORDERbit.ly/2WhICwB'"
https://www.instagram.com/arvincatering/,arvincatering,24,087878945394,"b'nasi kotak depokARVIN CATERINGSiap melayani anda..Menerima pesananuntuk acara tsakuran, tumpeng dll...Silahkan hubungi kontak kami 087878945394'"
https://www.instagram.com/nasiudukmamahismi_depok/,nasiudukmamahismi_depok,54,087308531380,"b'Nasi uduk mamah ismi est 2009Nasi Uduk Mamah Ismi : Jl.Laskar, Gg Al-Barkah RT 06/08 no73. ( Dekat Mushola albarkah)Citayam DepokWa:085313803642wa.me//6285313803642'"
https://www.instagram.com/nasbaksf_depok/,nasbaksf_depok,41,08988683798,b'Nasi Bakar 0898-8683-798Terima PesananTerima ResellerNasi Bakar SFCitayam - Depok '
https://www.instagram.com/nasibox_bogorenak/,nasibox_bogorenak,472,6287870723797,"b'Dapur RafyllaPart of @specialistumpeng_bogor. : Jl. Villa Bogor Blok E. 3 No.8, RT.02/RW.12, Ciparigi, Kec. Bogor Utara, Kota BogorPemesanan? Langsung klik wa.me/6287870723797'"
https://www.instagram.com/jualnasiboxbogor/,jualnasiboxbogor,252,081290801259,"b'nasi box nasi tumpeng bogorMELAYANI :Nasi Box,Nasi Kotak,Nasi TumpengUntuk Acara :Syukuran/Ultah/Tour & Travel, dll. 0812-9080-1259 PESAN ANTAR #nasibox #nasikotakORDERbit.ly/2WhICwB'"
https://www.instagram.com/tumpengmini_nasibox_bogor/,tumpengmini_nasibox_bogor,390,087877151450,"b'Nasi Box & Tumpeng MiniOpen Order@inez_catering_dekorasiBogor, IndonesiaWa:087877151450Cek #testimoniinezcatering*DM SLOW RESPON*WA FAST RESPON'"
https://www.instagram.com/jualtumpengmini.bogor/,jualtumpengmini.bogor,238,089515926593,b'Tumpeng Mini & Nasi BoxPemesanan H-3Terima pesanan hanya kota bogor saja .ongkir sesuai lokasiChat:0895-1592-6593'
https://www.instagram.com/nasiliwetkekinian/,nasiliwetkekinian,723,081288065561,"b'NASI LIWET BOGORNasi Liwet KekinianNasi liwet sunda yang di sajikan dengan daun pisangterima pesanan H-2 vina ,WA : 081288065561@devinaeffendy BOGOR'"
https://www.instagram.com/nieskitchencatering/,nieskitchencatering,647,087870154050,b'Nasi Kotak Catering BogorMenerima order :nasi kotaknasi boxtumpengnasi bentokateringprasmananWA : 0878-70154050 untuk PriceListArea Bogor dan sekitarnyawa.me/6287870154050'
https://www.instagram.com/nasibox_bogor/,nasibox_bogor,66,081808735777,b'nasi box bogor chef babeh ubanMelayani pesananNasi BoxSnack BoxKonsultan KulinerBelajar privat masak Lokasi Bogor081808735777'
https://www.instagram.com/nasitelurmamak_bogor/,nasitelurmamak_bogor,414,087822125133,"b""Nasi Telur Mamak BogorSorry we're temporarily closed. Be back soon! Bogor Hawkers - Jl Bangbarung Raya No.61info 0878-2212-5133 (WA) Available in GoFood & GrabFoodgofood.link/u/r2yGV0"""
https://www.instagram.com/cateringnasibox_bogor/,cateringnasibox_bogor,179,087881859034,b'Noni Catering Nasi Box BogorMelayani  Catering Nasi Box wilayah Bogor Snack Nasi Box UltahNasi Box Tasyakurandll087881859034Owner @dyahyanuarkriste.sefb.me/nonicatering'
https://www.instagram.com/dsangugorengbogor/,dsangugorengbogor,426,087875370001,"b'Nasi Goreng D\'Sangu, BogorPecinta Nasi Goreng+ Warga Bogor= D\'Sangu Goreng"" Nasi Gorengnya urang Bogor""Order yukk diWA: 087875370001dsangugorengbogor.business.site'"
https://www.instagram.com/nasi.bakar.ceu.didis/,nasi.bakar.ceu.didis,32,6287873497795,b'Nasi Bakar BogorMenyediakan nasi bakar yang khas dan memiliki rasa yang sesuai dengan lidah para pecinta kuliner : Tlp / WA +62 878-7349-7795'
https://www.instagram.com/nasikuning_ibu.ais_bogor/,nasikuning_ibu.ais_bogor,51,089638173928,"b'Nasi Kuning Ibu Ais BogorAlamat : Jln. Sirojul Munir No.29. Pemda Kab.Bogor. Gg Kodim. Depan servis kulkas. Hub : 0896-3817-3928 (sms/tlp/WA)Nasi Tumpeng, Box, dll.'"
https://www.instagram.com/nasi_kotakbogor/,nasi_kotakbogor,23,087870271000,b'Nasi Kotak BogorMenerima pesanan :- Nasi Kotak rames- Nasi Uduk/Nasi Kuning- Nasi Tumpeng- Pesmol Ikan Nila- Gudeg komplit- Empal GentongWA : 087870271000'
https://www.instagram.com/tungku.ibu/,tungku.ibu,66,081381804611,"b'CATERING & NASI KOTAK BOGOR""Sebuah catering rumahan sederhana yg berawal dr cinta Ibunya Thessa."" Siap antar ke seluruh penjuru Bogor Utk pemesanan : 081381804611 (Tlp/WA)'"
https://www.instagram.com/nasi.tumpeng.box.bogor/,nasi.tumpeng.box.bogor,117,081294968859,"b'@alya.kitchennBOGOR INDONESIAOwner @puri_alyaaaREAL PICT Terima catering wedding/ acaraNasi box, tumpeng mini, nasi tumpeng, cokelat karakter,Wa 081294968859'"
https://www.instagram.com/nasi_kotak_bogor/,nasi_kotak_bogor,221,085292335569,"b'Nasi Kotak diBogorkami melayani nasi kotak di Bogor, Depok dan Sekitarnya. Harga terjangkau mulai dari harga 20rbWA 0852 9233 5569'"
https://www.instagram.com/nasikotaknasitumpengbogor/,nasikotaknasitumpengbogor,265,081290801259,"b'jual nasi kotak nasi tumpengMELAYANI :Nasi Box,Nasi Kotak,Nasi TumpengUntuk Acara :Syukuran/Ultah/Tour & Travel, dll. 0812-9080-1259 PESAN ANTAR #nasibox #nasikotakORDERbit.ly/2WhICwB'"
https://www.instagram.com/sedekahjumat.bogor/,sedekahjumat.bogor,341,080301046268,"b'Sedekah Nasi JumatSedekah nasi Jumat 10rb/bungkus Bogor BRI : 080301046268537Bca, mandiri, BNIJumat makin berkah dengan sedekahbit.ly/WA_SedekahJumat_Bogor'"
https://www.instagram.com/ti_pawon/,ti_pawon,45,082249830848,b'nasi box bogorAll about cooking & food  Bogor 0822 4983 0848'
https://www.instagram.com/nasikuningbunda_bogor/,nasikuningbunda_bogor,58,089620706269,b'Nasi Kuning BundaTerima pesanan nasi box berbagai menu sesuai request khusus daerah Bogor dan sekitarnya.. WA : 089620706269 / 0895331426416'
https://www.instagram.com/nasiulam/,nasiulam,765,087885154411,"b'Nasi Ulam JakartaCitra 1Menu utama: NasiUlam, NasiAyam, Bakmie AyamMenerima catering untuk berbagai acaraWA: 087885154411 #nasiulamjakartaapi.whatsapp.com/send?phone=6287885154411&text=Selamat+datang+di+Nasi+Ulam+Jakarta+ada+yang+bisa+kami+bantu+%3F+'"
https://www.instagram.com/nasiberkat.jakarta/,nasiberkat.jakarta,29,085282464211,"b'Nasi Box, Nasi Besek JakartaWA. 0852.8246.4211Delivery: all Jakarta Area, Bintaro, BSD, Gading Serpong, Alam Sutera'"
https://www.instagram.com/nasibakarakasia/,nasibakarakasia,130,081319132227,b'Nasi Bakar Akasia - JakartaKalibata city tower Akasia (dekat lobby)Buka: 9.00-20.00 wibHalalPesan via GRABFOOD/GOFOODChat WA/DM PO H-1 krn stock tbatasWA/tlp 081319132227'
https://www.instagram.com/poporecipe/,poporecipe,479,082112713367,b'NASI KOTAK / NASI BOX JAKARTAMenerima Pesanan Untuk Berbagai AcaraNasi Tumpeng MiniMochi Classic 082112713367 Go-Send / Grab Delivery / Kurir Pribadi'
https://www.instagram.com/jualnasitumpengjakarta/,jualnasitumpengjakarta,169,081290801259,b'nasi tumpeng jakartaJual nasi tumpeng menyediakan : Paket 10 porsi Paket 20 porsi Paket 50 porsi Paket 100 porsi 0812-9080-1259 PESAN ANTAR #nasitumpengwa.me/6281290801259'
https://www.instagram.com/sedekahnasijakarta/,sedekahnasijakarta,191,6285710555513,b'Sedekah nasi jakartaKita siap Menyalurkan sedekah kalian berbentuk nasi dan lauk.Di masak oleh tukang masak professional dan disalurkan tepat sasaranInshaallah amanahwa.me/6285710555513'
https://www.instagram.com/ayamnaboks/,ayamnaboks,101,081110217891,"b'NASI NABOKS JakartaNasi Box Murah Lezat, HigienisUntuk Meeting, Bukber, Ultah, Arisan, Bagi berkat, Panti, Baksos dllORDER 08111021789Meruya, Jakarta Baratshopee.co.id/deviana1286'"
https://www.instagram.com/nasibumbubali/,nasibumbubali,75,62811192228,b'Nasi Bumbu Bali - JakartaNikmati kelezatan otentik masakan khas BaliMenerima pesanan +62 811 19 222 8nasibumbubali.com'
https://www.instagram.com/nasigulejakarta/,nasigulejakarta,88,085777313581,b'NASI GULE JAKARTAMenjual makan cepat saji Buka di jam makan siang - 01:00 pm@gofoodindonesia dan @grabfoodidTerima pesanan nasi box085777313581'
https://www.instagram.com/nasitumpengjakarta.id/,nasitumpengjakarta.id,133,6281290801259,b'Jual Nasi Tumpeng JakartaJual Nasi Tumpeng Paket 10.Porsi Paket 20.Porsi Paket 50.PorsiPESAN ANTAR#nasitumpeng #tumpengmini #tumpeng #tumpengultahORDER KLIKwa.me/6281290801259'
https://www.instagram.com/warungmasboed/,warungmasboed,10,087789194466,b'NASI KOTAK & NASI BOX JAKARTAOwn @sitirochimahtunREAL FOOD FROM OUR FAMILY catering hampers lauk paukFast order Wa 087789194466r'
https://www.instagram.com/nasijinggoputra/,nasijinggoputra,259,08170124567,"b'Nasi Jinggo JakartaPre order dari Senin - MinggguJakarta BaratUtk kantoran, meeting, seminar, acara syukuran, perkumpulan,weddingFresh ingredientsCP: 0817 012 4567'"
https://www.instagram.com/dapur.prambanan/,dapur.prambanan,490,085282464211,"b'Tumpeng Mini, Nasi Box Jakarta#TumpengMini #NasiBesek #NasiBox #NasiKotak 0852-8246-4211 (WA) Nasi Kuning, Liwet, Uduk dll. Jakarta, Bintaro, BSD, Tangsel Klik Link WA iniapi.whatsapp.com/send?phone=6285282464211&text=Halo%2C+Boleh+Minta+Info+Nasi+Boxnya+ya..+Saya+butuh+buat+Konsumsi+%3A%0ATanggal%3A%0AJam+%3A%0AAlamat+Kirim+%3A%0AMenu+Nasi+%3A%0AHarga+%3A%0A'"
https://www.instagram.com/nasikuning_tangsel/,nasikuning_tangsel,427,083899123335,b'Nasi Box & TumpengTangerang SelatanWA only 083899123335Order H-3Minimum order 10 boxDP 50%'
https://www.instagram.com/nasikuningbox.depok/,nasikuningbox.depok,680,082152697171,"b'Dapur_De_Tellonasi box, nasi kuning, pisang nuggetTerima pesananWa. 082152697171Lokasi : jl. Atim emat, cilodong, depok jabar#pisangnugget #pisangnuggetdepokbit.ly/Langsung_Order'"
https://www.instagram.com/udukkuning.depok/,udukkuning.depok,194,6281290582812,"b'Nasi UdukKuningCocok PisanJl.Pitara Raya , deket kelurahan Pancoran mas yang lama . Depan @gemaoo.vapestore .Pemesanan ? Untuk acaraMinimal 15 pcsKlik untuk WAapi.whatsapp.com/send?phone=6281290582812&text=Nama+%3A%0AAlamat+%3A%0AOrder+Pesanan%3A'"
https://www.instagram.com/nasikuning_ibu.ais_bogor/,nasikuning_ibu.ais_bogor,51,089638173928,"b'Nasi Kuning Ibu Ais BogorAlamat : Jln. Sirojul Munir No.29. Pemda Kab.Bogor. Gg Kodim. Depan servis kulkas. Hub : 0896-3817-3928 (sms/tlp/WA)Nasi Tumpeng, Box, dll.'"
https://www.instagram.com/nasi.kuningbogor/,nasi.kuningbogor,16,08170722480,"b'   Jln. Kolonel Ahmad Syam, Komplek IPB Baranangsiang 4 No.2B Bogor.Menerima Pesanan : 0817 0722 480'"
https://www.instagram.com/nasikuningbunda_bogor/,nasikuningbunda_bogor,58,089620706269,b'Nasi Kuning BundaTerima pesanan nasi box berbagai menu sesuai request khusus daerah Bogor dan sekitarnya.. WA : 089620706269 / 0895331426416'
https://www.instagram.com/nasikuning.jaktim/,nasikuning.jaktim,287,081280007344,b'Nasi Kuning jakarta TimurNasi Kuning Bento dan Tumpeng MiniMurah~Lezat~IstimewaAkun duplikat dari@nasikuning.arjuna#nasikuning.arjunaWA:081280007344'
https://www.instagram.com/cateringnasikuningjakarta/,cateringnasikuningjakarta,98,085910270369,b'Catering Nasi Kuning JakartaOrder Rp.20.000/Porsi#nasikuning#catering#tumpengmini#tumpengbesar#tumpengMinimal 15 PorsiHubungi :0859102703691 ( Whatshapp Only)www.tumpengmini.co.id'
https://www.instagram.com/nasikuningjakarta/,nasikuningjakarta,37,081286916932,"b'NASI KUNING JAKARTAMelayani Pemesanan Nasi KuningNasi Box dan TumpengAcara Pesta, Ulang Tahun, Syukuran DllDijamin Halal, Murah dan Bisa RequestWA: 081286916932'"
https://www.instagram.com/cateringnasikuningjakartautara/,cateringnasikuningjakartautara,3,085910270369,b'CateringNasiKuningJakartaUtaraOrder Rp.20.000/Porsi#nasikuning#catering#tumpengmini#tumpengbesar#tumpengMinimal 15 PorsiHubungi :0859102703691 ( Whatshapp Only)www.tumpengmini.co.id'
https://www.instagram.com/nasikuningjakarta_/,nasikuningjakarta_,21,089660910496,b'Nasi KuningJual Nasi KuningNasi TumpengTumpeng MiniNasi boxNasi box bento0896-6091-0496 (WA)'
https://www.instagram.com/nasikuningpontianak/,nasikuningpontianak,59,082156017222,b'Nasi Kuning & Uduk Jakarta%HalalSenin-Sabtu (Minggu off)17:00-21:00GoFoodTumpeng & Rice Box untuk acara max H-2contact:082156017222 lily'
https://www.instagram.com/nasikuningjakartafranchise/,nasikuningjakartafranchise,19,089676712693,"b'nasikuningjakarta(franchise)buat nasi kuning ga perlu ribet krn sdh ada nasi kuning jakarta,paket kemitraan 5jt lgkp peralatan dan booth. Start your bisnis nowWA : 089676712693'"
https://www.instagram.com/martabakombekasi/,martabakombekasi,154,085694690621,b'Martabak OM BekasiMartabak Manis dan Martabak India! Open 17:00 - 23:00 : 085694690621Gofood: Martabak Om Bekasi Order Take Photo Upload Eat Repeat!'
https://www.instagram.com/martabakharsbekasi/,martabakharsbekasi,444,085881652688,b'Martabak Hars BekasiJUARANYA MARTABAK!Alamat: Jl. Pulosirih Utama Blok EB No.140C (dkt sma panglima sudirman)WA / Call : 0858-8165-2688facebook.com/hars.bekasi19'
https://www.instagram.com/mehongmartabak/,mehongmartabak,57,082299446677,b'Martabak Mehong Bekasi TimurOwner outlet mehong MGT & Exit tol timur jl.mutiara gading timur exit tol timurOpen 16.00 - 22.00Terima pesanan 082299446677-081281075376martabakmehong.com'
https://www.instagram.com/martabakmini_bekasi/,martabakmini_bekasi,58,087889162959,b'MARTABAK MINI ENAKBy : @widyaningsih.98Sistem POMenerima Pesanan087889162959 (WA)Dekat Mall MetropolitanBekasi Selatan'
https://www.instagram.com/martabak_youth/,martabak_youth,63,6282213358432,b'MARTABAK YOUTH BEKASI*MARTABAK YOUTH* PONDOK UNGU PERMAI BLOK AK 23 NO. 19 MARTABAK MINI ANEKA SATE DELIVERY PUP +62 822-1335-8432 +62 856-7089-590'
https://www.instagram.com/martabak100.bekasi/,martabak100.bekasi,34,087100302119,b'Martabak 100+ Rasa - BekasiMartabak Khas Pecenongan 87 dengan 100+ varian rasa dan 30 premium topping : 2pm - 11pm : Jl. Raya Narogong KM.9 No.40 Bekasi'
https://www.instagram.com/jualmartabakenakbekasi/,jualmartabakenakbekasi,2,081110432991,b'Jual Martabak Enak 08111043299Pondok Ungu Permai Blok AL (Depan Lapangan Futsal Blok AL) 15.00 - 23.00 GoFood/GrabFood/Google Maps : Martabak Hits08111043299#martabakenak'
https://www.instagram.com/markotang18/,markotang18,15,085769421270,b'martabak kota tangerangSince 2018 15:00 - 23:00 085769421270/085882512367 jl. Kesatria No.27 Batu Ceper Tangerang (samping Polsek Batu Ceper)#markotang'
https://www.instagram.com/martabakjepangjony.tangerang/,martabakjepangjony.tangerang,543,085772760266,"b'TangerangFirst & Best in Tangerang    &  FoodCourt Rame2 Lt 2 D-3,Tangcity Mall 11.00 - 19.30085772760266'"
https://www.instagram.com/marlov.depok/,marlov.depok,789,6285156262584,b'Martabak Marlov!  @martabak_marlov & 16:00  23:00 (Senin Libur)Grabfood & Gofoodwa.me/6285156262584'
https://www.instagram.com/martabakaloyy/,martabakaloyy,29,081310677871,b' Martabak Aloy Depok  : Jl. Tole iskandar No 44.( depan Pom Bensin ) : 021-77834146 : 081310677871 : 16.00 - 23.59Order?  : Via GO-FOOD & GRAB FOODgofood.link/u/LGZ9m'
https://www.instagram.com/martabakoey_depok/,martabakoey_depok,84,081383704252,b'Martabak Oey DepokTersedia : Martabak Pizza Martabak Manis Martabak Tipis / Kering Martabak Mini Martabak TelorTelp. 0813-8370-4252www.martabakoey.com'
https://www.instagram.com/martabakoey_depokverbena/,martabakoey_depokverbena,99,081319473179,"b'martabakoey_depokverbenaMartabak Manis Rasa Mewah,Harga Murah. Terima Order utk Arisan,Pengajian dll. PesanAntar WA: 0813-1947-3179https://maps.app.goo.gl/Yy37t1k3mU7b236V7'"
https://www.instagram.com/martabaksanfranciscobogor/,martabaksanfranciscobogor,50,082113322082,b'martabak San Francisco BogorJl. Jend. Sudirman No. 22(Seberang Gd. Wanita/Bogor Permai) : 082 11 33 22 082 : Gofood & Grabfood'
https://www.instagram.com/orins_martabakpizzabogor/,orins_martabakpizzabogor,617,081214133000,"b'Martabak Pizza Orins BogorCabang pertama martabak pizza orins di Bogor.Jl.Lodaya1.No.4[samping salon fiza]jam buka:11.00-22.00Delivery order:0812 1413 3000, 0859 2134 3000.www.martabakorins.com'"
https://www.instagram.com/martabak_aa_bogor/,martabak_aa_bogor,386,085218233399,b'MARTABAK AARESTO AADELIVERY ORDER-Cabang martabak AA jambu dua-(0251) 8317223-WA 085218233399-Cabang martabak AA cimanggu-(0251) 8331996-WA 085311888899'
https://www.instagram.com/martabaktelorbogor5000/,martabaktelorbogor5000,195,087788792868,"b'Martabak telor bogorOrder via WhatsApp or telephone 087788792868,di tunggu orderan nya ya para Foodies lover '"
https://www.instagram.com/martabakmini_bgr/,martabakmini_bgr,22,088211454563,b'Martabak mini bogorWa : 0882 1145 4563Pengiriman via gojek / cod'
https://www.instagram.com/martabaksfbogor/,martabaksfbogor,9,082113322082,"b'Martabak San Francisco BogorJl. Jend. Sudirman No. 22 , Bogor082113322082'"
https://www.instagram.com/martabaksan/,martabaksan,7,082113322082,b'Martabak San Francisco BogorPelopor martabak modern No. 1Jl. Jendral Sudirman no. 22082 11 33 22 082Buka setiap hari : 12.00-24.00Available on : Go-resto & grab food'
https://www.instagram.com/matbog_/,matbog_,50,6282242866424,b'MARTABAKBOGORAN 14:00 - 00:00 ^ +62822 4286 6424 ( WhatsApp ) Belakang SMPN 2 WELAHAN 100m Ready Delivery'
https://www.instagram.com/martabakmini_bogor/,martabakmini_bogor,43,085781158691,b'Martabak Mini MacoMartabak mini coklatBogorInfo:Pin 7F9D8E85WA 085781158691Price 2k - 5k'
https://www.instagram.com/mukbogor/,mukbogor,2,089525536431,b'Martabak Unyil KhansaMartabak Unyil KhansaCemilan Cepuluh CebelasOrder : 089525536431| WA 08567173788'
https://www.instagram.com/martabakjakartasitubondo/,martabakjakartasitubondo,563,085258951073,b'Martabak Jakarta SitubondoJl. Basuki Rahmat (depan PP. Walisongo) Mimbaan - Panji - Situbondo - Jawa Timur 085258951073Order klik by WhatsAppbit.ly/MartabakJakartaSitubondo'
https://www.instagram.com/martabak_bangkaja/,martabak_bangkaja,181,087809372313,"b'MARTABAK BANGKA JAKARTAJl. Senen Raya, no.62 (Sebelah showroom daihatsu) Open : 12:00 s/d 02:00 WIB. call : 087809372313 : Go-food dan Grabfoodfood.grab.com/id/id/restaurant/martabak-bangka-jakarta-marbaja--senen-delivery/IDGFSTI00001j8v'"
https://www.instagram.com/lapehtaragak.jkt/,lapehtaragak.jkt,90,087883741559,"b'Martabak Mesir Kubang JakartaDijamin lapeh taragak Pemesanan bisa setiap hari.Pengiriman di akhir pekan.Whatsapp : 0878 8374 1559Setiabudi, Jakarta Selatanlinktr.ee/lapehtaragak'"
https://www.instagram.com/martabak_jakarta/,martabak_jakarta,183,085231397090,b'Martabak JakartaContak order marta or tebul085231397090Jl. A. Yani sebelah timur SDLBDepan toko Pradina FloristDeket SMP 3 bondowoso'
https://www.instagram.com/martabak_jakarta_curup/,martabak_jakarta_curup,317,085742971221,b'martabak jakartaMartabak Jakarta CurupJl.Merdeka pasar baru Curup Bengkulu( DEPAN HOTEL WISATA BARU )Buka Pkl.16.00 s/d 22.00 WIB085742971221Owner @iwan_akhmad'
https://www.instagram.com/martabak_jak/,martabak_jak,139,085231397090,b'Martabak JakartaNew accountLokasiJl. A Yani sebelah timur SDLBDepan toko Pradina FloristDekat SMP 3 BondowosojatimContak order WA 085231397090'
https://www.instagram.com/martabak_jakarta_malang/,martabak_jakarta_malang,71,081331181608,"b'martabak_jakarta_malangMartabak & Terang Bulan ""Premium Taste""Jl Raya Pakisaji no.115 (depan Alfamart)MalangSuport by Gofood dan Grabfood 17.00 - 22.30081331181608'"
https://www.instagram.com/martabakindia_jakarta_bung_ali/,martabakindia_jakarta_bung_ali,131,082279829420,b'Martabak india roxi jakartaTerima pesanan:Hub:Wa. :082279829420No Tlpon:085211401178Alamat :jln. Biak roxi jakarta pusat depan goa biliardBung. Ali Roxi '
https://www.instagram.com/martabak_mini_jakarta/,martabak_mini_jakarta,43,085782760697,b'mami jakkhusus PO : 5 porsi gratis ongkir (khusus jakarta)No WA : 085782760697'
https://www.instagram.com/martabakjablayjakarta/,martabakjablayjakarta,79,081292158008,b'Official Martabak JablayMartabak yg beda dari biasanyaJl. Palmerah Barat No.38(Depan Bank Danamon)Open Jam 7 Pagi - HabisStart : 2500/pcsORDER WA : 081292158008'
https://www.instagram.com/martabakshanghai_jakartautara/,martabakshanghai_jakartautara,63,087700112501,b'Martabakshanghai_JakartautaraCemilan Frozen Food-Jakut% HALAL & Higienis dengan bahan yg berkualitasOwner : @miarasita Order Wa : 087700112501Jne/Gojek'
https://www.instagram.com/martabakmini99/,martabakmini99,12,083812778886,"b'MARTABAK MINI 99 JAKARTAMenerima pesanan martabak mini/ Frencaes untuk selengkapnya hubungi nomor kami 083812778886/081317989956/089658886896Halal, Higienis, dan lezat '"
https://www.instagram.com/ayamgepreknyhelen/,ayamgepreknyhelen,100,087777618685,b'AYAM GEPREK NY. HELEN BEKASIAyam Geprek maknyus di Bekasi!Pesan lewat WA087777618685Terima event & Cateringwa.me/6287777618685'
https://www.instagram.com/ayamgeprekbekasi2020/,ayamgeprekbekasi2020,130,089601038790,"b'AYAM GEPREK BEKASIMAKAN BERKAH MAKAN SEMBARI SEDEKAH#Rajanya #Geprek~Gofood~ Halal dan Terenak se-bekasi....~ #089601038790, #081290160325~ayam-geprek-bekasi.business.site'"
https://www.instagram.com/bobeto_ayamgeprek_bks/,bobeto_ayamgeprek_bks,99,081280023418,b'Ayam geprek bobeto bekasiAyam geprek dengan berbagai varian sambalInfo dan order :081280023418'
https://www.instagram.com/catering.bekasi/,catering.bekasi,308,082244333092,"b'paket super pedas, ayam geprekBekasi, JakartaPengiriman Gojek&GrabFREE ONGKIR min pembelian 30boxGRATIS 1box min pembelian 20boxWA = 082244333092LINE = fitrianingrose'"
https://www.instagram.com/geprekmercon/,geprekmercon,126,082122790404,b'Ayam Geprek Mercon BEKASI Weekdays: 17.30 - 22.00Weekend: 17.30 - sold outRuko Harapan Indah blok BB no 6A/7 (Depan Salon Ladibi) 0821.2279.0404 0821.1473.4630'
https://www.instagram.com/bandarayamtangerang/,bandarayamtangerang,14,08129523581,"b'   Kuliner Elit, Harga Irittt    &  Terima Orderan Untuk Acara Formal maupun Informal by wa: 08129523581'"
https://www.instagram.com/novaa_novia/,novaa_novia,332,6285229535665,b'ayam geprek TangerangMelayani pesanan wilayah tangerang dstNo wa : +62 852-2953-5665'
https://www.instagram.com/geprekanmu/,geprekanmu,383,082114259862,"b'Ayam Geprek Bintaro - TangselAyam Geprek Original & Kuah KariPre-Order H-2 DM/WhatsApp: 082114259862..Bintaro Sektor 9, Tangsel'"
https://www.instagram.com/ayamgeprekmaster.depok/,ayamgeprekmaster.depok,193,081336989173,"b'Ayam Geprek Master DepokMaster nya Ayam Geprek!We are Available at Gofood & Grabfood  Jalan R. Sanim, Ruko Lemirage Centre Point , Tanah Baru - Depok 081336989173'"
https://www.instagram.com/ayam.geprekdepok/,ayam.geprekdepok,35,628776985877,b'AYAMGEPREKDEPOKWhatsaap +62 8776985877'
https://www.instagram.com/ayamgeprekdepok_id/,ayamgeprekdepok_id,86,085691156050,b'i am and Mie Geprek (ID AYAM)When the sambals and friedchicken burn your mouth with love  : Jakarta : BCAFor order Eci 085691156050'
https://www.instagram.com/ayamgefreakdepok/,ayamgefreakdepok,69,085773878668,b'Ayam Geprek Depok Open Order : 09.00 - 17.00 Off Order tiap hari Jumat COD Depok Kota dan CibuburFor information and order : : 085773878668 (WA)'
https://www.instagram.com/doyanayam_depok/,doyanayam_depok,37,089537360166,"b'Doyan Ayam Geprek DepokJln. Abdul Wahab rt 001 rw 009 Sawangan Lama Depok 09-21.00 ( Buka Setiap Hari ). GO/Grab-Food: Doyan Ayam order via WA 0895373601666, klik bit.ly/ChatWaDoyanAyamDepok'"
https://www.instagram.com/misscemildepok/,misscemildepok,57,089614527809,b'Ayam geprek baso aci & seblak 11.00 - 20.00 Wa 089614527809 Take away - cod - anter - go food - grab food Jalan pulo mangga grogol depok @cahayasafitri29'
https://www.instagram.com/ayamgepreksigendut.depok/,ayamgepreksigendut.depok,103,081511890888,"b'Ayam Geprek Si Gendut DepokSUDAH Tersedia diGrabFoodGoFood""Ayam Geprek Si Gendut Depok""Utk Pemesanan Hub 081511890888'"
https://www.instagram.com/menuwag/,menuwag,38,085747317197,"b'Warung Ayam Geprek Depok-All you can eat, all you can drink-Member of @ayamgeprek.idMENU OF WAGWE ARE OPEN16.00-22.30085747317197'"
https://www.instagram.com/dapur.annisa.depok/,dapur.annisa.depok,108,08988936502,"b'ayam geprek. popcorn.sesuap kebahagiaanmade by PO.WA 0898-8936-502 Margonda Raya, Pondok Cina. Depokowner @nuranisaaa'"
https://www.instagram.com/ayamgeprekcoet/,ayamgeprekcoet,32,083113131523,b'ayam geprek coet depokBuat yang ingin memesan ayam geprek coet baik untuk di kosonsumsi sendiri atau untuk acara bisa langsung wa 083113131523.khusus depok'
https://www.instagram.com/ayamgeprekdepok/,ayamgeprekdepok,46,6285655588699,b'AyamGeprek28ASiap kirim dan PesanGrabFood : Ayam Geprek 28AWhatsApp +6285655588699Yahyanuih 28A DepokGooglemaps Ayam Geprek 28A#testiAyamGeprek28A'
