https://www.instagram.com/ciramdepok/,ciramdepok,64,082311635232,b'Cireng Rujak Siram Depok s -  Payment BCA only WA 0823-1163-5232 SHOPEE : Klik Link di BioSemua Ready Tanpa Bahan Pengawetlinktr.ee/ciramdepok'
https://www.instagram.com/rujakcirengdepok/,rujakcirengdepok,77,089799663162,b'Rujak CirengRasakan sensasi rujak cireng dengan harga yang murah asli buatan rumahan.#rujakcirengdepokWA: 0897-9966-316 atau klik dibawah ini :bit.ly/2vjIVdV'
https://www.instagram.com/rujakcingursaw/,rujakcingursaw,99,085230508886,"b'Rujak Cingur Sawangan Depok : 10.00 - 21.00, Kamis Libur : 085230508886Order Via Go-Food ""Sego Sambel Khas Jawa Timur""Sawangan, DepokPerum Sawangan Permai Blok F1 nomor 5'"
https://www.instagram.com/cirengrujakdepok/,cirengrujakdepok,72,085892980852,"b'cirengrujakdepokJual Cireng Rujak, enak, gurih, Dan Mantul Rasanya. For order please wa 085892980852 or klik by shopee shopee.co.id/sriehutary'"
https://www.instagram.com/singkongrujakdepok/,singkongrujakdepok,42,082129752883,"b'Cemilan IndoAdmin Wa 0821-2975+2883Keripik singkong Rujak Depok akan membuat kalian ketagihan, coba ajah dulu, ketagihan kemudinashopee.co.id/litatardiyanti'"
https://www.instagram.com/rujakbangkokdepok/,rujakbangkokdepok,23,6285156248347,"b'@Saung_AmahRujak Bangkok DepokPondok Cina, DepokOrder api.whatsapp.com/send?phone=6285156248347'"
https://www.instagram.com/rujak_riyan_depok/,rujak_riyan_depok,2,089539526170,b'rujak_riyanMinat? Dm ajahWa: 0895395261701'
https://www.instagram.com/keripiksingkongbumburujakdepok/,keripiksingkongbumburujakdepok,105,085889056536,b'KERIPIK singkong bumbu rujak#suplayerkeripikdepok#oleholehdepok#produsenkeripikpedas#produsenkeripikbumburujak#anekaolahansingkongDepok-indonesia085889056536wa.me/6285889056536'
https://www.instagram.com/rujakdj_depokjaya01/,rujakdj_depokjaya01,23,083806024953,b'Mas ajizMenyediakan rujak serut rujak iris sop buah dan juice buahJl.irian jaya depok jaya pancoran mas depokWa-083806024953'
https://www.instagram.com/ay_tomyam/,ay_tomyam,98,089862996080,b'SUKI TOMYAM DEPOK Open reseller wa 08986299608GOSEND/COD/JNE YES BCA / BRIMampang DepokJl Dahlia raya RT 003 RW 003 no 27'
https://www.instagram.com/tumaritiscake/,tumaritiscake,585,081384235002,b'Toko Kue DepokBaked with .Ingin pesan? Telp & WA 0813-8423-5002 Cilodong - Depok.Follow Our Owner @sundari_tumaritiscake.facebook.com/TumaritisCake'
https://www.instagram.com/kuebaloklegendadepok/,kuebaloklegendadepok,742,6285156338328,"b'KUE BALOK LUMER DEPOK""Tak Harus Pergi ke Bandung"".Selasa-Minggu 13.00-21.00Senin Tutup.GoFood? Klik Order Food.Reseller? Pesanan untuk acara? Klik WA.api.whatsapp.com/send?phone=6285156338328'"
https://www.instagram.com/madinah.cookies/,madinah.cookies,46,089881398966,b'KUE KERING COOKIES DEPOKMADINAH.COEnjoy every bite... DEPOK 0898-8139-896wa.me/628988139896'
https://www.instagram.com/kuebalok_kangmuss_dpk/,kuebalok_kangmuss_dpk,47,081310297505,"b'Kue Balok Kang Muss DepokNIKMATNYA MENGHANTUI 12.00 - 20.00 WIB 081310297505 Jl. Raya Ciputat Parung Km. 24 No. 22 Bojongsari, Depok.Tersedia di GoFood dan GrabFood '"
https://www.instagram.com/kueorangdepok/,kueorangdepok,164,081287344470,"b'Makanan Khas Tempo DuluHomemadeDijamin 100% HALALTerima Pesanan untuk Acara Hantaran Pernikahan, Arisan Keluarga, Bingkisan, dllOrder Via DM atauWA081287344470www.instagram.com/kueorangdepok'"
https://www.instagram.com/arnbcookies/,arnbcookies,32,089686773199,b'kue dan snack DepokMeyediakan berbagai macam kue dan Snackinfo pemesanan : 089686773199'
https://www.instagram.com/syaracnk/,syaracnk,15,6285797120449,b'Syara toko kue DepokWa me +6285797120449Pemesanan H-3'
https://www.instagram.com/dapur_sc/,dapur_sc,313,085624605433,"b'Toko Kue Depok Instagram customized cake : @sophisticakes_scLINE : @sophisticakesWhatsApp : 085624605433No DM pleaseJalan Asmawi 62 Kukusan, Beji, Depok'"
https://www.instagram.com/tokokueyuendepok/,tokokueyuendepok,86,6281318611078,"b""Yuen's bakery100% halal Cake, Cookies, Bread Grabsend, Gosend, PaxelKontak Pemesanan Wa only +6281318611078Made by order..always fresh..premium goods"""
https://www.instagram.com/dapurdepok/,dapurdepok,140,08979567145,"b'kue lebaran dan pie susu enakYou can get what u need guys Fresh, Healthy, and make a happiness  WA : 0897-9567-145#jajanandepokenak #kuelebaranjakartafacebook.com/dapurdepok'"
https://www.instagram.com/kuelumerr/,kuelumerr,13,081384685356,"b'CAKE LUMER DEPOKDepok, IndonesiaHOMEMADESize cup= S, M & L Delivery order via:Go-send or COD (sesuai kami) Available order via:WA (0813-8468-5356) & DM'"
https://www.instagram.com/tokokueulangtahundepok/,tokokueulangtahundepok,378,089655000220,"b'Laily BakeryJl tole iskandar, DepokAsk/Order 0896 55 000 220'"
https://www.instagram.com/dus_kue_tinggi_depok/,dus_kue_tinggi_depok,37,08973333281,b'Dus Kue TinggiMenjual dus tinggi untuk kue bahan corrugatedLokasi DepokOrder WA 08973333281'
https://www.instagram.com/gathanbakery/,gathanbakery,356,081284994005,b' kue enak depokkota DepokHomemadeTanpa bahan pengawetOrder H-1Info whatsapp only  081284994005'
https://www.instagram.com/kuekering.depok/,kuekering.depok,55,081316425676,"b'KUE KERING DEPOK TERMURAH @kuekering_kuker @testimoni.kuker Homemade 0813-1642-5676Jabodetabek :  Go-Send/Grab  JNE, J&T, Tiki, dan Wahana.ORDERbit.ly/2ssXd7m'"
https://www.instagram.com/jualkuetalamdepok/,jualkuetalamdepok,4,082299017003,"b'jual kue talam DepokJual kue talam Depok, jual kue talam Depok, jual kue talam Depok, jl. Pradana 18 /11 villa pabauaran indah hub.082299017003'"
https://www.instagram.com/catring_depok/,catring_depok,171,089656119818,"b'catring makanan dan kue depokpawon iyeh menyediakan makanan katring untuk pagi,siang,sore silakan yang mau orderbisa langsung hubungi 089656119818/5D881C3E enak lohh'"
https://www.instagram.com/kuetradisionaldepok/,kuetradisionaldepok,13,6289665302244,b'Kue Tradisional Happy shopping Depok Bisa CODOrder Dm atau WA +62 896-6530-2244'
https://www.instagram.com/kuekeringdepok/,kuekeringdepok,80,08980167904,"b'KUE KERING DEPOKKue kering lebaranBahan yg digunakan dijamin aman, rasanya enak..Daerah depok, serius orderBBM: 545800C6WA : 0898-0167-904#kuekeringlebaran '"
https://www.instagram.com/kakakuedepok/,kakakuedepok,30,081905694913,"b'KAKAKUEMenjual Aneka Kue Basah, Kue Kering, Kue Ulang Tahun, Kue Lebaran, dll..Free Ongkir JabodetabekTester? WA ke : 081905694913 / 087771924311 (Rahmah)'"
https://www.instagram.com/madinah.cookies/,madinah.cookies,46,089881398966,b'KUE KERING COOKIES DEPOKMADINAH.COEnjoy every bite... DEPOK 0898-8139-896wa.me/628988139896'
https://www.instagram.com/kuekering.depok/,kuekering.depok,55,081316425676,"b'KUE KERING DEPOK TERMURAH @kuekering_kuker @testimoni.kuker Homemade 0813-1642-5676Jabodetabek :  Go-Send/Grab  JNE, J&T, Tiki, dan Wahana.ORDERbit.ly/2ssXd7m'"
https://www.instagram.com/kuekeringdepok/,kuekeringdepok,80,08980167904,"b'KUE KERING DEPOKKue kering lebaranBahan yg digunakan dijamin aman, rasanya enak..Daerah depok, serius orderBBM: 545800C6WA : 0898-0167-904#kuekeringlebaran '"
https://www.instagram.com/agenkuekeringdepok/,agenkuekeringdepok,15,089081270747,b'bellarosaMau beli aneka macam kue kering utk merayakan lebaran bersama keluarga Anda ? Yuk beli aneka macam kue kering harga grosir 50K - 89K hub. 081270747002'
https://www.instagram.com/anekakuekering.depok/,anekakuekering.depok,47,089684190318,b'Aneka Kue Kering DepokDEPOKToko Kue Online DepokMenjual Macam - Macam Jenis Kue Kering Wa : 089684190318 / 089660069290'
https://www.instagram.com/produsenkuekeringdepok/,produsenkuekeringdepok,15,081294231952,b'Produsen makanan keringjual makanan ringan snack camilanWA: 08129423195 (Didik)bit.ly/2INUUFF'
https://www.instagram.com/bakoel_risoles_depok/,bakoel_risoles_depok,535,089643359142,b'Bakoel Risoles Depok Frozen risoles Salad buah Tahu Bakso udang mix ayam Dimsum Pastel aneka pudding Tumpeng mini dll WA 089643359142 ( NO CALL) DEPOK'
https://www.instagram.com/risoles.ragoutdepok/,risoles.ragoutdepok,33,089512846018,"b'Risoles.ragout.depokRisoles ragout, ragout ayam, ragout sapi, ragout sayuran, salad buah for contact :WA 089512846018Ship - DepokPemesanan dapat melalui : Goje'"
https://www.instagram.com/risolesnampol/,risolesnampol,27,089570299731,b'RISOLES NAMPOL DEPOKWa :0895702997310Line:halimahtusaadah@tusaadahhalimah@risolesnampol'
https://www.instagram.com/dendeng_dapur_unihal_depok/,dendeng_dapur_unihal_depok,98,081212312711,b'Dendeng Batokok&Rendang PdangDendeng Batokok& Rendang*WA 081212312711*Lokasi Depok*Senin-Minggu*Request & PO% Halal dg Bahan kualitas Premium*BISA KIRIM SELURUH INDONESIAbit.ly/2X9cKsOFollowed by risolesmontok'
https://www.instagram.com/dapurab_depok/,dapurab_depok,326,08170098826,"b'Dapur AB DepokOpen PO: Getuk Lindri, Sosis, Tempe Organik, Jamu, Peyek, Cold Pressed JuiceOwned by @wiraniProduk Nafisa, Healthy FoodKukusan, Depokwa.me/08170098826'"
https://www.instagram.com/dapur_arrumi/,dapur_arrumi,985,082113629240,b'DAPUR ARRUMI . Jakarta & DepokPremiun Chiffon CakeHigh Recommended100% HALAL Homemade tanpa PengawetCitayam DepokWA: 0821 1362 9240www.tokopedia.com/dapurarrumi'
https://www.instagram.com/dapurmamandoet/,dapurmamandoet,47,081319917165,b'Dapur Mama Ndoet DepokOrder Via Wa/Dm [081319917165]Perum Nuansa Depok 99 blok A no 10Cook by : Mama Linda Silaen Polnaya'
https://www.instagram.com/dapur_euceu_depok/,dapur_euceu_depok,59,081201025082,"b'Dapur CeuceuPengiriman : GoSend, J&T, JNETransfer BNI : 0768417396Mandiri : 1330016359481BRI : 081201025082533'"
https://www.instagram.com/dapurmama_depok/,dapurmama_depok,7,089611497947,"b'Dapur Mama DepokTerima Pesanan untuk arisan, acara keluarga dll.Info : 089611497947 BRI & BCAPesanan selalu fress karna di buat setelah orderan masuk'"
https://www.instagram.com/dapur_ratuicip/,dapur_ratuicip,161,081295224549,b'Dapur Ratu Icip (Depok)Menyediakan berbagai masakan dan snack (kue-kue) u/ berbagai acara. Dimsum juga tetap ada ya dibuat saat open orderTlp/sms - whatsapp :081295224549'
https://www.instagram.com/dapurdepok/,dapurdepok,140,08979567145,"b'kue lebaran dan pie susu enakYou can get what u need guys Fresh, Healthy, and make a happiness  WA : 0897-9567-145#jajanandepokenak #kuelebaranjakartafacebook.com/dapurdepok'"
https://www.instagram.com/bebekemakdepok_/,bebekemakdepok_,402,087880966405,b'Dapur Emak DepokMitra Bebek Emak DepokWelcome reseller Dan marketerWa 087880966405www.galleryryamah.com'
https://www.instagram.com/dapurnyai09/,dapurnyai09,46,081315628351,"b'DAPUR NYAI (Depok - Tangerang)Jual aneka masakan & snackMasakan Rumahan, buatan sendiri, insyaAllah halal dan non msg Wa : 081315628351'"
https://www.instagram.com/dapur_mamih_depok/,dapur_mamih_depok,531,081219452295,b'Ela NugrohoTumpeng tumpengmini nasikebulinasiKuning paketaqiqahnasibox#dapurmamihdepok#tumpengnasikebuli#nasikebulidepok081219452295Pemesanan H-5'
https://www.instagram.com/dapur_depok/,dapur_depok,36,081210237167,b'DAPUR DEPOK1. Untuk pemesanan dapat dilakukan sehari sebelumnya sampai dengan jam 22.00. Transfer ke BCA 2671452544 an Achmad Teguh Santoso2. Wa 0812 1023 7167'
https://www.instagram.com/nasikuningbox.depok/,nasikuningbox.depok,676,082152697171,"b'Dapur_De_Tellonasi box, nasi kuning, pisang nuggetTerima pesananWa. 082152697171Lokasi : jl. Atim emat, cilodong, depok jabar#pisangnugget #pisangnuggetdepokbit.ly/Langsung_Order'"
https://www.instagram.com/dapurelis_/,dapurelis_,87,083874392845,"b'Dapur Elis DepokBUBUR MANIS, SIOMAY, SNACK BOXMade by orderOpen for Reseller HALALOrderWA : 083874392845 Depok, Indonesia'"
https://www.instagram.com/dapurara.depok/,dapurara.depok,523,081380731566,"b'DapuRara Bolketem , Birthday Cake , Pastry , Snack Box , Cookies WA 081380731566 BCA Grand Depok City , Depok Delivery Gojek , Kurir khusus kuewww.facebook.com/anna.rahmawati.750'"
https://www.instagram.com/dapur_erita/,dapur_erita,450,6287869254533,"b'Frozen Food Jakarta DepokPaxel, jet, Gosend, Grab.Produsen berpengalaman.#frozenfoodJakarta #halal #frozenfoodbdg #snackbeku #siapsaji #fastfoodsehat #lauksehat.WA wa.me/6287869254533'"
https://www.instagram.com/dapurmonaz/,dapurmonaz,218,089536007541,b'DESSERT BOX DEPOKSince 2019- HomemadeTestimonials Check in our highlight! Payment BCA/BNI Via Dm/ WA (0895360075417)Shopee : dapurmonajGrab/Gojekwww.tokopedia.com/dapurmonaj'
https://www.instagram.com/dapurismi_depok/,dapurismi_depok,751,082185622290,"b'Dapur Ismi Menerima orderan catering harian, nasi box , tumpeng & Desserts..Call / Chat 082185622290Bisa di order juga di Gojek @Cateringdapurismi '"
https://www.instagram.com/dapur_ibu_rn/,dapur_ibu_rn,133,089692458880,"b'RICE BOWL& NASI BAKAR DEPOKMumer,porsi mantep,bikin nagih.PemesananWA:089692458880Go Food : Dapur ibu RNJLn.Musi XI (ujung) Rt3/Rw2 No 104F kec Sukmajaya'"
https://www.instagram.com/dapurmimadepok/,dapurmimadepok,26,085777875368,b'by mima#makananbymimaHome made 100%Owner @dapur_mima52Order via WhatsApp :085777875368085780135759Go food - coming soon'
https://www.instagram.com/ayambakar.depok/,ayambakar.depok,76,081807355227,"b'Dapur BunzieCek Highlight for Menu Wa : 081807355227 Jl. Arjuna 1 No.10, Mekarjaya, Sukmajaya DepokSekitar sukmajaya depok 2 free antar'"
https://www.instagram.com/dapur_majol/,dapur_majol,50,080015000821,"b'Dapur Majol, DepokMasakan RumahPesan Hari Ini, Besok diAntar : 08.00 - 15.00 : (WA) 082110917797 : Mandiri / BCA : Gosend / Grabsend'"
https://www.instagram.com/cuanki_dapurbunda_depok/,cuanki_dapurbunda_depok,81,082117261664,b'Cuanki Dapur BundaAgen Cuankie Dapur Bunda DepokOrder/PreOrderWa 082117261664Open Reseller Depokshopee.co.id/product/46270961/3920190676?smtt=0.0.9'
https://www.instagram.com/dapur_vie/,dapur_vie,404,6285290068500,"b'Cibinong, Bogor, Depok, JktAll products are made by order- Eclair cake- Cake tape keju- Brownies (bisa kirim luar kota)- etc fast response klik api.whatsapp.com/send?phone=6285290068500'"
https://www.instagram.com/dapurcokelatdepok/,dapurcokelatdepok,2,081295186608,b'Dapur Cokelat DepokUntuk yang mau order bisa chat ke :Wa  0812 9518 6608Bisa juga melalui GrabFoodatau di website kami www.dapurcokelat.com'
https://www.instagram.com/dapurrumahdepok/,dapurrumahdepok,111,6281291018784,"b'CATERING dan SNACK DEPOKMenerima Catering harian untuk Keluarga dan Karyawan, serta Cemilan Rumahan untuk yang suka nyemil tapi malas membuat Dapurnya ~> Cak Anand DEPwa.me/6281291018784'"
https://www.instagram.com/dapur_yenny_/,dapur_yenny_,71,081804059292,b'yenny effendi - depok081804059292'
https://www.instagram.com/dapur.mamadepok/,dapur.mamadepok,77,6281299313993,"b'Dapur MamaJl. Lafran Pane 7B TuguDepokAdmin 1 +6281299313993Admin 2 +6281585392925Catering harian,Nasi BoxDekorasi engagement, Khitanan, birthday'"
https://www.instagram.com/dapur.ajimey/,dapur.ajimey,178,081288908404,"b'CATERING DEPOK Dapur Hj. Maysaroh 0812 8890 84040822 9932 9116For Fast Respon, reach us thru WA'"
https://www.instagram.com/pempekdepok_/,pempekdepok_,89,081385128322,"b'PempekDepokbuTitiekMenerima pesanan pempek, Tekwan dan snack untuk pesta.HP 081385128322'"
https://www.instagram.com/pempeklaopan_depok/,pempeklaopan_depok,122,085693532736,b'Pempek LaoPan DepokOPEN PO UNTUK 19 Agustthe literal translation of laoban = old bosss e j a k 2014order : DM or WA 0856 9353 2736Pengiriman: GOJEK/GRAB/JNE YESwa.me/6285693532736'
https://www.instagram.com/pempekiburos/,pempekiburos,57,081287999219,"b'Pempek DepokCitayam,Depok,Indonesia.Pengiriman menggunakan gojek/grab081287999219'"
https://www.instagram.com/pempekbunhan/,pempekbunhan,224,6281213617468,b'Pempek bunhan depokPempek Bunhan DepokAsli Ikan Tenggiri PilihanOpen Resellerwa.me/6281213617468 untuk pemesanan#PempekFrozen#Tekwaninstan'
https://www.instagram.com/pempek_azka_depok/,pempek_azka_depok,191,082317775200,"b'Azkakitchen_Depok 0823-1777-5200 DEPOK, PITARA'"
https://www.instagram.com/pempekbelledepok/,pempekbelledepok,51,082371166656,"b'PEMPEK BELLE CAB DEPOK""PEMPEK BELLE ASLI PALEMBANG""WA 082371166656DEPOKDIJAMIN HALAL DAN HIGIENISPEMPEK SUDAH DI VACUMOWNER DEPOK @putri.aprilia25'"
https://www.instagram.com/pempeksangprabu/,pempeksangprabu,110,085619587953,b'PEMPEK SANG PRABU - DEPOK Fast respon 07:00 - 18:00 WA : 08561958795 Cabang Depok.Cab. Jakarta :@pempeksangprabu_jakarta.   GOFOODgofood.co.id/jakarta/restaurant/pempek-sang-prabu-pancoran-mas-30ce6172-a386-42d9-8edb-91369198a43e'
https://www.instagram.com/pempeklova_depok/,pempeklova_depok,126,6289510001394,"b'Pempek Lova pempek PalembangHALALTANPA PEMUTIH dan BAHAN PENGAWETCUKO 100% GULA AREN, ASAM JAWA, CABE RAWITJl asrama divisi 1 infanteri depokWa.me/6289510001394'"
https://www.instagram.com/pempekayuklina/,pempekayuklina,529,087882048500,b'Pempek Palembang enak di DepokPempek Ikan tenggiri homemade..In syaa Allah halal dan thoyib..Wa 087882048500Jne & go sendJatijajar.Depok'
https://www.instagram.com/pempeksulthan.depok/,pempeksulthan.depok,22,082133552093,b'Pempek Sulthan DepokPempek Palembang AsliFrozen (Kemasan Vacuum)Tanpa Pengawet dan MSGWhatsApp 0821-3355-2093'
https://www.instagram.com/pempekalicia.depok/,pempekalicia.depok,52,081285179873,b'pempekalicia.depokUntuk pemesananWa 081285179873'
https://www.instagram.com/pempekbelida.depok/,pempekbelida.depok,6,6281319322002,b'Pempek Belida AsliSelalu sedia stock pempek dirumah gaes MOODBOOSTERReseller n dropship welcomeDepokwa.me/6281319322002'
https://www.instagram.com/pakradendepok/,pakradendepok,88,081310002035,b'Pempek Pak Raden DepokJl. Margonda Raya No. 301A Depok Jawa Barat (021)77212900 081310002035'
https://www.instagram.com/pempekpahajidepok/,pempekpahajidepok,25,082114608175,b'Pempek Pa Haji DepokHarga Rp.40.000 / PackIsi 9 :- 5 Kapal Selam- 2 Lenjer- 2 AdaanFor Oder  082114608175 081318103177'
https://www.instagram.com/pempekolindepok/,pempekolindepok,119,085692978281,"b'Pempek Olin Depok : Jl. Palangkaraya No.35, Tugu, Cimanggis, Depok : 0856 9297 8281'"
https://www.instagram.com/dapoer.pempek/,dapoer.pempek,60,085357899971,b'DAPOER PEMPEK DEPOKMade by order (PO)pempek ikan tenggiritekwan ikan tenggirikemplang Tunu + sambelDll.#khaspalembang Order ? Wa. 085357899971'
https://www.instagram.com/pempeksutradepok26/,pempeksutradepok26,70,081317302236,"b'pempeksutradepokProdusen Pempek sutra palembang super DD cabang DepokWa : 0813 1730 2236Depok indonesiaTerima pesanan pesta pernikahan, catering dll'"
https://www.instagram.com/pempekema/,pempekema,74,6282110503762,b'PEMPEK BU EMA DEPOKMENJUAL PEMPEK ASLI PALEMBANG DI KOTA DEPOK | open reseller WA +6282110503762JL. Cengkeh PERUMAHAN BUKIT CENGKEH 2 CIMANGGIS KOTA DEPOK'
https://www.instagram.com/bolu.gulung_depok/,bolu.gulung_depok,144,081284195593,b'Bolu Gulung DepokJual Bolu Gulung PremiumJual Bolu Gulung LembutEnak dimakan saat dinginPRE-ORDER (H-1)Menyediakan Snack BoxWA 081284195593Klik Disini bit.ly/bolugulungdepok'
https://www.instagram.com/bolususubandung_depok/,bolususubandung_depok,123,085688575480,"b'bolususubandung_depokBolu susu bandung ready di depokUntuk wilayah depok dan sekitarnya gak perlu jauh2 lagi buat dapetin oleh2 yg satu iniWA 08568857548, 085777935287'"
https://www.instagram.com/baksodepok/,baksodepok,217,081998082112,b'BASO ACI NOVASInfo order BAKSO ACI NOVAS KHAS GARUT:Line : iqbal17081998New W. A admin BASO ACI DEPOK :082112313995'
https://www.instagram.com/baksotitotidepok/,baksotitotidepok,78,081296046918,b'Bakso Titoti DepokWa 081296046918'
https://www.instagram.com/bakso_sabrina_depok/,bakso_sabrina_depok,37,085881312484,"b'Bakso Sabrina DepokBakso enak, ya Bakso SABRINAContact : 085881312484 : Open order 7am - 12pm : Minggu Libur : Ready Stok : Jl. Maliki I RT 06 RW 02 No. 84'"
https://www.instagram.com/baksosawangan/,baksosawangan,51,087777884726,b'Bakso Homemade DepokBakso homemade yang fresh dan lezat!Order by WA: 087777884726 / 0895 3356 55686Kita tunggu ordernya ya! www.tokopedia.com/lemonadeart/etalase/bakso-homemade'
https://www.instagram.com/tobeeftahubakso/,tobeeftahubakso,39,085799033818,"b'TOBEEF TAHU BAKSO DEPOKDepok, Jawa Barat 24 Jam 0857-9903-3818 (Whatsapp only) BNI, BRI, BCA, MandiriPengiriman via JNE, J&T, PaxelO R D E R N O W    linktr.ee/Tobeef'"
https://www.instagram.com/baksojenius_depok/,baksojenius_depok,60,6281389658039,"b'Bakso Jenius, Kalimulya DepokDepok BAKSO POLOS BAKSO KEJU BAKSO RAWIT BAKSO TELOR BAKSO URAT BAKSO + INDOMIE Available on GoFood & GrabFoodapi.whatsapp.com/send?phone=6281389658039'"
https://www.instagram.com/lamak_bywiliparadika/,lamak_bywiliparadika,76,6282216555354,b'Bakso aci depokBuatan dapur by @wiliparadikaResep turunan keluarga (minang kental) & milenial.Halal JAKSEL - DEPOKTokopedia : Lamak_bywiliparadikaOrder DM api.whatsapp.com/send?phone=6282216555354&text=Nama+%3A%0AAlamat+%3A%0ABarang+Pesanan%3A%0ANo.Hp+%3A%0A'
https://www.instagram.com/bensubaksomargondadepok/,bensubaksomargondadepok,121,081219511833,"b'Bensu Bakso Margonda DepokBuka Jam 11:00 - 21.00 WIB (sementara)Jl. Margonda Raya No.514, Pondok Cina, Kecamatan Beji, Kota Depok, Jawa Barat 16424.No. HP/WA : 081219511833'"
https://www.instagram.com/ciomy.ind/,ciomy.ind,77,081908272732,"b'Bakso Aci Sehat | Ciomy Depok Pelopor Bakso Aci Sehat dan Halal Bakso Aci Full Daging Rempah, tanpa MSG, menggunakan garam Himalaya. Store di Citayem,Depok,Bogorwa.me/081908272732'"
https://www.instagram.com/baksoseafoodfrozendepok/,baksoseafoodfrozendepok,18,087880643713,b'Bakso Seafood DepokNDASKAN FROZEN FOODDapatkan mix Bakso Seafood Frozen lezat dengan harga menarikORDERWA 087880643713BB D46065E6'
https://www.instagram.com/bakso_rusuk_depok/,bakso_rusuk_depok,159,081297719060,b'Bakso Rusuk Goyang Lidah jl. Sentosa raya no.2A (samping bakmi margonda depok 2)  Order via Sms/WA 08129771906 & 082110398466'
https://www.instagram.com/baksoidolacipayung12/,baksoidolacipayung12,16,087796856516,"b'Gudang Bakso Sapi DepokBerdiri Sejak Tahun 1980, BAKSO IDOLA WONOGIRITersedia Bakso, Mie Ayam & Soto MieGRAB FOOD & GO FOODCipayung-Depok, Jawa Barat0877-9685-6516api.whatsapp.com/send?phone=6287796856516&text=Halo+Saya+Ingin+Memesan+Bakso+Sapi+Gurih+Ini'"
https://www.instagram.com/nasitumpengdepok/,nasitumpengdepok,214,081290801259,b'Nasi Tumpeng DepokJual nasi tumpeng menyediakan : Paket 10 porsi Paket 20 porsi Paket 30 porsi Paket 50 porsi 0812-9080-1259 PESAN ANTAR #nasitumpeng'
https://www.instagram.com/jualtumpengdepok/,jualtumpengdepok,72,6281290801259,b'Nasi tumpeng DepokJual Nasi Tumpeng Paket 10.Porsi Paket 20.Porsi Paket 50.PorsiPESAN ANTAR#nasitumpeng #tumpengmini #tumpeng #tumpengultahORDER KLIKwa.me/6281290801259'
https://www.instagram.com/jualnasitumpengdepok/,jualnasitumpengdepok,174,081290801259,b'nasi tumpeng depokJual nasi tumpeng menyediakan paket 10.porsi Paket 20.porsi Paket 30.porsi Paket 50.porsi 0812-9080-1259 PESAN ANTAR #nasitumpeng'
https://www.instagram.com/nasitumpengmurahdepok/,nasitumpengmurahdepok,96,6281290801259,b'Jual Nasi Tumpeng DepokJual Nasi Tumpeng Paket 10.Porsi Paket 20.Porsi Paket 50.PorsiPESAN ANTAR#nasitumpeng #tumpengmini #tumpeng #tumpengultahORDER KLIKwa.me/6281290801259'
https://www.instagram.com/nasikebulibunda_depok/,nasikebulibunda_depok,495,081294430199,b'Nasi kebuli bunda Depok*Terima pesanan*Paket nampanPaket aqiqahPaket prasmananAcara kantorAcara pengajianAcara mauliddllInfo081294430199/085664963499'
https://www.instagram.com/nasi_kebuli_depok/,nasi_kebuli_depok,51,082161870043,b'Nasi kebuli uncu oktaTerima pesananWa 082161870043l.instagram.com/?u=https%3A%2F%2Fwww.youtube.com%2Fchannel%2FUChJC0E8kao2sEDNQkx3xO2g&e=ATM9zCPJmF_p1859fuE5Hjdk1nuyHkoCfVtFPtIzCI8DTnVtEHbF2IEbQu7jlP9yMFrTY6u2kK3UwCFnMiIqfw&s=1'
https://www.instagram.com/nasiboxmurahpitaradepok/,nasiboxmurahpitaradepok,290,083807920605,b'nasi box murah pitara depokJual nasi box melayanisarapancatering kantor&sekolahnasi box/snack box & TumpengBisa untuk BerlanggananTlp/wa:083807920605Pitara Depok'
https://www.instagram.com/nasitumpengdepok/,nasitumpengdepok,214,081290801259,b'Nasi Tumpeng DepokJual nasi tumpeng menyediakan : Paket 10 porsi Paket 20 porsi Paket 30 porsi Paket 50 porsi 0812-9080-1259 PESAN ANTAR #nasitumpeng'
https://www.instagram.com/jualtumpengdepok/,jualtumpengdepok,72,6281290801259,b'Nasi tumpeng DepokJual Nasi Tumpeng Paket 10.Porsi Paket 20.Porsi Paket 50.PorsiPESAN ANTAR#nasitumpeng #tumpengmini #tumpeng #tumpengultahORDER KLIKwa.me/6281290801259'
https://www.instagram.com/nasimentaidepok/,nasimentaidepok,149,6281280922067,b'Nasi Mentai Depok HALALHALAL Nasi Mentai DepokWe use halal products only.SMS/WA: +6281280922067Or click link below bit.ly/3kEVHIS'
https://www.instagram.com/jualnasitumpengdepok/,jualnasitumpengdepok,174,081290801259,b'nasi tumpeng depokJual nasi tumpeng menyediakan paket 10.porsi Paket 20.porsi Paket 30.porsi Paket 50.porsi 0812-9080-1259 PESAN ANTAR #nasitumpeng'
https://www.instagram.com/nasi.mandhi.depok/,nasi.mandhi.depok,16,081387847712,"b'Nasi Mandhi DepokNasi Mandhi & Nasi Kebuli Fresh homemade Pre-Order H-1, max jam 12 siangMampang Indah DepokBank Mandiri0813 8784 7712 atau klik link inibit.ly/NasiMandhiDepok'"
https://www.instagram.com/nasitumpengmurahdepok/,nasitumpengmurahdepok,96,6281290801259,b'Jual Nasi Tumpeng DepokJual Nasi Tumpeng Paket 10.Porsi Paket 20.Porsi Paket 50.PorsiPESAN ANTAR#nasitumpeng #tumpengmini #tumpeng #tumpengultahORDER KLIKwa.me/6281290801259'
https://www.instagram.com/mamitacatering_bynfs/,mamitacatering_bynfs,636,081287780001,b'CATERING NASI BOX DEPOKCheck @rumahayam_mamita@rumahfrozenfood_mamitaNasibox & snackboxMenu ungkepKentang mustofaCookies lebaranWhatsapp : 081287780001Depok 2api.whatsapp.com/send?phone=6281287780001&text=assalamu%27alaikum'
https://www.instagram.com/nasikuningbox.depok/,nasikuningbox.depok,676,082152697171,"b'Dapur_De_Tellonasi box, nasi kuning, pisang nuggetTerima pesananWa. 082152697171Lokasi : jl. Atim emat, cilodong, depok jabar#pisangnugget #pisangnuggetdepokbit.ly/Langsung_Order'"
