https://www.instagram.com/sorban_import/,sorban_import,827,6281229569299,b'Sorban ImportSorban Mewah Import Barang Langka & BertuahKitab Murah ImportDll yang dahsyat-dahsyat Wa: +6281229569299 Klik link bawah ini:www.arabiatastore.com'
https://www.instagram.com/siti_shop_grosir/,siti_shop_grosir,256,6285717022048,"b'Ummi khadziq llPengganti @ummi_khadziqBarang Antik Lokal & Timur Tengah Kirim ke seluruh Indonesia-Mancanegara BCA, BRI, BNI, WU+6285717022048 (wa only)www.arabiatastore.com'"
https://www.instagram.com/hana_elco/,hana_elco,187,081230899905,b'ElcometerAuthorised gracoAuthorised elcometerKami juga menyediakan alat alat sandblasting dan paintingPlease wa dan call 0812 3089 9905'
https://www.instagram.com/yeyeherba/,yeyeherba,242,085613777330,b'Yeye Herba WhatsApp : 08561377733Open untuk Reseller Jam kerja : Senin -Jumat : 08:00 s/d 16:00 soreSabtu : 08:00 s/d 14:00 siangwww.yeyeherbal.com'
https://www.instagram.com/awaludin_store/,awaludin_store,534,087780183242,b'The Awaludin StoreAhlu Sunnah Wal JamaahTraditional Muslim Style NusantaraTHEAWALUDINSTOREJAKARTA INA.Whatsapp 087780183242'
https://www.instagram.com/saffana_herbal/,saffana_herbal,461,082116959134,b'distributor_herbal_jakarta*Sedia macam2 produk herbal WA : 082116959134 JAKARTA BCA BRI MAN JNE JNT POS GOJEKDropship 100% AMAN'
https://www.instagram.com/rumah.loka/,rumah.loka,519,6285772906968,b'Rumah LokaLoka PadangPadang Vegan Pertama di Jakarta Sudirman Park Blok C.27 FoodHall GIOrder via DM / WA: +62 857-7290-6968linktr.ee/lokapadang'
https://www.instagram.com/foodbycai/,foodbycai,538,6281398823838,b'Cai | Plant BasedPlant Based Comfort FoodHome-cooked meals by vegan cousins Noodles Rice Broth DrinksDelivery by Pre-Orderwa.me/6281398823838'
https://www.instagram.com/bangkid.konveksi/,bangkid.konveksi,14,085893499242,"b'Bangkid KonveksiCustom Sablon,Topi, Celana, Kaos, Jaket, Kemeja, Tote Bag WhatsApp: 085893499242or click to chatbit.ly/BangkidKonveksi'"
https://www.instagram.com/anjalivegan/,anjalivegan,793,6287885066018,b'WARVEG ANJALI[WARUNG VEGAN ANJALI] Jalan Taman Semanan Indah blok G/5 +62 878 85066018'
https://www.instagram.com/kantin_pafu/,kantin_pafu,976,082176401278,"b' Jual Makanan Vegetarian Sungailiat , BabelLine : yiichang2WA : 0821-7640-1278BBM : 595eca9epengiriman.seluruh.indonesia'"
https://www.instagram.com/rumahsayuroni/,rumahsayuroni,718,081929088887,b'UNCLE SAYUROpen PO 2x seminggu SAYUR BUMBU & REMPAH BUAH DAGING OLAHANWA : 081929088887 / 087720170880Delivery setiap Rabu & Sabtu'
https://www.instagram.com/loving.hut.denpasar/,loving.hut.denpasar,830,089995000771,"b'Loving Hut Denpasar BaliPertokoan Sudirman Agung B 12A, Denpasar,0361- 241035WA : 0899-9500-077Open : 10.00 - 19.00https://goo.gl/maps/Rj9DXNbVMvkfk9WG8'"
https://www.instagram.com/sobatgift.qu/,sobatgift.qu,11,6285156969543,"b'home decor | Birthday GiftQuality Custom PillowsQuality Printing Free DesignWedding Gift, Couple Gifta gift for someone dearOrder by RequestShipping From Jakartawa.me/6285156969543'"
https://www.instagram.com/wungu_store/,wungu_store,37,081310290637,"b'Dapur_QtaaKesehatan/kecantikan/fashionAgen Resmi HNI hpaiAgen Resmi Natura WorldPerumahan GPG I, Mustikajaya - Bekasi Timur. WhatsApp 081310290637'"
https://www.instagram.com/mak_ovin/,mak_ovin,346,087870936804,"b'MAK OVINPastel Semok Mak Ovin, Lemper, Roti Goreng Sosis, Risol Mayo/Ragout, Talam Ubi, dllLayani min. 30 box 08787 0936804 (phone) 08577 6799578 (WA)'"
https://www.instagram.com/collagenclinic.indo/,collagenclinic.indo,452,6282123044565,b'Collagen Clinic IndoAUTHORIZED SELLER WELLOUS MCOLL Collagen tokopedia.com/collagenclinic bukalapak.com/u/collagenclinic wa : +62-821-2304-4565shopee.co.id/collagenclinic.indo?smtt=0.0.9'
https://www.instagram.com/albaraglutenfree/,albaraglutenfree,246,08111820973,"b'Albara Gluten FreePangan Gluten Free/non terigu/non gandum, non 5P, lowsugarSehat berawal dari apa yang anda konsumsiWA : 0811 1820 973Group of Albara'"
https://www.instagram.com/ichantik_icha/,ichantik_icha,653,081382379199,b'Mailiza IchaAtha shop apa aja ada jkt terima pesanan WA 081382379199www.facebook.com/icha.mailiza'
https://www.instagram.com/modernhospitalgz/,modernhospitalgz,397,085211194878,"b'St. Stamford Modern HospitalNo.42, Tianhe District, Lianquan Street, Guangzhou, ChinaBranch Office : Jakarta, Surabaya, MedanHotline: 0852 1119 4878 (call/WA)KONSULTASIapi.whatsapp.com/send?phone=6285211194878&text=Nama+%3A%0ADiagnosa+%3A%0AKota+%3A%0A'"
https://www.instagram.com/butiqginda_silihwangispeed200/,butiqginda_silihwangispeed200,270,081292803739,b'butiqginda_silihwangispeed200Gamis original brandedZaitunspeed200 skincare productsfor fast responseWa 081292803739shopee.co.id/butiq_gamis_ginda'
https://www.instagram.com/mamam_cookies/,mamam_cookies,37,087873215878,"b'mamam cookiesJual kue-kue kering spt nastar, kastengel, semprit, sagu keju dll, bisa satuan.Bahan2 Insya Alloh halal..Utk tanya2 silahkan hub wa 0878-7321-5878'"
https://www.instagram.com/bobayaga.kbnnas/,bobayaga.kbnnas,44,089570311963,b'B O B A Y A G A AUTHENTIC BOBA DRINKOPEN 10.00 - AM 20.00 PMOrder 0895703119632Jln Kebon Nanas Selatan Cipinang Cempedak Jatinegara Jakarta Timurjakarta.com'
https://www.instagram.com/waroengazka17/,waroengazka17,222,089536466212,"b'Waroeng AzkaJualan Ayam Penyet sambel ijo, Chicken Wings, Nasi Kebuli AyamHALALBuka jam 18.00wib - 23.45wibJl. Gang Padesin, Otista, JaktimWA : 0895364662122'"
https://www.instagram.com/daribumi.co/,daribumi.co,209,085738251140,"b'minuman daun kelor 10k/bottle1st jamu kelor in a bottle from Tbnbased Tbn, cod Dpspickup, grab, COD every sabtuhomemade with love&hygieneorder: dm/wa(085738251140)/kliklinktr.ee/hidaribumi.co'"
https://www.instagram.com/weekendbaker_bydhanislicious/,weekendbaker_bydhanislicious,62,087887731265,b'Weekend Baker by DhanisliciousMade by OrderDelivery every Saturday and SundayPre Order max H-3Ph 087887731265 Whatsap only'
https://www.instagram.com/griyaharsi/,griyaharsi,665,082230340650,"b'Griya HarsiNatural Living""A Seed of Love always Grows""Green Gift, Quote and Happy PlantsWA only : 082230340650'"
https://www.instagram.com/betta.betawimodern/,betta.betawimodern,267,081298274652,b'Betta.BetawiModernIkan cupang hias Plakat 081298274652'
https://www.instagram.com/oceano.indonesia/,oceano.indonesia,17,6281952542435,b'Oceano IndonesiaFrozen Seafood Specialist +62 819 5254 2435.Pengiriman dari Jatibening Bekasioceanoindonesia.comFollowed by dapurlokarasa'
https://www.instagram.com/bursum_surupandan/,bursum_surupandan,55,081315411746,b'BUBUR SUMSUM SURUPANDANBubur Sumsum SurupandanSistem Pre-OrderSETIAP JUMAT LIBUR WA : 081315411746OR DM '
https://www.instagram.com/nonakidsfashion/,nonakidsfashion,836,085619892002,"b'NonakidsfashionJual baju anak..murah..berkualitasBobokids, Bambino, Calista, oshkoshSOLD=HAPUSWA 1 : 08561989200WA 2 : 085781011536Shoppe : nonakidsfashion'"
https://www.instagram.com/leche_id/,leche_id,65,6288102574341,b'LECHE | SpaghettiBruleeLimited Slots OnlyOpen Pre-order by WADelivery : MingguClick below to order wa.me/62881025743419'
https://www.instagram.com/jacket_q1/,jacket_q1,48,081391577026,b'Susi123Sedia jacket sweater untuk pria dan wanita harga murah kualitas bagus dan amanahwa.me/081391577026Followed by elikatering'
https://www.instagram.com/ace_rawamangun/,ace_rawamangun,317,082122276363,b'ACE HARDWARE RAWAMANGUN PEMUDAThe biggest hardware store and home improvement lifestyle in Indonesia.Info location: Jl Pemuda no 66-67Telp : 021-47866868WA : 0821-2227-6363acehardware.co.id'
https://www.instagram.com/infokemayoran/,infokemayoran,435,6289519778321,b'infokemayoranInformasi wilayah kemayoran & sekitarnyapunya informasi menarik & bermanfaat ?tag #infokemayoranBersama membangun kebaikan www.infokemayoran.comapi.whatsapp.com/send?phone=6289519778321'
https://www.instagram.com/busana_muslim_2020/,busana_muslim_2020,95,081380105558,b'busana muslimMenjual berbagai macam busana muslim- Peci- Sarung- Sajadah- Baju kokoh- TasbihTRUSTED SELLER !Eceran&Grosir09.00-15.00 : 081380105558'
https://www.instagram.com/kursusbahasaarabdalwa/,kursusbahasaarabdalwa,242,6287777575514,b'Dalwa Center JakartaIttishal Rijaal: Ust.Hafid Attamiimy +62 877-7757-5514Ust.Tholhah +6282119209768Nisa:Ustz Hasanah +6287822052982'
https://www.instagram.com/satomotor.id/,satomotor.id,103,080017009075,b'Sato Motor#jualbelimotor Bekas berkualitas Kondisi motor sangat mulus Bergaransi 3 bln/3.000 km08.00 - 17.00 setiap hariCek harga & stok di katalog OLXm.olx.co.id/profil/?user_id=90753058'
https://www.instagram.com/afwindimsum/,afwindimsum,211,085810645467,"b'halal, enak, higienis High Quality Home Made Jl. raya cilandak kko, jaksel Terima Pesanan, Hajatan, dll Reseller Welcome 085810645467afwindimsum.bussiness.site'"
https://www.instagram.com/nyonyadimsum/,nyonyadimsum,361,082110001070,"b'Appetizer/Snack Made with Love (Frozen Dimsum) Homemade, Halal Dimsum, Tanpa MSG & Pengawet Everyday Delivery Jakarta & Bekasi 0821-1000-1070 (WA only)'"
https://www.instagram.com/sorban_import/,sorban_import,829,6281229569299,b'Sorban ImportSorban Mewah Import Barang Langka & BertuahKitab Murah ImportDll yang dahsyat-dahsyat Wa: +6281229569299 Klik link bawah ini:www.arabiatastore.com'
https://www.instagram.com/siti_shop_grosir/,siti_shop_grosir,256,6285717022048,"b'Ummi khadziq llPengganti @ummi_khadziqBarang Antik Lokal & Timur Tengah Kirim ke seluruh Indonesia-Mancanegara BCA, BRI, BNI, WU+6285717022048 (wa only)www.arabiatastore.com'"
https://www.instagram.com/hana_elco/,hana_elco,187,081230899905,b'ElcometerAuthorised gracoAuthorised elcometerKami juga menyediakan alat alat sandblasting dan paintingPlease wa dan call 0812 3089 9905'
https://www.instagram.com/yeyeherba/,yeyeherba,242,085613777330,b'Yeye Herba WhatsApp : 08561377733Open untuk Reseller Jam kerja : Senin -Jumat : 08:00 s/d 16:00 soreSabtu : 08:00 s/d 14:00 siangwww.yeyeherbal.com'
https://www.instagram.com/awaludin_store/,awaludin_store,536,087780183242,b'The Awaludin StoreAhlu Sunnah Wal JamaahTraditional Muslim Style NusantaraTHEAWALUDINSTOREJAKARTA INA.Whatsapp 087780183242'
https://www.instagram.com/saffana_herbal/,saffana_herbal,462,082116959134,b'distributor_herbal_jakarta*Sedia macam2 produk herbal WA : 082116959134 JAKARTA BCA BRI MAN JNE JNT POS GOJEKDropship 100% AMAN'
https://www.instagram.com/rumah.loka/,rumah.loka,523,6285772906968,b'Rumah LokaLoka PadangPadang Vegan Pertama di Jakarta Sudirman Park Blok C.27 FoodHall GIOrder via DM / WA: +62 857-7290-6968linktr.ee/lokapadang'
https://www.instagram.com/foodbycai/,foodbycai,547,6281398823838,b'Cai | Plant BasedPlant Based Comfort FoodHome-cooked meals by vegan cousins Noodles Rice Broth DrinksDelivery by Pre-Orderwa.me/6281398823838'
https://www.instagram.com/bangkid.konveksi/,bangkid.konveksi,14,085893499242,"b'Bangkid KonveksiCustom Sablon,Topi, Celana, Kaos, Jaket, Kemeja, Tote Bag WhatsApp: 085893499242or click to chatbit.ly/BangkidKonveksi'"
https://www.instagram.com/anjalivegan/,anjalivegan,795,6287885066018,b'WARVEG ANJALI[WARUNG VEGAN ANJALI] Jalan Taman Semanan Indah blok G/5 +62 878 85066018'
https://www.instagram.com/kantin_pafu/,kantin_pafu,976,082176401278,"b' Jual Makanan Vegetarian Sungailiat , BabelLine : yiichang2WA : 0821-7640-1278BBM : 595eca9epengiriman.seluruh.indonesia'"
https://www.instagram.com/rumahsayuroni/,rumahsayuroni,718,081929088887,b'UNCLE SAYUROpen PO 2x seminggu SAYUR BUMBU & REMPAH BUAH DAGING OLAHANWA : 081929088887 / 087720170880Delivery setiap Rabu & Sabtu'
https://www.instagram.com/loving.hut.denpasar/,loving.hut.denpasar,829,089995000771,"b'Loving Hut Denpasar BaliPertokoan Sudirman Agung B 12A, Denpasar,0361- 241035WA : 0899-9500-077Open : 10.00 - 19.00https://goo.gl/maps/Rj9DXNbVMvkfk9WG8'"
https://www.instagram.com/sobatgift.qu/,sobatgift.qu,11,6285156969543,"b'home decor | Birthday GiftQuality Custom PillowsQuality Printing Free DesignWedding Gift, Couple Gifta gift for someone dearOrder by RequestShipping From Jakartawa.me/6285156969543'"
https://www.instagram.com/wungu_store/,wungu_store,39,081310290637,"b'Dapur_QtaaKesehatan/kecantikan/fashionAgen Resmi HNI hpaiAgen Resmi Natura WorldPerumahan GPG I, Mustikajaya - Bekasi Timur. WhatsApp 081310290637'"
https://www.instagram.com/mak_ovin/,mak_ovin,347,087870936804,"b'MAK OVINPastel Semok Mak Ovin, Lemper, Roti Goreng Sosis, Risol Mayo/Ragout, Talam Ubi, dllLayani min. 30 box 08787 0936804 (phone) 08577 6799578 (WA)'"
https://www.instagram.com/collagenclinic.indo/,collagenclinic.indo,452,6282123044565,b'Collagen Clinic IndoAUTHORIZED SELLER WELLOUS MCOLL Collagen tokopedia.com/collagenclinic bukalapak.com/u/collagenclinic wa : +62-821-2304-4565shopee.co.id/collagenclinic.indo?smtt=0.0.9'
https://www.instagram.com/albaraglutenfree/,albaraglutenfree,248,08111820973,"b'Albara Gluten FreePangan Gluten Free/non terigu/non gandum, non 5P, lowsugarSehat berawal dari apa yang anda konsumsiWA : 0811 1820 973Group of Albara'"
https://www.instagram.com/ichantik_icha/,ichantik_icha,653,081382379199,b'Mailiza IchaAtha shop apa aja ada jkt terima pesanan WA 081382379199www.facebook.com/icha.mailiza'
https://www.instagram.com/modernhospitalgz/,modernhospitalgz,397,085211194878,"b'St. Stamford Modern HospitalNo.42, Tianhe District, Lianquan Street, Guangzhou, ChinaBranch Office : Jakarta, Surabaya, MedanHotline: 0852 1119 4878 (call/WA)KONSULTASIapi.whatsapp.com/send?phone=6285211194878&text=Nama+%3A%0ADiagnosa+%3A%0AKota+%3A%0A'"
https://www.instagram.com/butiqginda_silihwangispeed200/,butiqginda_silihwangispeed200,270,081292803739,b'butiqginda_silihwangispeed200Gamis original brandedZaitunspeed200 skincare productsfor fast responseWa 081292803739shopee.co.id/butiq_gamis_ginda'
https://www.instagram.com/mamam_cookies/,mamam_cookies,37,087873215878,"b'mamam cookiesJual kue-kue kering spt nastar, kastengel, semprit, sagu keju dll, bisa satuan.Bahan2 Insya Alloh halal..Utk tanya2 silahkan hub wa 0878-7321-5878'"
https://www.instagram.com/bobayaga.kbnnas/,bobayaga.kbnnas,46,089570311963,b'B O B A Y A G A AUTHENTIC BOBA DRINKOPEN 10.00 - AM 20.00 PMOrder 0895703119632Jln Kebon Nanas Selatan Cipinang Cempedak Jatinegara Jakarta Timurjakarta.com'
https://www.instagram.com/waroengazka17/,waroengazka17,222,089536466212,"b'Waroeng AzkaJualan Ayam Penyet sambel ijo, Chicken Wings, Nasi Kebuli AyamHALALBuka jam 18.00wib - 23.45wibJl. Gang Padesin, Otista, JaktimWA : 0895364662122'"
https://www.instagram.com/daribumi.co/,daribumi.co,208,085738251140,"b'minuman daun kelor 10k/bottle1st jamu kelor in a bottle from Tbnbased Tbn, cod Dpspickup, grab, COD every sabtuhomemade with love&hygieneorder: dm/wa(085738251140)/kliklinktr.ee/hidaribumi.co'"
https://www.instagram.com/weekendbaker_bydhanislicious/,weekendbaker_bydhanislicious,63,087887731265,b'Weekend Baker by DhanisliciousMade by OrderDelivery every Saturday and SundayPre Order max H-3Ph 087887731265 Whatsap only'
https://www.instagram.com/griyaharsi/,griyaharsi,668,082230340650,"b'Griya HarsiNatural Living""A Seed of Love always Grows""Green Gift, Quote and Happy PlantsWA only : 082230340650'"
https://www.instagram.com/betta.betawimodern/,betta.betawimodern,268,081298274652,b'Betta.BetawiModernIkan cupang hias Plakat 081298274652'
https://www.instagram.com/jacket_q1/,jacket_q1,48,081391577026,b'Susi123Sedia jacket sweater untuk pria dan wanita harga murah kualitas bagus dan amanahwa.me/081391577026Followed by elikatering'
https://www.instagram.com/bursum_surupandan/,bursum_surupandan,55,081315411746,b'BUBUR SUMSUM SURUPANDANBubur Sumsum SurupandanSistem Pre-OrderSETIAP JUMAT LIBUR WA : 081315411746OR DM '
https://www.instagram.com/nonakidsfashion/,nonakidsfashion,846,085619892002,"b'NonakidsfashionJual baju anak..murah..berkualitasBobokids, Bambino, Calista, oshkoshSOLD=HAPUSWA 1 : 08561989200WA 2 : 085781011536Shoppe : nonakidsfashion'"
https://www.instagram.com/pawon_torie/,pawon_torie,508,6281255515579,b'OLEH OLEH PONTIANAK#cemilansehatmurah Kubu Raya - PONTIANAK Owner @ikaherlambang_ Senin -Sabtu O8:00 -18:00Reseller : +62 812-5551-5579ORDER LINK wasap.at/nIf9hX'
https://www.instagram.com/xiangshou789/,xiangshou789,67,087780804220,"b'Les Mandarin ""Xiang Shou""Les Mandarin ""Xiang Shou""Education""Mandarin is JOY"" Call/WA : 0877 8080 4220'"
https://www.instagram.com/utamarayafrozen/,utamarayafrozen,717,081192727119,"b'UTAMA RAYA FROZEN FOODCENGKARENG - JKT BARATTOKOPEDIA : KEDAI-KECILSHOPPEE : UTAMA RAYA FROZEN FOODSHOPPEE : UTAMA FROZENWA : 0811 9272711Menerima GROSIR dan ECERANFollowed by 99frozenfood, katering_sultan, dimsum99official +1 more'"
https://www.instagram.com/jacket_q1/,jacket_q1,48,081391577026,b'Susi123Sedia jacket sweater untuk pria dan wanita harga murah kualitas bagus dan amanahwa.me/081391577026Followed by elikatering'
https://www.instagram.com/oceano.indonesia/,oceano.indonesia,18,6281952542435,b'Oceano IndonesiaFrozen Seafood Specialist +62 819 5254 2435.Pengiriman dari Jatibening Bekasioceanoindonesia.comFollowed by dapurlokarasa'
https://www.instagram.com/kochstrasseofficial/,kochstrasseofficial,767,08995630078,"b'Pastel Goreng | Sponge Cake     . 08995630078 (WA) GoJek & Grab OVO, GoPay, Transfer Cideng, JakPus, IDN  |  | linktr.ee/kochstrasseofficial'"
https://www.instagram.com/alita_collection/,alita_collection,860,081219309538,"b'Novita RiweuhATASAN BAJU WANITA, KEMEJA, TUNIK & DASTERFor order: 081219309538BCA /BNI (dari Bogor)Tanyakan stok, pesanan hari sabtu/minggu dikirim senin'"
https://www.instagram.com/azizahvictoryduasinga/,azizahvictoryduasinga,15,082335345085,b'azizahvictoryduasingaAzizah VictorysingaWa: 082335345085Shopee: victory2singa.officialTokped: victoryduasingaofficialFollowed by katering_sultan'
https://www.instagram.com/tahukriukgalak.bdg/,tahukriukgalak.bdg,607,6281385287733,b'Tahu Kriuk Galak BandungTahu kriuk enak lezat gurih bandung Sudirman Street Sumber SariGriya buah batuMekar WangiYogya CiumbuleuitOrder klik WA linkwa.me/6281385287733'
https://www.instagram.com/aviaca__/,aviaca__,37,081287632263,"b'AVIACASilakan hubungi kami :Whats App : 0812 - 8763 - 2263LINE : @530yrzzcShopee : aviacaShipping : JNE, J&T dan Si Cepat'"
https://www.instagram.com/haneul.studio/,haneul.studio,499,087781129291,b'Haneul StudioKomplek Greenville Blok BG 53 / 3rd flJakarta BaratMon - Sun / 7am - 6pmWA 087781129291linktr.ee/haneul.studio'
https://www.instagram.com/roemahtjabe/,roemahtjabe,208,087733160916,b'Roemah TjabeTeristimewa Boeatan RoemahOrder NowPengiriman via JNT/Grab/GojekOrder via:Direct MessageWA 0877 3316 0916SHOPEE shopee.co.id/roemahtjabe?smtt=0.0.9'
https://www.instagram.com/nagatahouseware/,nagatahouseware,845,6282287009392,b'MEDAN PANCI TEKO RANTANG ZEBRAEST 2018READY STOCKORDER & KATALOG:SHOPEE : nagatahousewareTOKOPEDIA: nagata house wareWHATSAAP: +6282287009392ORDER? CLICK LINKinstabio.cc/20518ksJEDz'
https://www.instagram.com/ramdhani.92/,ramdhani.92,284,087775294848,b'Dhani#ferrox#wizardfire#thsbooster#thsbelis#primesasiaWa:087775294848'
https://www.instagram.com/soess.co/,soess.co,348,081293025849,"b'SOESS.COHAND&HOMEMADE! FRESHLY BAKED BY PO!Order:WA :081293025849Line : @xnx6066n (pakai @)Jelambar,Jakarta Barat'"
https://www.instagram.com/ekasariyan/,ekasariyan,244,085310307223,"b""Yan's KitchenMakanan Hygenis- Made by PO- order by minimum requestWA : 0853-1030-7223"""
https://www.instagram.com/grosir_bajubobo/,grosir_bajubobo,341,0811932756,"b'AnceMENJUAL PIYAMA KATUN, SATEN, EMBOS, SPANDEX, KAOS IMPORT, KIMONO, BUAT ANAK2 DAN DEWASA, COUPLE. TERIMA RESELLER DR SELURUH NUSANTARA 0811932756'"
https://www.instagram.com/anajelambar/,anajelambar,328,085215051122,"b'ANA Agen Properti Jelambar085215051122Ingat PROPERTI JELAMBAR... Ingat ANA JELAMBARspesialisasi wilayah Jelambar, Kavling Polri, THI, Taman Duta Mas, dll di Jakarta Baratbit.ly/36VORIFana'"
https://www.instagram.com/trustdisplay/,trustdisplay,131,081871643908,b'yonathan_gandhi@yahoo.comSuplier display promosi & digital printingCall : 0818716439 / 082213672715Pin : 28F2A21Awww.trustdisplayindonesia.com'
https://www.instagram.com/toyotaauto2000pluit/,toyotaauto2000pluit,96,08159296760,b'Dealer Toyota Auto2000 pluitCash / Credit segala mobil ToyotaTerima tukar tambah segala merekJabodetabekInfo : 08159296760'
https://www.instagram.com/karya.bu.didik/,karya.bu.didik,120,628990779353,b'Bu Didik * handmadeKerajinan tangan lokal dikerjakan oleh Bu Didik.Handmade with love in IndonesiaPlease DM / Wa : +628990779353Terima kasih atas dukungan kalian.'
https://www.instagram.com/kebuli_arafah/,kebuli_arafah,44,082114735159,"b'Kebuli Arafah- Kebuli Arafah -Info Pesanan : 0821-1473-5159Alamat Resto : Jl. Raya Regency 2, Kuta Jaya, Kec. Ps. Kemis, Tangerang, Banten 15560(Kedai Sutera)'"
https://www.instagram.com/madlove_loveforfood/,madlove_loveforfood,125,08119692412,b'food product and servicesFood is love representation in lifeOrder to : 08119692412 or DM'
https://www.instagram.com/zafood_risol_pamulang/,zafood_risol_pamulang,505,081281597501,"b'suplyer dan produsenZafood PamulangHealthy foods is homemade foods: 081281597501: Alamat Griya asri Pamulang, blok e 13 no 3, Tangsel.'"
https://www.instagram.com/ichasiska509/,ichasiska509,82,081281960299,b'ichasiska50Cantik alami bersama SR12OrderWA : 081281960299Jln. Merah delima 3 RT 05 RW 021 Perumahan kuta bumi 2 Kec. Pasar Kemis'
https://www.instagram.com/miekembang/,miekembang,186,085921519010,"b'Mie Kembang Pamulang Pamulang,Tangerang SelatanWA: 085921519010 (Delivery Order) *ex samping CORESMie Mentah IDR 35.000/KG (homemade noodle)Via Gofood available'"
https://www.instagram.com/omahsalad17/,omahsalad17,50,6289560069710,b'OMAH SALAD> Salad Buah Owner : @mirawuland15Yang ingin tanya tanya bisa melalui instagram dan whatsapp Wa : klik bisa link yang dibawah ini api.whatsapp.com/send?phone=62895600697101'
https://www.instagram.com/datesmilk_/,datesmilk_,70,085939406626,"b'datesmilk_3AbradeMenjual Susu Kurma Berkualitas 100% Halal untuk di konsumsi & Coffee Milk ,( Coffee Robusta )Pesan melaluiWa : 085939406626Ciledug Tangerang'"
https://www.instagram.com/utamarayafrozen/,utamarayafrozen,729,081192727119,"b'UTAMA RAYA FROZEN FOODCENGKARENG - JKT BARATTOKOPEDIA : KEDAI-KECILSHOPPEE : UTAMA RAYA FROZEN FOODSHOPPEE : UTAMA FROZENWA : 0811 9272711Menerima GROSIR dan ECERANFollowed by 99frozenfood, katering_sultan, dimsum99official +1 more'"
https://www.instagram.com/jacket_q1/,jacket_q1,48,081391577026,b'Susi123Sedia jacket sweater untuk pria dan wanita harga murah kualitas bagus dan amanahwa.me/081391577026Followed by elikatering'
https://www.instagram.com/oceano.indonesia/,oceano.indonesia,19,6281952542435,b'Oceano IndonesiaFrozen Seafood Specialist +62 819 5254 2435.Pengiriman dari Jatibening Bekasioceanoindonesia.comFollowed by dapurlokarasa'
https://www.instagram.com/kaoscustom.ah/,kaoscustom.ah,5,085777285674,b'Kaos Custom AHUntuk order dan pemesananWa 085777285674Followed by hafizh_cookies'
https://www.instagram.com/apriljasmine_lemon_tulungagung/,apriljasmine_lemon_tulungagung,8,087770464195,b'apriljasmine_lemon_tulungagungWelcome resellerWelcome dropshipWelcome agenWa 0877-7046-4195Followed by 99frozenfood'
https://www.instagram.com/azizahvictoryduasinga/,azizahvictoryduasinga,15,082335345085,b'azizahvictoryduasingaAzizah VictorysingaWa: 082335345085Shopee: victory2singa.officialTokped: victoryduasingaofficialFollowed by katering_sultan'
https://www.instagram.com/lidah_betawi/,lidah_betawi,46,6285710160706,b'Kuliner Tradisional BetawiTerima order Lunch Box/Catering/Kuliner Betawi/Snack/Bir PletokWA : wa.me/6285710160706Followed by kueyosiko'
https://www.instagram.com/wedangronde_kedoya/,wedangronde_kedoya,77,081281227888,b'Wedang Ronde KedoyaOrder WA 081281227888Terima pesanan H-2 18.00 - 22.00Taman Jajan Pola Bugar'
https://www.instagram.com/_candra.bussines/,_candra.bussines,213,6285738220323,b'Bussines Online terpercayaBisnis DatabaseSiapapun Dapat JoinModal 1X Selamanya Only 50.000PROMOGet 300-1Jt/HariHalalAmanRealPayment : Via Pulsa/DanaJoin DM/WA api.whatsapp.com/send?phone=6285738220323&text=Halo+Admin+Saya+Mau+Join'
https://www.instagram.com/aliya_beauty_shop/,aliya_beauty_shop,990,089536779033,b'abaya arab qualityorder viawa 0895367790339abaya popasminamukenah OPEN RESELLERdastersirupskin care &bb creamkhas wangi dupatesti aliyabeautyshop'
https://www.instagram.com/donuts.art/,donuts.art,403,085717124122,"b'Donuts Art Donat kentang 085717124122 Jakarta Barat, Indonesia Express your love with '"
https://www.instagram.com/wishgrantedid/,wishgrantedid,348,081808020506,b'wishgrantedIDJasa titip beli apa ajawish anything your heart desiresdrop your wish:WA:0818-0802-0506@keripiktempesaikichat.whatsapp.com/LctLx17Ry6T7WEmm7mAeyv'
https://www.instagram.com/jasatitipyukk/,jasatitipyukk,694,082210972225,b'Preloved under 80rbPERSONAL SHOPPERTRUSTED  since 2017SERIOUS BUYER ONLY .Order?DM / WA : 082210972225 (wa only)'
https://www.instagram.com/zgbeauty_resellertangerang/,zgbeauty_resellertangerang,51,085892814526,b'ZG BEAUTY By ZASKIA GOTIXCOMING SOONSkincare by @zaskia_gotixReseller Resmi @zgbeauty_officialOrder bisa bisa hubungi :Admin WA : 0858-9281-4526'
https://www.instagram.com/berlcosmetic_tangerang8/,berlcosmetic_tangerang8,15,081314856761,b'B ERL Cosmetic TangerangRESELLER RESMIHalal & BPOMAman Untuk Bumil & Busui JNE / JNT (Dalam / Luar Tgr) COD / GoJek / Delivery H+1Order: WA : 081314856761tokopedia.link/38GJN90bMU'
https://www.instagram.com/rizniesalad/,rizniesalad,46,085891116981,b'Fruit SaladAsinanSpaghetiCiledug-Tangerang% halal H - 1 order Delivery order by go send wa: 0858.9111.6981 payment: transfer BCA'
https://www.instagram.com/propertyrumah34/,propertyrumah34,15,081314856761,b'Dekor shabby craftAll craft (Open PO)Minat hubungi admin 081314856761'
