https://www.instagram.com/healthyfruit.salad/,healthyfruit.salad,518,628994996662,b'Salad Buah DepokOpen PO/mingguTerima pesanan berbagai acaraAntar/CoD/Go-SendGratis ongkir max 2km dr jarak pengirimanorder? ready stock? DM/WAwa.me/628994996662'
https://www.instagram.com/lamanise_saladbuah/,lamanise_saladbuah,57,089608574131,"b'Salad Buah DepokSawangan, Depok0896-0857-4131 (wa only)COD Sawangan/Bojongsari, Gosend/GrabExpressReady setiap hari Kamis, Sabtu dan Minggu (pre-order)bit.ly/2Ce3Z8S'"
https://www.instagram.com/ayroshop/,ayroshop,464,087720498388,b'SUPPLIER BUAH DI DEPOK grosir dan ecer Order H-1 Go/grab send WA 0877-2049-8388#buahonline#jualbuahgrosirdanecerTokopedia m.tokopedia.com/ayros?source=universe&st=product'
https://www.instagram.com/saladbuahdapurazkha/,saladbuahdapurazkha,126,083873430072,b'salad buah depokOrder 083873430072 Jln TPU kalimulya 3 rt03/06 no.55 Kalimulya Cilodong Depok Jawa barat..Fresh di buat hanya pesanan tidak stok'
https://www.instagram.com/nazzranfruit19/,nazzranfruit19,84,081317934106,b'buah segar depokLokasi kelapa dua depokGrosir dan ecerBuah imporBuah lokalDijamin masih freshOrder wa: 081317934106Kirim :gojek grab '
https://www.instagram.com/eatsaladku/,eatsaladku,103,082114274114,b'SALAD BUAH PREMIUM DEPOKSeger & manis kaya kamu Depok 082114274114 (WA) Go-send GrabExpress'
https://www.instagram.com/saladbuah_rafanda/,saladbuah_rafanda,307,081218082069,b'salad buah sehat depokYuk ngemil yg sehatOpen ResellerWA 081218082069 Depok'
https://www.instagram.com/saladbuah_rsw/,saladbuah_rsw,138,089653364255,"b'SALAD BUAH DEPOKFRESH dan HALALHOMEMADE @ranisariw Mandiri WA: 089653364255Cimanggis Depok, TIPARPengiriman kita antar / GRAB NoCODHargabelumtermasukON'"
https://www.instagram.com/cemilbuah_mpokupi/,cemilbuah_mpokupi,50,085695500455,b'Buah Cemilan DepokBuah segar berkwalitasCemilan sehat no MSG dan bahan pengawet*Upi Lutfiah*wa085695500455tlp08176823356Wilayah JKT-Depok bisa kirim ojol sameday'
https://www.instagram.com/saladbuah_alifa/,saladbuah_alifa,690,088707738609,b'SALAD BUAH MERUYUNG DEPOKOrder :088707738609 / 089603549987GOFOOD'
https://www.instagram.com/saladbuahdepokjuanda/,saladbuahdepokjuanda,60,081294191452,"b'Aminah Salad~saladbuahdepokjuanda~ DepokPengiriman : COD or GosendGojek "" Aminah salad ""Owner : 081294191452(Aminah)0895384141726(Andre)maps.app.goo.gl/3owWp9egWiCJB9iN6'"
https://www.instagram.com/dapuraisya.id/,dapuraisya.id,319,081247464392,b'Salad Buah Depok Made by order Salad buah 081247464392 (only WA) Gosend/Grab Delivery from Depok'
https://www.instagram.com/agenbuahdepok/,agenbuahdepok,15,089679280548,b'agenbuahdepokFollow akun Utama: @jualbuahdepokBelanja buah aman & nyaman dr rumahSpecial Price chat WA yaWA: 0896-7928-0548'
https://www.instagram.com/tokobuahdepok/,tokobuahdepok,18,089679280548,b'Toko Buah DepokFollow akun Utama: @jualbuahdepokBelanja buah aman & nyaman dr rumahSpecial Price chat WAWA: 0896-7928-0548'
https://www.instagram.com/asalada.id/,asalada.id,188,089541092941,b'Salad Buah DepokPRE ORDER (PO)Salad Buah Homemade#caralainmenikmatibuahDepok-Jakarta BCA WA: 0895410929416NoCall Pengiriman Via Gosend/Grabdelivery'
https://www.instagram.com/asinan.buah.jambu.kristal_/,asinan.buah.jambu.kristal_,183,0817852186,b'asinan buah DepokAsinan Buah Jambu Kristal dan Nanas MaduDijamin rasanya segar dan buahnya freshWA : 0817852186#asinandepok#asinanbuah#asinanjambukristal'
https://www.instagram.com/blacksalad.id/,blacksalad.id,141,081286987939,b'Salad buah DepokBlack salad seriously delicious..Pesan sekarang atau kehabisanOrder now:081286987939 Hanya melayani DepokOrder klik di sini:goo.gl/fVy9PX'
https://www.instagram.com/saladbuahyonaa/,saladbuahyonaa,209,081294147481,"b'Yona Salad Margonda DepokFresh , HealtyHALAL %Kedai salad Original Mayo Pioneer Sweet Mayo Margonda DepokWA : 081294147481GrabfoodGofood klik link gofood.link/u/pjPOnZ'"
https://www.instagram.com/yogurt_buah_depok/,yogurt_buah_depok,227,081213319340,b'Homemade YogurtYogurt Buah... Homemade irisan buah  jelly DEPOK WA 0812 1331 9340 Go Send'
https://www.instagram.com/onlinebuahdepok/,onlinebuahdepok,24,081295739408,b'online buah depokJual buah onlineFree delivery (Depok)Call wa/tlp 081295739408'
https://www.instagram.com/saladnom_nom/,saladnom_nom,36,089611591299,"b'Salad Buah DepokGOFOOD SaladNomnom, BacangCilodong, kota depok jl bacang no 138Wa only 089611591299 '"
https://www.instagram.com/saladbuah23_/,saladbuah23_,275,089535537890,"b'Salad Buah DepokSaladbuah HomeMade Pabuaran Citayem 09.00-20.00 Wib Gosend,Cod,Kerumah 0895355378902#saladbuahfresh #saladbuahdepok #saladbuahbogor'"
https://www.instagram.com/sabusaladbuahpremiumdepok/,sabusaladbuahpremiumdepok,33,082123037320,b'sabusaladbuahDepokmampangSalad buah dengan kualitas premium!Outlet:mampang.Jln.pramuka rayaTerima pesanan (WA) 082123037320'
https://www.instagram.com/dapur_mimi.el/,dapur_mimi.el,12,6281287265135,b'Salad Buah DepokFresh & HealthyKalimulya - Depok Order H-1 api.whatsapp.com/send?phone=6281287265135&text=Halo+Mimi+Aku+Mau+Order'
https://www.instagram.com/saladbuahpremiumdepok/,saladbuahpremiumdepok,13,082123037320,b'Sabusaladbuahpremium DepokTerima pesanan.(wa) 082123037320'
https://www.instagram.com/dessert_ngeunah/,dessert_ngeunah,64,089690042033,"b'SALAD BUAH,BANOFFE,BACI DEPOKMADE WITH LOVE.Salad buahBanoffeeBaso aci garutLeuwinanggung,Tapos-DepokFast respon via WA : 089690042033'"
https://www.instagram.com/bibitbuahdepok/,bibitbuahdepok,40,089652331262,"b'bibitbuahdepokJual bibit mangga, jeruk, kelengkeng, sawo, jambu dll jl rawasari 2 rt 3/6 no 47 cipayung depok wa: 089652331262'"
https://www.instagram.com/buburbuah/,buburbuah,51,081212033009,"b'Bubur Buah DepokBubur Buah DepokRasa Mangga,Durian,alpukat dengan toping buah2 segar dan permesan keju dijamin ketagihan..Bisa via Gojek dan Grab WA 081212033009'"
https://www.instagram.com/misalad.depok/,misalad.depok,70,089580634295,b'Salad Buah Premium DepokSince 2019made by Love PO H-1Homemade | Fresh | Hygienic |   s GOSEND / Takeaway / CODWa : 0895806342957 or DM'
https://www.instagram.com/saladkuni/,saladkuni,234,089523989620,b'Salad Buah Premium DepokSaladkuni___________________________GoFood : Salad Kuni Jl. H. Narip No.19 MeruyungPat. Masjid Kubah Emas BCAWa : 0895-2398-9620Or Clickbit.ly/2yYeFnD'
https://www.instagram.com/saladhomemade_/,saladhomemade_,90,089661443502,"b'Salad Buah Homemade Depok 100% halal, Hygienic & FreshFruit Sauce creamy Topping Keju Home Made 089661443502 (WA Only) Via Grab/Gojek ParungBingung,Depok'"
https://www.instagram.com/saladnya.mboten/,saladnya.mboten,4,089638202267,b'Salad Buah dan Sayur DepokPREMIUMSALAD BUAH SALAD SAYUR Made by Order  GoSend/Grab  WA 089638202267Owner @fanyambeleOrder by Tokopedia m.tokopedia.com/saladnyamboten'
https://www.instagram.com/pastelmurahdepok/,pastelmurahdepok,3,089783371229,b'PastelEcoUntuk pemesanan Watsapp *08978337122*Line: wandanh98 (admin)Pengiriman JNE (jabodetabek)Khusus DEPOK bisa COD 100% HALAL !!!'
https://www.instagram.com/rokupang_cimanggis/,rokupang_cimanggis,613,085771363975,"b'ROTI KUKUS DAN PANGGANG DEPOKSatu ga akan cukup senin - minggu 13.00 - 22.00 Teras Alfamidi.Jl putri tunggal, harjamukti, cimanggis, depok 085771363975/085814726638'"
https://www.instagram.com/rotikadetdepok/,rotikadetdepok,13,081290840604,b'Roti Bakar Kukus Mas RandiHallo Fooders !Roti Bakar Kukus..Bisa P.O Roti Kadet aja @2100/pcs +7k dianter sampe lokasi (min 24pcs) Depok dan sekitarnya.W.a 081290840604'
https://www.instagram.com/tahugo.depok_kukusan/,tahugo.depok_kukusan,76,081281183696,"b'Tahu Go! Depok Kukusan Senin-Minggu 10.00-21.00 081281183696Jl. K.H.M. Usman Kelurahan No.161, Kukusan, Kecamatan Beji, Depok,https://goo.gl/maps/MMespdcFnw2Zk5WW8'"
https://www.instagram.com/brot_way_/,brot_way_,212,6281213851914,b'BROT_WAY Kukusan-Depoksekumpulan para pecinta gowes sehat yg ramah lingkungan dan anti polusiCp : +6281213851914 [joki ]: +6281361560157 [bonar]'
https://www.instagram.com/wahana.depok.kukusan/,wahana.depok.kukusan,20,081230723000,"b'agen wahana kukusanAgen Wahana Kukusan, free pickupJl. KH.M.Usman no 42 Kukusan , Beji , DepokWa : 081230723000'"
https://www.instagram.com/durian.depok24/,durian.depok24,177,085773060750,b'pancake durian&makanan frozenDurian&aneka frozzenFoodBisa cod untuk wilayah depokORDER/TLP= 0857-7306-0750= 0855-9137-3688More info? lngsung klik link ofc kami dibawahwa.me/message/RIYMEAZ3QIZZP1'
https://www.instagram.com/makaroni.ngocor.depok/,makaroni.ngocor.depok,129,085591178653,"b'Snack Kekinian Makaroni NgocorWELCOME RESELLER AND DROPSHIP085591178653/085771040588 (whatsapp)JNE,J&T,Tiki (ongkir Menyesuaikan)Info lebih lanjut DM/klik link dibawah ini bit.ly/331F5Bs'"
https://www.instagram.com/makaronibonju.depok/,makaronibonju.depok,95,082288886147,b'Makaroni Bonju DepokAgen Resmi Makaroni Bonju DepokRESELLER WELCOMETANYA/ORDER DM 0822.8888.6147Shopee: cemilan.wolesLANGSUNG KLIK LINK bit.ly/MakaroniBonjuDepok'
https://www.instagram.com/makaroniin.depok/,makaroniin.depok,71,6289625583062,"b'Makaroniin DepokBojongsari, DepokBisik-bisik di dm/waWelcome Reseller!BRIJNE, J&T or CODFor order? Dm or Whatsapp :+62 896-2558-3062 +62 858-9116-4850shopee.co.id/ichannggih060102'"
https://www.instagram.com/qaisar_bonju/,qaisar_bonju,47,081227232318,"b'makaroni bonju agen depokAgen makaroni Premium Depok15 Varian RasaOrder 081227232318JNE, TIKI and others BCABukalapak : qaisarshop'"
https://www.instagram.com/nengmakaroni_dpk/,nengmakaroni_dpk,553,087775403170,b'Neng Makaroni DepokDepok - Jawa BaratOrder By Dm/Whatsaap 0877 7540 3170'
https://www.instagram.com/makaroni_depok/,makaroni_depok,141,081311327368,"b'MAKABLANDEMakaroni belanda depok, ( jl. Margonda no 32 depok) 081311327368 .BUKA 17.00 - 21.00 WIB ( BUKA SETIAP HARI KECUALI HARI RABU dan MINGGU)'"
https://www.instagram.com/makaroni_ngehek_depok/,makaroni_ngehek_depok,98,085210321538,b'Makaroni _ngeheAyo Ayo di order mahe Makaroni ngehe Ada Varian rasa -pedes -keju -balado -asin -WA-085210321538 -monggo sadayana'
https://www.instagram.com/maba_depok/,maba_depok,37,6281410999038,b'Aneka MakaroniCabang dari @lih_simup- Makaroni Bantet (MABA)- Makaroni Panggang (MAGANG)- Makaroni Choklat (MACHO) +62 814-1099-9038'
https://www.instagram.com/makaronibonju_kotadepok/,makaronibonju_kotadepok,47,087878082233,"b'Agen Resmi Depok BogorResellers, Dropships are WelcomeInfo & Order:0878-7808-2233 (whatsapp only)'"
https://www.instagram.com/makaronibonju.depok_08/,makaronibonju.depok_08,64,081808780057,b'makaroni bonju depokCemilan kekinian ..Makaroni Bonju (Agen kota Depok)WA : 081808780057BBM : D75EE4F8'
https://www.instagram.com/makaronimboksubur/,makaronimboksubur,10,08981408666,b'Makaroni Mbok Subur (Depok)Banyak Variant RasaBBQBALADOFRIED RICEBALADO SUPER PEDAS (HOT)SALTED EGGFOR ORDER=> WA/TLP : 08981408666LokasiDepok'
https://www.instagram.com/pastaku_depok/,pastaku_depok,8,081918178866,b'MAKARONI_PASTASnack murah meriah yg bisa dinikmati kpn aja...Buat rasaPedasBaladoKejuJagung bakarOrder 0819-1817-8866'
https://www.instagram.com/makaronidungdungdepok/,makaronidungdungdepok,1,085791827326,b'Makaroni Dungdung - DepokMenjual Makaroni kering/goreng *CEMILAN JAMAN NOW*RENYAHHIGIENISMUDAH DIBAWA-BAWATERSEDIA VARIANT RASAWA 085791827326BBM lin888'
https://www.instagram.com/makaronisetandpk/,makaronisetandpk,5,087764492035,"b'Makaroni Setan DepokOpen order makaroni dan Open Reseller/ Dropshipsiap menerima pesananWhatsapp: 087764492035BBM:Kota Depok, Indonesia J&T Express'"
https://www.instagram.com/mandes_depok/,mandes_depok,41,082111312384,b'MAKARONI ENDESBy @tamaradmelCrunchy&Spicy BCA J&T DM & Whatsapp (082111312384)'
https://www.instagram.com/maba_kotadepok/,maba_kotadepok,32,085716023675,"b""Makaroni kekinian Menjual aneka makaroni kkinian cabang @lih_simup Makaroni bantet - makaroni panggang - makaroni coklat085716023675Reseller's account @qirusy26"""
https://www.instagram.com/mielididepok/,mielididepok,27,6287705339702,b'Mie lidi dan MakaroniMie lidi dan Makaroni murah meriah DepokCOD Depok / Jne / GosendOrder?Line @kcm0334hAdmin:Adinda +6287705339702Michelle +6283870641825www.shopee.co.id/michelleanjelicaa'
https://www.instagram.com/makaroniking_depok/,makaroniking_depok,216,081382020054,b'makaroniking_depokMakanan non msg halalRasanya bikin jatuh cintaInfo reseller wa dm081382020054Shopee @makaroniking_depokLazada @makaroniking_depok'
https://www.instagram.com/jj_depok/,jj_depok,123,085691676738,"b'Makaroni mama Pengiriman Depok wa : 085691676738Tokopedia : jeje_snackJne, wahanaSenin - jumatMandiriCOD depok,pamulang,ciputat,cireunde,pondokcabe,LB'"
https://www.instagram.com/makaronimozza_depok/,makaronimozza_depok,16,085697207906,b'makaronimozza_depokMakaroni kering berbagai rasa dengan irisan daun jerukHarga 7k ajaBerat 100 grBisa COD di daerah Depok loh!!Order? Via WA 085697207906'
https://www.instagram.com/makaronibonju_depokk/,makaronibonju_depokk,57,081388366397,"b'karomahPROMO buy 5 get 6Agen resmi dari @makaronibonju_idOpen for resellers kuota terbatas!Cemilan renyah, lembut dan gurihwa: 081388366397'"
https://www.instagram.com/makaronibonju_depok/,makaronibonju_depok,75,081282874188,b'Agen Resmi BONJU DepokMakaroni Kekinian & Berkualitas (sedikit MSG & tanpa bahan pengawet)- INFO ORDER & RESELLER WA/SMS 0812 8287 4188Line ID jds89'
https://www.instagram.com/nugteta.depok/,nugteta.depok,248,081216668727,"b'NUGGET TEMPE TAHUHalalTanpa PengawetFrozen foodCilodong, DepokPemesanan via: WA 081216668727/ DM IG'"
https://www.instagram.com/nuggetempedepok/,nuggetempedepok,40,089502038867,b'Nugget tempe DepokWELCOME RESELLEROwned by @sifa_hasna @ratnaayunii @rthjln @yunitapurnama5 @ekaraaa_Order Whatsapp : 089502038867 (fast)COD/GOSEND/JNE'
https://www.instagram.com/keripik_tempe_depok/,keripik_tempe_depok,47,089696089165,b'keripik_tempe_depokWa : 089696089165'
https://www.instagram.com/dapuraisyahdepok/,dapuraisyahdepok,55,6281219896408,b'Sambal kentang & tempe depokSpesial Sambal Kentang & Sambal Tempe Order DM WA klik wa.me/6281219896408'
https://www.instagram.com/dapurbujiran/,dapurbujiran,141,083876011926,"b'olahan tempe coklat depokMenjualan olahan produk tempe :Nastar, coklat tempe,pembelian bisa langsung whatsapp :083876011926'"
https://www.instagram.com/tempesicipi.depok/,tempesicipi.depok,23,081119015923,b'TempeSicipi.DepokOPEN RESELLER SICIPI#sicipioriginal #sicipibalado #sicipihotspicyMore info 0811190159Order langsung klikbit.ly/2UTnv35'
https://www.instagram.com/tempe_geprek121/,tempe_geprek121,80,081314895048,b'Cupang depok 35kJual cupang hias berbagai macam jenisTq atas kunjungan nya Wa_081314895048'
https://www.instagram.com/pechocdepok/,pechocdepok,8,08999323581,"b'Tempe Coklat4varian rasa: Original tempe coklat, Topping kacang, Topping wijen, Topping biskuit.08999323581pechocdepok@gmail.comJNE depokBNI/mandiri'"
https://www.instagram.com/akhwat_story/,akhwat_story,415,082123578127,"b""Halal Mart Sukmajaya Depok HPAI Makanan & minuman sehat & halal Ganci unyu muslimah Hijab syar'i Depok worldwide shipment0821 2357 8127(WA only) Free onshopee.co.id/akhwat_story"""
https://www.instagram.com/raisemask/,raisemask,216,081284061758,b'MASKER ORGANIK HALAL DEPOK Masker organik Halal&AmanTanpa bahan pengawetAman untuk semua jenis kulit .. BTN/BCACOD DEPOK/JNEOpen resellerOrder:0812-8406-1758 WA'
https://www.instagram.com/nasimentaidepok/,nasimentaidepok,163,6281280922067,b'Nasi Mentai Depok HALALHALAL Nasi Mentai DepokWe use halal products only.SMS/WA: +6281280922067Or click link below bit.ly/3kEVHIS'
https://www.instagram.com/mommydaddycafe/,mommydaddycafe,646,085823628129,"b'homemade food Depok - Halal Owner : @mrs.sinaga http://www.tokopedia.com/mommydaddycafe Jl.Margonda Raya No.10,Depok (Depan KF) Mon-Fry:8am-5pm,Sat:8am-23pm Sunday closedwa.me/6281298818414'"
https://www.instagram.com/halalmart.harris/,halalmart.harris,116,6281218067118,"b'Halal Mart HNI DepokUntuk sementara hanya menerima Pesanan OnlineCOD area Depok & Jakarta TimurBRIHalal, BPOMwa.me/6281218067118'"
https://www.instagram.com/i_panelstock/,i_panelstock,54,089530162359,b'KUTEK HALAL BOGOR DEPOK JKT   WARNA2 KUTEK CANTIKOwner @intn_04fashion @i_panelfashionSince19COD/kurirOrder 0895-3016-2359bit.ly/39x6kbC'
https://www.instagram.com/brownispangganghalaldepok/,brownispangganghalaldepok,58,081383537380,b'brownis panggangJual brownis panggang di depokHALALWa/hp 081383537380'
https://www.instagram.com/hpai_depok/,hpai_depok,114,082162131890,"b'Halal Mart HNI-HPAIProduk HerbalProduk Halal dan BerkualitasMelayani Pembelian Produk HNI HPAI0821-6213-1890Depok II, Pasar Agung'"
https://www.instagram.com/depokcupangaja/,depokcupangaja,171,085773070085,b'Halal Itu IndahBrederr Betta BerkualitasLokasi : DepokWA : 085773070085Jasper : TIKI Indonesiawww.youtube.com/channel/UCtZhsryRA3X3pHHhtimqwIw'
https://www.instagram.com/bosdagingsapi/,bosdagingsapi,15,087882664528,"b'Daging Sapi Halal Depok Daging Sapi Terbaik  Halal Murah Berkualitas Frozen HigienisSawangan, Depok087882664528'"
https://www.instagram.com/homukare.depok/,homukare.depok,15,081314823301,b'Nasi Kare Jepang HalalTaste Will Never Lie. Go-Food & Grab Food Ready  More Than 25 Portion : 081314823301(Takeaway Only)homukare.business.site'
https://www.instagram.com/hpai.bejidepok/,hpai.bejidepok,9,081298011088,"b""Stokis Halal Mart HPAI Depok Stokis HNI HPAI Beji Depok Sertifikasi Halal Dewan Syari'ah MUI Produk Herba Halal & Berkualitas 08129801108Syukran    Orderwa.link/8xpz72"""
https://www.instagram.com/dapursehatdepok/,dapursehatdepok,864,6281287781819,"b'Produk alami, sehat, dan halalKARE JEPANG NICCHIBAKSO SOSIS PEMPEK msg & pengejal sintetis, tersedia FLOURLESSSAFFRON GRADE COUPE SPAINHIMALAYAN SALT & SUPERFOOD lainwa.me/6281287781819'"
https://www.instagram.com/hni_depok/,hni_depok,14,089530636817,"b'HNI_HALAL NETWORKMenyediakan produk herbal,halal 100%Mulai dari produk kesehatan, kecantikan,dllPemesan bisa via WhatsApp,DMPengiriman via JNE,CODWa:089530636817'"
https://www.instagram.com/halalherbsdepok/,halalherbsdepok,157,6285890217311,"b'Halal Mart PDRDistribution Center Produk HPAIOpen Order & ResellerDelivery: JETexpress, WahanaOrder: WA +6285890217311Bank: BSM'"
https://www.instagram.com/skincarehalal_dpk/,skincarehalal_dpk,75,089533032494,b'Skincare Halal DepokOWNER by @purnamasiti SAFI INDONESIA SKINCARE SKINCARE HALAL ! REAL PICT ! W.A 0895330324941 BCA DEPOKbit.ly/2MOqQcm'
https://www.instagram.com/depokkindosnack/,depokkindosnack,7,6281388974301,b'gurih dan renyah 100% HALALCemilan cita rasa ibu.cara ORDERapi.whatsapp.com/send?phone=6281388974301'
https://www.instagram.com/kosmetikhalaldepok/,kosmetikhalaldepok,2,6281311974199,b'B ERL COSMETIC#berlcosmetic #skincareberl.Skincare dan Kosmetik halalBPOMAlami.Ask&Order klik:wa.me/6281311974199'
https://www.instagram.com/sc_halalmartdepokjaya/,sc_halalmartdepokjaya,46,081283681726,"b'SC Halal Mart Depok JayaStock Center Halal Mart menyediakan berbagai produk herbal HPAIHNI-HPAIMore info WA : 081283681726 /081212335781Depok, Jawa Barat - Indonesiahpaindonesia.net'"
https://www.instagram.com/_afinadepok/,_afinadepok,55,081266838629,"b""Organic Mask  Halal  CheapSynergized w/ Qur'anic HealingNo Paraben, Alcohol, Etc-OPEN RESELLER-Ask/Order : 081266838629 (WA)-PRE-ORDER-Kelapa Dua, Depok."""
https://www.instagram.com/hpai.krukut/,hpai.krukut,108,089561657029,"b'HPAI KRUKUT DEPOK(HALAL MART)Agen Stokis Produk Herbal Alami HPAI HNIMenerima Dropship Open Member Baru HPAI HNI : JNE , J&T : WA 089561657029tokopedia.link/sCoc/ft5nZ2l8rJ'"
https://www.instagram.com/kuebasah.depok_mahkota/,kuebasah.depok_mahkota,111,089533778578,"b'Mahkota_bunda yoelidimsum,risol mayones,rainbow cake,pizza, zuppa soup,martabak manis,aneka bolu kukus, aneka puding cake(wa: 0895.337.785.785)'"
https://www.instagram.com/ketan_bagaskara/,ketan_bagaskara,165,081295985912,b'Ketan Bagaskara | Depok Available on GoFood & GrabFood. For catering: 081295985912 (WA only)'
https://www.instagram.com/jualtapeulididepok/,jualtapeulididepok,131,081293065598,b'jualtapeulididepokMenerima Pesanan :*TAPE ULI*WAJIK Betawi*GEPLAK*KUE BUGIS*DODOL Betawi dll.PernikahanArisan DLL ..(WA) 0812-9306-5598 / 0882-1043-2302gofood.co.id/jakarta/restaurant/uli-bakar-dan-susu-jahe-wadas-pitara-raya-e43991a8-bd08-49d1-b016-88689bc177ee'
https://www.instagram.com/saladbuahdepok2/,saladbuahdepok2,100,081932422009,b'Puding & Salad Buah DepokPO.puding / salad buahSetiap hari : senin - sabtuPukul 09.00-21.00No.pengawet /HalalHubungin/DM&WA : 081932422009Depok2-Bekasi Timur'
https://www.instagram.com/saladbuah_depok/,saladbuah_depok,798,087789061515,"b'Salad Buah Depok AlladijaYuk Order ya Harga mulai 15rb anBisa utk acara Arisan, Nikahan, Meeting kantor, ultahdllOpen Reseller.Wa: 087789061515GoFood klik link berikutbit.ly/CekpromoGoFoodSaladAlladija'"
https://www.instagram.com/saladbuahdepokjuanda/,saladbuahdepokjuanda,60,081294191452,"b'Aminah Salad~saladbuahdepokjuanda~ DepokPengiriman : COD or GosendGojek "" Aminah salad ""Owner : 081294191452(Aminah)0895384141726(Andre)maps.app.goo.gl/3owWp9egWiCJB9iN6'"
https://www.instagram.com/saladbuahdepok9/,saladbuahdepok9,135,081299403646,b'SaladbuahRAReady setiap HariCod/gosendStand :Taman Lembah GurameBedahan sawangan ( samping kanan SDN bedahan 01 )/WA : 081299403646'
https://www.instagram.com/heavenlysalad/,heavenlysalad,398,081280179462,"b'Salad Buah Depok Cibubur Freshly Made by OrderOrder Via:Admin Depok 0812-8017-9462Admin Cibubur 0878-8374-7343-Depok, Cibuburlinktr.ee/heavenlysalad'"
https://www.instagram.com/healthyfruit.salad/,healthyfruit.salad,518,628994996662,b'Salad Buah DepokOpen PO/mingguTerima pesanan berbagai acaraAntar/CoD/Go-SendGratis ongkir max 2km dr jarak pengirimanorder? ready stock? DM/WAwa.me/628994996662'
https://www.instagram.com/rizky_saladfruits/,rizky_saladfruits,187,081383163829,b'Salad buah depokSALAD BUAH || PUDDING || PIZZA || DESSERTOwner  @rizkynurdiana_Order? Dm/Wa 081383163829#saladbuahdepok#bedatanganbedarasa'
https://www.instagram.com/lamanise_saladbuah/,lamanise_saladbuah,57,089608574131,"b'Salad Buah DepokSawangan, Depok0896-0857-4131 (wa only)COD Sawangan/Bojongsari, Gosend/GrabExpressReady setiap hari Kamis, Sabtu dan Minggu (pre-order)bit.ly/2Ce3Z8S'"
https://www.instagram.com/saladbuahdapurazkha/,saladbuahdapurazkha,126,083873430072,b'salad buah depokOrder 083873430072 Jln TPU kalimulya 3 rt03/06 no.55 Kalimulya Cilodong Depok Jawa barat..Fresh di buat hanya pesanan tidak stok'
https://www.instagram.com/eatsaladku/,eatsaladku,103,082114274114,b'SALAD BUAH PREMIUM DEPOKSeger & manis kaya kamu Depok 082114274114 (WA) Go-send GrabExpress'
https://www.instagram.com/saladbuah_rsw/,saladbuah_rsw,138,089653364255,"b'SALAD BUAH DEPOKFRESH dan HALALHOMEMADE @ranisariw Mandiri WA: 089653364255Cimanggis Depok, TIPARPengiriman kita antar / GRAB NoCODHargabelumtermasukON'"
https://www.instagram.com/saladbuah_rafanda/,saladbuah_rafanda,307,081218082069,b'salad buah sehat depokYuk ngemil yg sehatOpen ResellerWA 081218082069 Depok'
https://www.instagram.com/dapuraisya.id/,dapuraisya.id,319,081247464392,b'Salad Buah Depok Made by order Salad buah 081247464392 (only WA) Gosend/Grab Delivery from Depok'
https://www.instagram.com/asalada.id/,asalada.id,188,089541092941,b'Salad Buah DepokPRE ORDER (PO)Salad Buah Homemade#caralainmenikmatibuahDepok-Jakarta BCA WA: 0895410929416NoCall Pengiriman Via Gosend/Grabdelivery'
https://www.instagram.com/blacksalad.id/,blacksalad.id,141,081286987939,b'Salad buah DepokBlack salad seriously delicious..Pesan sekarang atau kehabisanOrder now:081286987939 Hanya melayani DepokOrder klik di sini:goo.gl/fVy9PX'
https://www.instagram.com/saladbuah_alifa/,saladbuah_alifa,690,088707738609,b'SALAD BUAH MERUYUNG DEPOKOrder :088707738609 / 089603549987GOFOOD'
https://www.instagram.com/saladbuahyonaa/,saladbuahyonaa,209,081294147481,"b'Yona Salad Margonda DepokFresh , HealtyHALAL %Kedai salad Original Mayo Pioneer Sweet Mayo Margonda DepokWA : 081294147481GrabfoodGofood klik link gofood.link/u/pjPOnZ'"
https://www.instagram.com/saladnom_nom/,saladnom_nom,35,089611591299,"b'Salad Buah DepokGOFOOD SaladNomnom, BacangCilodong, kota depok jl bacang no 138Wa only 089611591299 '"
https://www.instagram.com/dapur_mimi.el/,dapur_mimi.el,12,6281287265135,b'Salad Buah DepokFresh & HealthyKalimulya - Depok Order H-1 api.whatsapp.com/send?phone=6281287265135&text=Halo+Mimi+Aku+Mau+Order'
https://www.instagram.com/sabusaladbuahpremiumdepok/,sabusaladbuahpremiumdepok,34,082123037320,b'sabusaladbuahDepokmampangSalad buah dengan kualitas premium!Outlet:mampang.Jln.pramuka rayaTerima pesanan (WA) 082123037320'
https://www.instagram.com/saladbuah23_/,saladbuah23_,275,089535537890,"b'Salad Buah DepokSaladbuah HomeMade Pabuaran Citayem 09.00-20.00 Wib Gosend,Cod,Kerumah 0895355378902#saladbuahfresh #saladbuahdepok #saladbuahbogor'"
https://www.instagram.com/saladbuahpremiumdepok/,saladbuahpremiumdepok,13,082123037320,b'Sabusaladbuahpremium DepokTerima pesanan.(wa) 082123037320'
https://www.instagram.com/dessert_ngeunah/,dessert_ngeunah,64,089690042033,"b'SALAD BUAH,BANOFFE,BACI DEPOKMADE WITH LOVE.Salad buahBanoffeeBaso aci garutLeuwinanggung,Tapos-DepokFast respon via WA : 089690042033'"
https://www.instagram.com/saladkuni/,saladkuni,234,089523989620,b'Salad Buah Premium DepokSaladkuni___________________________GoFood : Salad Kuni Jl. H. Narip No.19 MeruyungPat. Masjid Kubah Emas BCAWa : 0895-2398-9620Or Clickbit.ly/2yYeFnD'
https://www.instagram.com/misalad.depok/,misalad.depok,70,089580634295,b'Salad Buah Premium DepokSince 2019made by Love PO H-1Homemade | Fresh | Hygienic |   s GOSEND / Takeaway / CODWa : 0895806342957 or DM'
https://www.instagram.com/saladhomemade_/,saladhomemade_,90,089661443502,"b'Salad Buah Homemade Depok 100% halal, Hygienic & FreshFruit Sauce creamy Topping Keju Home Made 089661443502 (WA Only) Via Grab/Gojek ParungBingung,Depok'"
