https://www.instagram.com/azizahvictoryduasinga/,azizahvictoryduasinga,16,082335345085,b'azizahvictoryduasingaAzizah VictorysingaWa: 082335345085Shopee: victory2singa.officialTokped: victoryduasingaofficialFollowed by katering_sultan'
https://www.instagram.com/aleshashop2893/,aleshashop2893,225,085794616868,b'ALESHAshopFor order add Whatsup : 085794616868'
https://www.instagram.com/cemilangaluhenak/,cemilangaluhenak,15,082213353569,b'Real Account! Homemade cemilan enakkk dan bikin ketagihan lagi...lagii...lagiii pemesanan bisa dikirim atau COD lohhWA : 082213353569 & 087882356196 Followed by nasikuningsamarinda'
https://www.instagram.com/cemilangaluhenak/,cemilangaluhenak,15,082213353569,b'Real Account! Homemade cemilan enakkk dan bikin ketagihan lagi...lagii...lagiii pemesanan bisa dikirim atau COD lohhWA : 082213353569 & 087882356196 Followed by nasikuningsamarinda'
https://www.instagram.com/keday_momydy/,keday_momydy,39,085781458551,b'keday momydyfor order wa : 085781458551Followed by kedai_ateu'
https://www.instagram.com/rumahtisu33_/,rumahtisu33_,46,6281290641618,b'Rumahtisu33Menyediakan berbagai macam tisu grosir/ecer untuk keperluan : Rumah Kantor Toilet Restoran/Cafehttps://wa.me/6281290641618 Bekasi TimurFollowed by nasimandhiabah'
https://www.instagram.com/abi.ngemil/,abi.ngemil,222,082117961525,b'ABI.NGEMIL ~ Jajanan Cemilan~ Dimsum ~ Seafood ~ Roti ~ Fresh Milk ~ Via WA : 082117961525 Available On GOFOOD/GRABFOOD : DIMSUM ABI.NGEMIL'
https://www.instagram.com/dlimakitchen_bsd/,dlimakitchen_bsd,24,081283363987,"b'cakes, cookies, bento, pastaMother of 1 Home Made with OtodidakBukan Chef Made by premium ingredientsPRE - ORDERWA : 0812 83363987BSD - Tangsel'"
https://www.instagram.com/rafa_partners/,rafa_partners,85,081365531099,"b'Rafa & Partners Law FirmKonsultasikan masalah hukum keluarga anda dengan kami (gratis).Wa: 081365531099Email: info@rafa-law.comMenara 165, Lantai 4, Jakarta Selatanrafa-law.comFollowed by nasimandhiabah'"
https://www.instagram.com/pudikitchen/,pudikitchen,402,081398693961,b'Pudi KitchenMentai cooking & Contemporary FoodLocation : South Jakarta 081398693961Shopee/Toped : PudiKitchenAvailable at GoFood & GrabFoodgofood.link/a/yeLy3zA'
https://www.instagram.com/peekupmarket/,peekupmarket,100,081227600240,b'Peek Up MarketBazaar organizerContact usEmail : peekupmarket@gmail.comWa : 081227600240'
https://www.instagram.com/fluwelmarket/,fluwelmarket,553,081227600240,b'Fluwelmarket Jakarta selatan line : bungssWA: 081227600240 BCAtiki/jne/gosend'
https://www.instagram.com/upaupi.kiddo/,upaupi.kiddo,997,6282113204032,b'Upa Upi Kids StuffMenjual pakaian anak berkualitasPengiriman Senin - MingguInfo dan pemesanan +62 82113204032shopee.co.id/upaupi.kiddo'
https://www.instagram.com/rindubundo/,rindubundo,376,08111566500,b'Padang Resto & CoffeeRindu Masakan Padang di Jakarta ?.Rendang Rasa yang Tak Pernah Ada .Jl. Mangga Besar Raya No.30A.Order?Call or Wa 08111-566-500rindubundo.com'
https://www.instagram.com/abadi.soesman.official/,abadi.soesman.official,558,087823156608,b'Abadi Soesman OfficialCp: 087823156608www.youtube.com/channel/UC_udwqsiN1OSZCYgq3u6yuw/featured'
https://www.instagram.com/bakmijhon1/,bakmijhon1,72,081299129321,"b""BAKMI JHON CABANG PERTAMAThe Taste That You NeedWe're now on Go-FoodBakmi Jhon Sampit Melawai Pertama08129912932Jl. Sampit IV No.10, RT.4/RW.6Kramat Pela, Kebayoran Baru"""
https://www.instagram.com/tereskitchens/,tereskitchens,90,081291439993,b'Tere WulCooked w/  by @tere_wulanWA 081291439993/087775955906Delivery JKT by Gosend/Grab express/kurir exp. Delivery luar JKT by kurir express '
https://www.instagram.com/keikeu.cakes/,keikeu.cakes,20,08119308595,"b'Keikeu.cakesBy l.w.sBakery, Cake, BrowniesMade by OrderFor order: WA: 08119308595'"
https://www.instagram.com/international_melawai/,international_melawai,340,6281100549662,"b'International MelawaiLogam Mulia, Emas, Berlian Open : 10:30-18:00 WIB Melawai Plaza lt. I No. 275 FG Jakarta (021)7393457 WA : +62811005496, +6281295093200api.whatsapp.com/send?phone=6281295093200'"
https://www.instagram.com/gbhmelawai/,gbhmelawai,181,6281316027555,b'Golden Boutique Hotel MelawaiGolden Boutique Hotel Melawai The elegantly designed 4 star hotel.For Reservation and InformationCall : 62 021 7234 555WA : 62 813 1602 7555www.goldenboutiquemelawai.com'
https://www.instagram.com/gladiresikmusicstore/,gladiresikmusicstore,118,081294407675,"b'GML storeMusic, clothing, apparel & merchandiseJl Hanglekiu II No 10, Kebayoran Baru, Jakarta Selatan 12120Telp. 0812 9440 7675 / 0811 9912 122'"
https://www.instagram.com/aneka.tahu_paksuarnao/,aneka.tahu_paksuarnao,25,081511390167,b'aneka.tahu_paksuarnoPusat aneka tahu pak suarno ecer / bak 081511390167 jakarta baratJl .kemanggisan.pulo 05/17 no 95c( Harga kusus untuk pedagang )'
https://www.instagram.com/pcmsbintaro/,pcmsbintaro,43,085710455817,"b'Purwa Caraka BintaroRuko Victorian,Jl.Bintaro utama 3a blok a no.4 Bintaro sektor 3 - TangerangTelp : 021-73690057 & 021-7342630Hp : 085710455817'"
https://www.instagram.com/cosmic_customdesign/,cosmic_customdesign,180,087780237047,b'Custom Scuba Kaos SatuanCustom Masker Kaos MerchandisePO : 3 - 7 hariWa : 087780237047Klik below to order simpellink.com/cosmiccustomdesign'
https://www.instagram.com/sumberiramaofficial/,sumberiramaofficial,160,081893462908,"b'sumber irama storeIbanez MusicMan Korg Laney Vox tama sabian Jl. Pinangsia1, No.55 B-C, Jakarta Barat 0818 934 629 / 0815 829 8029 Klik for instant whatsappyukchat.us/distibahannadistributor'"
https://www.instagram.com/minangbravo/,minangbravo,808,081212136929,b'MINANG BRAVO - Kencana LokaMasakan Padang.Jl. Wana Kencana Blok J1 No. 10Kencana Loka Sektor 12.3Tangerang Selatan 15318.Tel. 0812-1213-6929.Delivery / Grabfood / Gofood'
https://www.instagram.com/inrockwetrust_rockers/,inrockwetrust_rockers,112,081290538143,b'inrockwetrustCloth rumahan | @jabogar_rock merchendize | @jabogar management | Spotify : #jabogar | cp : 081290538143 | FB : Jabogar | rockjabogar@gmail.comjabogar.bandcamp.com/track/bucin-alias-budak-cinta'
https://www.instagram.com/sumberiramainstrument/,sumberiramainstrument,76,081893462908,"b'Sumber Irama Instrument Jl. Pinangsia1, No.55 B-C, Jakarta Barat 0818 934 629 / 0815 829 8029 Klik for instant whatsappyukchat.us/distibahannadistributor'"
https://www.instagram.com/sumberiramasound/,sumberiramasound,82,081893462908,"b'Sumber Irama Sound Jl. Pinangsia1, No.55 B-C, Jakarta Barat 0818 934 629 / 0815 829 8029 Klik for instant whatsappyukchat.us/distibahannadistributor'"
https://www.instagram.com/ahmadguitarzan/,ahmadguitarzan,427,6282298798736,b'AhmadGuitarzanSession Gitar PlayerCp : +6282298798736 (WhatsApp Only)My Cover guitar available on youtube chanelyoutu.be/Xwdtg-YsXME'
https://www.instagram.com/i.x_official/,i.x_official,475,081292415161,b'I.X BAND  I.X - Soul Vigor Booking Contact: 081292415161Single Video  [ SOUL VIGOR ]youtu.be/KUFelSRu0uQ'
https://www.instagram.com/fitriautami_ai/,fitriautami_ai,966,081219702113,b'P I P I E T Jakarta selatanTravelling and cookingWA :081219702113Owner @hauranawa.sushiMY YOUTUBE open this Linkyoutu.be/UD0kQdHspxo'
https://www.instagram.com/cemilangaluhenak/,cemilangaluhenak,15,082213353569,b'Real Account! Homemade cemilan enakkk dan bikin ketagihan lagi...lagii...lagiii pemesanan bisa dikirim atau COD lohhWA : 082213353569 & 087882356196 Followed by nasikuningsamarinda'
https://www.instagram.com/abi.ngemil/,abi.ngemil,222,082117961525,b'ABI.NGEMIL ~ Jajanan Cemilan~ Dimsum ~ Seafood ~ Roti ~ Fresh Milk ~ Via WA : 082117961525 Available On GOFOOD/GRABFOOD : DIMSUM ABI.NGEMIL'
https://www.instagram.com/azizahvictoryduasinga/,azizahvictoryduasinga,15,082335345085,b'azizahvictoryduasingaAzizah VictorysingaWa: 082335345085Shopee: victory2singa.officialTokped: victoryduasingaofficialFollowed by katering_sultan'
https://www.instagram.com/jesie.muse/,jesie.muse,26,085693680643,"b'Model Freelace JakartaJasa Model Make Up, Hair Do, Hijab Do, Fashion, Fotoshoot, Dll@jesiscajee18 Years OldTB 155cm BB 43KgWa 085693680643 (NoCall!)Jakarta Selatan'"
https://www.instagram.com/preloved.sise/,preloved.sise,271,085693680643,"b'Preloved Second Star 5kBy @jesiscajeeDm/Wa: 085693680643 (NoCall!)*Happy Shopping  AYO DIBELI!: COD, Grab, Go Send, Tiki'"
https://www.instagram.com/keday_momydy/,keday_momydy,39,085781458551,b'keday momydyfor order wa : 085781458551Followed by kedai_ateu'
https://www.instagram.com/abi.ngemil/,abi.ngemil,223,082117961525,b'ABI.NGEMIL ~ Jajanan Cemilan~ Dimsum ~ Seafood ~ Roti ~ Fresh Milk ~ Via WA : 082117961525 Available On GOFOOD/GRABFOOD : DIMSUM ABI.NGEMIL'
https://www.instagram.com/azizahvictoryduasinga/,azizahvictoryduasinga,15,082335345085,b'azizahvictoryduasingaAzizah VictorysingaWa: 082335345085Shopee: victory2singa.officialTokped: victoryduasingaofficialFollowed by katering_sultan'
https://www.instagram.com/cemilangaluhenak/,cemilangaluhenak,15,082213353569,b'Real Account! Homemade cemilan enakkk dan bikin ketagihan lagi...lagii...lagiii pemesanan bisa dikirim atau COD lohhWA : 082213353569 & 087882356196 Followed by nasikuningsamarinda'
https://www.instagram.com/apriljasmine_lemon_tulungagung/,apriljasmine_lemon_tulungagung,6,087770464195,b'apriljasmine_lemon_tulungagungWelcome resellerWelcome dropshipWelcome agenWa 0877-7046-4195Followed by 99frozenfood'
https://www.instagram.com/keday_momydy/,keday_momydy,39,085781458551,b'keday momydyfor order wa : 085781458551Followed by kedai_ateu'
https://www.instagram.com/abi.ngemil/,abi.ngemil,223,082117961525,b'ABI.NGEMIL ~ Jajanan Cemilan~ Dimsum ~ Seafood ~ Roti ~ Fresh Milk ~ Via WA : 082117961525 Available On GOFOOD/GRABFOOD : DIMSUM ABI.NGEMIL'
https://www.instagram.com/azizahvictoryduasinga/,azizahvictoryduasinga,15,082335345085,b'azizahvictoryduasingaAzizah VictorysingaWa: 082335345085Shopee: victory2singa.officialTokped: victoryduasingaofficialFollowed by katering_sultan'
https://www.instagram.com/cemilangaluhenak/,cemilangaluhenak,15,082213353569,b'Real Account! Homemade cemilan enakkk dan bikin ketagihan lagi...lagii...lagiii pemesanan bisa dikirim atau COD lohhWA : 082213353569 & 087882356196 Followed by nasikuningsamarinda'
https://www.instagram.com/apriljasmine_lemon_tulungagung/,apriljasmine_lemon_tulungagung,6,087770464195,b'apriljasmine_lemon_tulungagungWelcome resellerWelcome dropshipWelcome agenWa 0877-7046-4195Followed by 99frozenfood'
https://www.instagram.com/reseputi.lpg/,reseputi.lpg,59,083863212334,b'Hampers Mendoan LampungPart of @mendoan1.jktMendoan asli Toko Oleh-oleh Sawangan no 1 PurwokertoPreOrder Bandar LampungBoost ur mood with ImoodrinkWA : 083863212334'
https://www.instagram.com/rn.laksana/,rn.laksana,164,087826968448,b'RN LAKSANANEW BRAND NEW TASTESNACK & FOOD KEKINIAN PENDAMPING KEBAPERAN YG HQQ Order?DM atau chatt Iyang - 087826968448 (WA ONLY)'
https://www.instagram.com/rumahproduksiestu/,rumahproduksiestu,128,083863899143,"b'Rumah Produksi ""S1""Pusat Oleh Oleh Khas Banyumas083863899143/0281639392Jl. Letjend Soetoyo No 23 Purwokerto'"
https://www.instagram.com/dapur.terazza/,dapur.terazza,127,081398106035,"b'Ayam Geprek, Brownies, Cake.Since Nov 2017Terima Pesanan min 25 box mulai dari 20rb/box, pemesanan h-3PEMESANAN BISA MELALUI WA 081398106035'"
https://www.instagram.com/draw.a.cake/,draw.a.cake,926,089680000146,b'Custom Cake/Cupcake TangerangDelivery / Pick up di rumah Draw a Cake *Boleh DM atau WA: 0896 80000 146'
https://www.instagram.com/endahkristianingrum/,endahkristianingrum,170,081382039265,b'Endah KristianingrumPemesanan WA = 081382039265Daerah Halim Jakarta Timur dan sekitarnyapesan.link/endahcake'
https://www.instagram.com/nuryati.s9/,nuryati.s9,107,081293540418,"b'Nuryati.sJln Pertengahan Gang.Mede Rt001/03 No.21 Kel Cijantung, Psr Rebo Jaktim 081293540418 / Citra Indah City, Jln Raya Jonggol Cilengsi Bogor Jabar'"
https://www.instagram.com/makembar12/,makembar12,177,6289632547326,b'Bawang Goreng Original/PedasBismillah100 % Bawang Merah Tanpa Tepung Tanpa Pengawet Tanpa MSGLezat - Gurih - Renyah Homemadehttps://wa.me/6289632547326'
https://www.instagram.com/pempekmima/,pempekmima,299,081382299919,"b'Pempek Ikan TenggiriPempek dan tekwan Gosend, Grabexpress, JNE - YES Gofood, Grabfood, Bukalapak, Tokopedia, Shopee BCA, BNI 0813-8229-9919'"
https://www.instagram.com/kelaskursusjakarta/,kelaskursusjakarta,860,081382332193,b'Kelas Kursus Jakarta TimurPONDOK KELAPA JAKARTA TIMURMau belajar.. Mau Bisa.. Mau Jualan..Yuk daftar ...Register & PERTANYAAN HANYA LEWAT WA 081382332193'
https://www.instagram.com/laryskitchen_bylilis/,laryskitchen_bylilis,801,6287880000423,"b"" Made by The Order Only . Lary's Kitchen Puding Art | Danish Pastry.Jatinegara ~ Jakarta Timur. Agen LUNA Lemon Jakarta Menjual 100% Lemon Aseli  Brand LUNA.wa.me/6287880000423"""
https://www.instagram.com/toembasbylyza/,toembasbylyza,201,087882695468,b'Liza.FitrianiInsyaa Allah HalalMade by order with WA only : 0878 8269 5468Bogor Raya ResidenceBogor UtaraGo send'
https://www.instagram.com/ala_abata/,ala_abata,163,628161922811,b'@ala_abataproduk roti dan cemilan buatan ibuk mima @primaningrumwa.me/628161922811'
https://www.instagram.com/tungkusaya/,tungkusaya,101,08129989596,"b'Shanty GanosaNasi Tim, Toge Goreng, Nasi Bakar dan aneka kueOrder : 08129989596 (WA only)Thanks for Follow, like n orderpesan.link/nasitim'"
https://www.instagram.com/lilawilyana/,lilawilyana,461,087884040458,"b'lilawilyana""Just sharing what I love""Homemade with love cakes & cookiesWA only 087884040458Thanks for likes & follows ya'"
https://www.instagram.com/narninurn/,narninurn,183,085891231544,b'NARCHI cake n cookiesTo fast respon please add Whatsapp 085891231544'
https://www.instagram.com/lisa_dessert2/,lisa_dessert2,257,081619464574,b'lisa_dessert2Wa : 08161946457Pemesanan minimal -4Lokasi Jakarta UtaraNasi kuningLasagnaMakaroniKlapertartSnack boxKaree jalaDonatMinumanJastip impor'
https://www.instagram.com/cakededali/,cakededali,133,081372867206,b'Dedali cake and cookiesAneka Brownies panggang/kukusMacaroni schotel ikan dori / daging /ayamAneka Kue kering/basahSambel baby cumi/kecombrang/roa/cabe ijo0813-7286-7206'
https://www.instagram.com/ike_boga/,ike_boga,103,0817290976,"b'ikeCatering, Snacks,and cookiesWe serve and bake with LoveFor order via wa / call 0817290976Cinere-Depok'"
https://www.instagram.com/sticksidiah/,sticksidiah,181,082311484343,"b'siti diah farida pSidiah Stick Keju, Sidiah Stick Bawang, Sidiah Stick KentangFast Respon : (WA) 082311484343ODER SEKARANG YUK!wa.me/6282311484343'"
https://www.instagram.com/chatlea.collection/,chatlea.collection,77,081317888438,"b'chatlea collection 0813-1788-8438 (wa Only) bekasi utaraSedia baju adat, baju profesi dan aksesoris tari'"
https://www.instagram.com/qaykounkitchen/,qaykounkitchen,416,081884909233,"b""Qaykoun's KitchenHome Baker at Qaykoun KitchenOrder contact WA 0818 84 9092PO dibuka hari Selasa - Jum'atPengiriman hari Senin#qaykounkitchen#browniesyammychat.whatsapp.com/CCaCnSJgPe33j48ZN20Wby"""
https://www.instagram.com/vircoan/,vircoan,366,087734189399,"b'LAMPUKITAProduced VCO Premium Class in Jakarta, Indonesia.Please contact:WA 087734189399vircoan.blogspot.com'"
https://www.instagram.com/alldarkitchen/,alldarkitchen,158,081517220629,b'alldar kitchenMenjual kue & rotiMenerima pesanan snak box dan catringNo tlp:081517220629:082114704005Intagram :DmPemesana bisa melewati:wa:Dm'
https://www.instagram.com/adhelovejell/,adhelovejell,114,089538515414,b'LOVEJELLLovejell.. minuman kekinian..Wa.0895385154140Welcome reseller'
https://www.instagram.com/ariesetiadi1980/,ariesetiadi1980,118,6287881756179,"b'DapoerF4 SnackfoodMenjual & Menerima PesananansnackBox dan NasiBox  & Aneka kue Brownies, PieBrownies,Caketape pembayaran  :BCA,MANDIRI,DKIKirimGosendwa.me/6287881756179'"
https://www.instagram.com/d_arfini/,d_arfini,99,087887408440,"b""D'arfini bakery & cookiesterima pesanan snack box ,nasi bakar ,,tape uli dllwa 0878 8740 8440"""
https://www.instagram.com/dapoerpinang/,dapoerpinang,99,089627918665,"b'dapoerpinang@gmail.com makanan sehat &bergizi Zuppa soup, macaroni schotel, salad buah, silkypuding WA 089627918665bit.ly/2H5zzFr'"
https://www.instagram.com/mak_goring/,mak_goring,120,085752115711,"b'""KENTANG MUSTOFA""Kentang mustofa variant rasa Halal Tanpa Bahan Pengawet HomemadeOriginal-Pedas/Pedas Sedang..DLL 085752115711 JakartaJNE/GOJEK/JNwa.me/6285752115711'"
https://www.instagram.com/oleholehbangzazri/,oleholehbangzazri,143,085109028711,"b'Oleh Oleh Khas BetawiEncang Encing Nyak Babeh Mpok Abang nyok beli oleh2 dr kite, smuenye khas BetawiBETAWI PUNYE GAYEEEE 085109028711 (Zazri) 085100101675 (Yana)www.oleholehbangzazri.com'"
https://www.instagram.com/dapurtehtety/,dapurtehtety,202,087889998113,b'Dapur Teh Tety Menerima Pemesanan Nasi Box & Produk Frozen Food Usaha Mikro Kecil Menengah (UMKM) 0878-8999-8113 100% Halal bersertifikat'
https://www.instagram.com/nafnablemonic/,nafnablemonic,278,081574403900,b'nafnab lemonic#minumansehat wa 081574403900shopee.co.id/bunda_nafnab/2603777630'
https://www.instagram.com/rafisnack/,rafisnack,261,085692618843,b'RAFI SNACKMinat? hubungi : 085692618843'
https://www.instagram.com/trylicious_id/,trylicious_id,129,081296806556,b'trylicious officialDiproduksi oleh try_cemilan#trycemilanMade by @triyunita_sWa. 081296806556Berbelanja via shopee klikshopee.co.id/triyunita3.'
https://www.instagram.com/utarisuzanbalqis/,utarisuzanbalqis,726,6281808285802,b'utarisuzanbalqiskacamata k-ionBuku Sygma&alqolamDlemonie sari lemonbolubatikgulungeskrim dan aneka frozen foodJakarta selatan wa.me/+6281808285802tokopedia.link/sCoc/sfaW0Q25LJ'
https://www.instagram.com/rumahrempahnoni/,rumahrempahnoni,233,62818707779,b'Rumah RempahIndonesian Spices for Your Kitchenwa.me/62818707779Followed by kolangkalingenyak'
https://www.instagram.com/sadiahtalithaaa/,sadiahtalithaaa,502,081296736068,"b""DiFaYaNa'S CakesMenerima pesanan :-Brownies-Kue Ulang Tahun-Aneka Puding-Snack Box-Nasi Tumpeng-ParcelOrder disini : 081296736068bit.ly/2mue7Tv"""
https://www.instagram.com/dapoerf4arie/,dapoerf4arie,630,6287881756179,"b'MamaArieF4Menjual & Menerima Pesananan:snackBox &NasiBox & Aneka kue Brownies, PieBrownies,Caketape pembayaran :BCA/MANDIRI/DKIKirim:Gosendwa.me/6287881756179'"
https://www.instagram.com/kartonbox_dalian/,kartonbox_dalian,548,081290537780,"b'karton box packaging DalianPackaging Karton boxlokasi : Depok , Jawa BaratTlp/WA : 081290537780'"
https://www.instagram.com/cemilangaluhenak/,cemilangaluhenak,15,082213353569,b'Real Account! Homemade cemilan enakkk dan bikin ketagihan lagi...lagii...lagiii pemesanan bisa dikirim atau COD lohhWA : 082213353569 & 087882356196 Followed by nasikuningsamarinda'
https://www.instagram.com/abi.ngemil/,abi.ngemil,222,082117961525,b'ABI.NGEMIL ~ Jajanan Cemilan~ Dimsum ~ Seafood ~ Roti ~ Fresh Milk ~ Via WA : 082117961525 Available On GOFOOD/GRABFOOD : DIMSUM ABI.NGEMIL'
https://www.instagram.com/keday_momydy/,keday_momydy,39,085781458551,b'keday momydyfor order wa : 085781458551Followed by kedai_ateu'
https://www.instagram.com/azizahvictoryduasinga/,azizahvictoryduasinga,15,082335345085,b'azizahvictoryduasingaAzizah VictorysingaWa: 082335345085Shopee: victory2singa.officialTokped: victoryduasingaofficialFollowed by katering_sultan'
https://www.instagram.com/nasi_kebuli_betawi/,nasi_kebuli_betawi,333,0811163234,b'irma ameliaNasi kebuli betawiFor order contact Wa. 0811163234Jakarta'
https://www.instagram.com/yuna_imyuna/,yuna_imyuna,270,089533576340,b'Vens Kitchen BaruCek juga ya album kue buatanku di ig yg lama .D/h.Dinadwisetyorini.Fb.Vens KitchenWa.0895335763401'
https://www.instagram.com/gallery_adiba/,gallery_adiba,963,089685193891,"b'PUSAT GROSIR ADIBA (PGA)Info Order/pertanyaan : :0896_8519_3891(WA) :Gallery adiba(Tokopedia)wahana ,j&t ,jne ,tikishopee.co.id/galleryadiba?smtt=0.0.9'"
https://www.instagram.com/jaliasmar/,jaliasmar,700,08567974000,b'Micky JaliasmarCatetan traveling bersama @yulianialmalitawa/telp : 08567974000support by : semurtahuphotograph : hayomoto : pregret'
https://www.instagram.com/dapurbetawimimi/,dapurbetawimimi,291,081381816976,"b'ANEKA MACAM LAUK PAUKANEKA LAUK PAUK KHAS BETAWIMenerima pesanan catering,acara dll duren sawit - BKT senin-sabtuFor order whatsap : 081381816976Order klik dibwhapi.whatsapp.com/send?phone=6281381816976&text=mauorder'"
https://www.instagram.com/opiskebab/,opiskebab,600,6281901014141,"b'Opi\'s Kebab, we SERVE the BESTPure Beef,Chicken,Tuna dllGO-FOOD,TAKE AWAY ""ONLY""CATERING.NO MSG,HALAL%Monday-Thrusday:10:30-21:00Friday-Sunday:10:30-22:00 62-819-0101-4141'"
https://www.instagram.com/aniissa_olshop/,aniissa_olshop,492,081239238927,"b'olshop aniisaAniisa OlshopBismillahGamis Syari, Dress, Tunik, Sepatu Bara""WELCOME RESELLER#WA : 081239238927Via JNE, TIKI & SICEPATcek DM tuk Order & Tanya""'"
https://www.instagram.com/ach_ramdhani/,ach_ramdhani,445,085732485483,"b""Achmad RamdhaniBerusaha dan Berdo'a@drinkel_ar Minuman Kekinian (TERSEDIA-Kopi, Teh, Susu dan Soda).0857.3248.5483AR"""
https://www.instagram.com/leche_id/,leche_id,65,6288102574341,b'LECHE | SpaghettiBruleeLimited Slots OnlyOpen Pre-order by WADelivery : MingguClick below to order wa.me/62881025743419'
https://www.instagram.com/leche_id/,leche_id,65,6288102574341,b'LECHE | SpaghettiBruleeLimited Slots OnlyOpen Pre-order by WADelivery : MingguClick below to order wa.me/62881025743419'
https://www.instagram.com/putricatering.id/,putricatering.id,6,085715038085,"b'Putri Food & Catering Jasa Catering untuk Berbagai AcaraDikelola oleh Mahasiswa Gizi Dijamin Sehat & MurahBekasi, Indonesia 085715038085 For PROMO&Pricelist!!!'"
https://www.instagram.com/kerajinanbambucimahi/,kerajinanbambucimahi,14,081298949802,b'Kerajinan bambu cimahimenerima pembuatan-produk bambu laminasi-keranjang parcel-packaging dll-custom produkcp:081298949802Followed by katering_sultan'
https://www.instagram.com/azizahvictoryduasinga/,azizahvictoryduasinga,15,082335345085,b'azizahvictoryduasingaAzizah VictorysingaWa: 082335345085Shopee: victory2singa.officialTokped: victoryduasingaofficialFollowed by katering_sultan'
https://www.instagram.com/apriljasmine_lemon_tulungagung/,apriljasmine_lemon_tulungagung,7,087770464195,b'apriljasmine_lemon_tulungagungWelcome resellerWelcome dropshipWelcome agenWa 0877-7046-4195Followed by 99frozenfood'
https://www.instagram.com/l.y.collection83/,l.y.collection83,228,081263007553,b'L.Y.collectionOrder via: Dm Wa : 081263007553 Tokped: fashion ly% kualitas import'
https://www.instagram.com/tntbags_andsouvenir/,tntbags_andsouvenir,480,085642706271,"b'grosir tas,dompet batik,grosirPlease feel free contact us, WA 085642706271/ 08558757405 (Fast Response)Or you might also order via Tokopedia, Happy Shopping '"
https://www.instagram.com/event_photo_vidiografy/,event_photo_vidiografy,672,085778486654,b'event_photo_vidiografyWedding.. Pre wedding.. All moment@DR PHOTOGRAPHY call 085778486654Info chat WA'
https://www.instagram.com/eo_bazaarjakarta/,eo_bazaarjakarta,523,08161462254,"b'Jadwal Bazaar jakarta (Winter)PT. Martiro Karya indotamaJadwal bazaar :Plaza uob 30,31maret - 01 april 2020festival palang pintu 04-05 april 2020|Info: 08161462254- Whatsappwww.haievent.com/bazaar-walikota-winter-martiro'"
https://www.instagram.com/omahsnack_lusi/,omahsnack_lusi,43,085287111491,"b'OMAH SNACK BY LUSImau cemilan uenak?KINI HADIR OMAH SNACK!! OMAH E JAJANAN YANG UENAK E PUOLDepok, Margondafor thru order : via dm dan wa (085287111491)MONGGO'"
https://www.instagram.com/kindalittleshop/,kindalittleshop,19,087876062333,b'bennayaMenjual perlengkapan wanita dan priaTasJam tanganBajuMakeupDllUntuk wa hubungi 087876062333'
https://www.instagram.com/teguh_furniturejepara/,teguh_furniturejepara,387,082325879321,b'DwiTeguhRaharjoBismillah Open OrderSedia furniture jepara yang berkualitas oke BRI a.n Dwi Teguh Raharjojepara-jawa tegahfb.Dwi teguhWA. 082325879321'
https://www.instagram.com/maswidoyoshop/,maswidoyoshop,792,6281908166072,"b'Mas Widoyo shopRitel & belanjaMelayani kebutuhan rumah tangga, Fashion,Kuliner, Furniture dan Alat musik.wa.me/c/6281908166072'"
https://www.instagram.com/ace_rawamangun/,ace_rawamangun,316,082122276363,b'ACE HARDWARE RAWAMANGUN PEMUDAThe biggest hardware store and home improvement lifestyle in Indonesia.Info location: Jl Pemuda no 66-67Telp : 021-47866868WA : 0821-2227-6363acehardware.co.id'
https://www.instagram.com/infokemayoran/,infokemayoran,433,6289519778321,b'infokemayoranInformasi wilayah kemayoran & sekitarnyapunya informasi menarik & bermanfaat ?tag #infokemayoranBersama membangun kebaikan www.infokemayoran.comapi.whatsapp.com/send?phone=6289519778321'
https://www.instagram.com/busana_muslim_2020/,busana_muslim_2020,60,081380105558,b'busana muslimMenjual berbagai macam busana muslim- Peci- Sarung- Sajadah- Baju kokoh- TasbihTRUSTED SELLER !Eceran&Grosir09.00-15.00 : 081380105558'
https://www.instagram.com/kursusbahasaarabdalwa/,kursusbahasaarabdalwa,241,6287777575514,b'Dalwa Center JakartaIttishal Rijaal: Ust.Hafid Attamiimy +62 877-7757-5514Ust.Tholhah +6282119209768Nisa:Ustz Hasanah +6287822052982'
https://www.instagram.com/satomotor.id/,satomotor.id,103,080017009075,b'Sato Motor#jualbelimotor Bekas berkualitas Kondisi motor sangat mulus Bergaransi 3 bln/3.000 km08.00 - 17.00 setiap hariCek harga & stok di katalog OLXm.olx.co.id/profil/?user_id=90753058'
https://www.instagram.com/afwindimsum/,afwindimsum,209,085810645467,"b'halal, enak, higienis High Quality Home Made Jl. raya cilandak kko, jaksel Terima Pesanan, Hajatan, dll Reseller Welcome 085810645467afwindimsum.bussiness.site'"
https://www.instagram.com/nyonyadimsum/,nyonyadimsum,361,082110001070,"b'Appetizer/Snack Made with Love (Frozen Dimsum) Homemade, Halal Dimsum, Tanpa MSG & Pengawet Everyday Delivery Jakarta & Bekasi 0821-1000-1070 (WA only)'"
